,company_name,job_summary,job_title,City,State
0,The David Round Company,"Recommends data changes regarding lead times, minimum balances, lot sizes, and order policy coding relative to scheduling area. 401k plan with employer match.",Plant Engineer (Local Candidates only),Streetsboro, OH
1,EXAL Corporation,"Rigorously use data and performance metrics to break down functional barriers. The Continuous Improvement Engineer will lead operational excellence projects,…",Continuous Improvement Engineer,Youngstown, OH
2,Procter & Gamble,"Performing data discovery to understand data sources. You will work with data analysts and data scientists to understand business needs, data needs, and outcome…",IT-Data Wrangler,Cincinnati, OH
3,Inspection Engineering,"Document control to record data. Looking for extraordinary people to join our team at Inspection Engineering; Family-owned, great work life balance!_*.",Quality Engineer,Westlake, OH
4,Mphasis,"Understanding of data management including recovery, security and monitoring. Experience with working ETL platforms such as Data stage is desirable.",Data Engineer USA,United States,
5,QP Manufacturing,Screw Machine Lead & Process Engineer*. Reviews data to determine material and labor requirements and prepares itemized lists.,Screw Machine Lead & Process Engineer,Chardon, OH
6,Confidential,Data analysis and using statistical tools. Serve as an authority in data analysis and statistical tools. Share expertise and make recommendations as a part of a…,Manufacturing Process Engineer,Mentor, OH
7,"Honda R&D Americas, Inc.",Apply data quality checks using data mining and data analysis. Ensure data quality and data management. Ensure strong understanding of data change requirements…,Material Handling Data Engineer,Marysville, OH
8,"Applied Medical Technology, Inc.","Material characterization techniques and data interpretation. Ability to define problems, collect data, establish facts, and draw valid conclusions.",Polymer Engineer/Scientist,Brecksville, OH
9,Diebold Nixdorf,Properly handling company data and property. A Data Development Engineer Associate with Diebold Nixdorf’s Service Organization will contribute to the design and…,Associate Data Development Engineer,North Canton, OH
10,Sierra Lobo,"The data engineer is the liaison between the test customer, electrical/instrumentation engineers and the data acquisition system programmer.",Data Engineer,Cleveland, OH
11,"Kennametal, Inc.",Data anaylsis and related software (i.e. Experience as an equipment engineer or field service engineering professional who is highly effective working in a team…,Manufacturing Engineer - PVD Coatings,Orwell, OH
12,State of Ohio Jobs,Coordinates the collection of other data related to treatment plant performance. Reviews IU self -monitoring data and POTW reports for compliance with…,Environmental Specialist 2 (20044660),Twinsburg, OH
13,Hose Master,Control the performance data and product manufacturing tolerances. Maintain and update product data and test records. Conduct and document product testing.,Product Analysis Engineer,Cleveland, OH
14,Kroger General Office,"Data warehousing, big data management, analytics development, data science, application programming interfaces (APIs), data integration, cloud, servers and…",Data Engineer,Blue Ash, OH
15,The J. M. Smucker Company,1+ years in a Data Engineer / System Architect / DevOps role. Determine best practices for acquiring the data necessary for analyses and curate run-model ETL…,Data Engineer,Akron, OH
16,Verizon,"Voice cells infrastructure experience, such as Lucent, Motorola, Ericsson, LTE, or CDMA data. Training in data communications, digital communications, operating…",Cell Site Engineer,Warrensville Heights, OH
17,Ameritas,Ameritas Investment Partners is seeking a Investments Data Engineer Intern. Understands foundational concepts of data development and operational procedures…,AIP Intern-Investment Data Engineer,Cincinnati, OH
18,Keystone Technology Consultants,Microsoft Certified System Engineer (MCSE); Is now seeking to hire a Support Engineer. Objectives of the role of Support Engineer*.,Support Engineer,Akron, OH
19,Moen,Provide and maintain packaging information to insure accurate data is available to Moen customers. Moen has a new opening for a Packaging Engineer to join our…,Packaging Engineer,Cleveland, OH
20,Knight Global / Knight Ergonomics,Advantages of a Knight Sales Engineer. The Role of a Knight Sales Engineer. Support the Design staff by continuously providing essential data when requested.,Sales Engineer,Cleveland, OH
21,R+L Carriers,"Provide mentoring to junior engineers supporting the data network. R+L Carriers is expanding its Information Technology Department in Wilmington, Ohio, and has…",Network Engineer,Wilmington, OH
22,Tronair,"Must be proficient in managing, organizing, and maintaining large quantities of data. Analyze data to develop new system designs using motors, brakes, pumps,…",Mobile Equipment Systems Engineer,Swanton, OH
23,Everest Technologies,"The data engineer is responsible for data profiling, analysis and extraction of data in the process of constructing data products. Retail experience is a plus.",Data Integration Engineer,Columbus, OH
24,Emerald Resource Group,SQL Server Developer and Engineer*. Experience working with ETL and Data Warehouse solutions is a must. You must have 3 years minimum experience working with…,SQL Developer and Engineer,Cleveland, OH
25,Onix Networking Corp,Google Certification - Professional Data Engineer. Bring together multiple data sources into a unified data warehouse. Some travel to client locations.,Data Engineer,Lakewood, OH
26,Giesecke & Devrient,"Is seeking a Lean Engineer to join our growing team in Twinsburg, OH. Must possess the ability to understand complex data driven technical processes and…",Lean Engineer,Twinsburg, OH
27,"BGI, LLC","Leverage data aggregation, statistical analysis, and data mining algorithms. As a Data Science Software Engineer, you will apply algorithms to heterogeneous…",Data Science Software Engineer - Entry Level,Akron, OH
28,"Affinity, Inc.","In this role, you will be joining our enterprise data protection and storage support team, as the primary Data Protection Engineer working directly with one of…",Data Protection Engineer,Cleveland, OH
29,Google,We're proud to be our engineers' engineers and love voiding warranties by taking things apart so we can rebuild them.,Data Center Facilities Technician,New Albany, OH
30,Goodyear,Strong communication skills [written/oral] in presenting data and information to others. This position is responsible for development of projects with moderate…,ENGINEER - ENGINEERING MECHANICS 1,Akron, OH
31,"Applied Medical Technology, Inc.","Ability to define problems, collect data, establish facts, and draw valid conclusions. As a Materials Engineer, you will be responsible for creating, monitoring…",Materials Engineer,Brecksville, OH
32,Facebook,Facebook is seeking a forward thinking experienced Engineer to join the Capacity team within Data Center Operations. Participate in an on-call rotation.,Data Center Capacity Engineer,New Albany, OH
33,Electrical Power and Safety Company,Our Engineering firm is excited to add 2-3 hardworking & fun individuals to our team! To get to know a little more about our company feel free to check out the…,Power Systems Engineer,Cleveland, OH
34,Lubrizol Corporation,"The Strategic Research group is a global multidisciplinary team of chemical engineers, mechanical engineers, physicists and chemists who are accountable for…",Thermal & Fluid Research Engineer,Wickliffe, OH
35,Murrplastik Systems Inc,"Collect and analyze data for process improvement. Ability to positively interact with internal and external customers, engineers and other skilled trades.",Applications Engineer,Cincinnati, OH
36,Dowa THT America,"Provides data analysis to support recommendations; Dowa THT America, Inc., a leader in heat treatment technologies, seeks a Process Engineer*.",Process Engineer,Bowling Green, OH
37,Ameritas,"Ameritas Life Insurance Corp is seeking a Data Engineer Intern In this role, you will be responsible for contributing to data development and operational…",Data Engineer Intern,Cincinnati, OH
38,"InSource Technologies, Inc.","Review manufacturer's data sheets for component interface & compatibility. An Embedded Hardware Engineer performs the design, layout, testing, and validation of…",Embedded Hardware Engineer,Paulding, OH
39,Confidential,"Leading complex, medium to large scale network implementation projects including LAN, WAN and Data Center architectures. Motivated to meet deadlines on time.",Infrastructure Engineer - Mid-Senior Level,Wickliffe, OH
40,"C2P Enterprises, LLC",Debugging and Optimization of data problems and building data processes that maximize data integrity and usability.,Database Engineer,Westlake, OH
41,Cardinal Health,"Data Analytics Engineer is responsible for understanding, preparing, processing and analyzing data to make data valuable and useful for operations decision…",Data Engineer -- Data Curation,Dublin, OH
42,"OverDrive, Inc.","We’ve adopted other data stores to deal with issues of scale and performance, and to better fit our evolving data models. Work on small projects independently;",Developer I (Software Engineer I),Cleveland, OH
43,American Greetings,"The Data Engineer will support our database architects, data analysts, and data scientists on data initiatives and will ensure optimal data delivery…",Data Engineer,Westlake, OH
44,Goodyear,Work closely with other data scientists to scale up platforms for Big Data across diverse business and manufacturing applications. Ability to convince and lead;,Staff Data Engineer,Akron, OH
45,"Amazon.com Services, Inc.",We are currently seeking an energetic Data Center Project Engineer to serve as a technical resource within Amazon data centers. You think and act globally;,Data Center Project Engineer(Critical Infrastructure),Dublin, OH
46,"Kennametal, Inc.","Data anaylsis and related software (i.e. Manufacturing Engineer, CVD Coating Engineer is responsible for all engineering related aspects of Chemical Vapor…",Manufacturing Engineer - CVD Coatings,Orwell, OH
47,Myriad Genetics,"As an Enterprise Data management (EDM) Data Engineer, you will work alongside a team of Business Intelligence (BI) Analysts to support data acquisition,…",(MW) Data Engineer,Mason, OH
48,Dana Corp.,Write/present reports of test results to internal Application Engineers or others responsible for the program and customers.,NVH Engineer,Ohio,
49,Alpha Technologies Services LLC,"Hands-on experience with testing equipment, data acquisition, data analysis, report preparation and troubleshooting preferred. MS Word and MS PowerPoint).",Applications Engineer,Hudson, OH
50,Cardinal Health,"Data Analytics Engineer is responsible for understanding, preparing, processing and analyzing data to make data valuable and useful for operations decision…",Data Engineer -- Tabular Model,Dublin, OH
51,Emerson,Improve documentation of business logic used within our MFG Data and Data Analytics systems; Work closely with internal MFG customers to understand MFG Data and…,Sr. Manufacturing Software Engineer,Sidney, OH
52,Pythian,"Warehousing, data marts, data lakes). Experience in data management best practices, real-time and batch data integration, and data rationalization.",Big Data Engineer,United States,
53,Technical Assurance,"License Professional Engineer (PE) (Preferred). Technically competent with field data collection tools. Structural Engineer - TechnicalAssurance Inc.*, a…",Structural Engineer,Willoughby, OH
54,Jobot,We are looking for a data engineer to join our team of software engineers that support this e-commerce business unit. What you will be doing:,Data Engineer,Solon, OH
55,Comet Group,We take data protection seriously. The processing of your data complies with general data security standards based on the latest technology.,Applications Engineer,Hudson, OH
56,The Timken Company,"Knowledge of grinding cycle design and optimization, technical support/problem-solving through process development, process modeling, and data analysis skills…",Senior Grinding Process Engineer,North Canton, OH
57,"Honda R&D Americas, Inc.","Data Analytics Engineers are able to summarize and evaluate market data, make conclusions, and support next step direction in terms of problem analysis.",Data Analytics Engineer,Raymond, OH
58,Bridgestone,"Coordinate tire builds, analyze testing data, draw conclusions and make plans to ensure product/technology timelines are met and aligned plans are executed.",Tire Technology Engineer V,Akron, OH
59,Root Insurance Company,"What we look for in senior data infrastructure engineers: Able to positively influence other engineers, both directly and indirectly.",Data Infrastructure Engineer,Columbus, OH
60,American Axle & Manufacturing,"Job Posting Title Industrial Engineer. Verify accuracy of IE data on customer quotes. For over 20 years, customers around the world have entrusted AAM to design…",Industrial Engineer,Twinsburg, OH
61,"AMETEK, Inc.","Ability to define problems, collect data, establish facts, and draw valid conclusions. We are looking for a well-rounded engineer that has demonstrated a high…",Mechanical Engineer,Athens, OH
62,Goodyear,Statistical design & analysis of experimental data. We are looking for an outstanding Associate Development Engineer to join our hands-on team.,Tire Engineer,Akron, OH
63,American Axle & Manufacturing,"For over 20 years, customers around the world have entrusted AAM to design, engineer, validate and manufacture driveline, metal forming, powertrain, and casting…",Assistant Document Control,Twinsburg, OH
64,Lubrizol Corporation,"Data Scientist / Statistician Intern (BS/MS Students). The Statistics & Data Analytics Team. Collaborate with data science team, as well as, scientists and…",Data Scientist/ Statistician Intern (BS/MS Students),Wickliffe, OH
65,"A. Schulman, Inc.",Uses intuition and experience to complement data. The Product and Applications Development (PAD) Engineer will be responsible for the development of new…,Product Application Development Engineer,Akron, OH
66,Airgas Inc.,"Interface internally with Airgas’ regional gas sales team, ESG’s engineering equipment engineers and Airgas’ corporate marketing and strategic account teams.",Applications Engineer,Oakwood Village, OH
67,Swisslog,Swisslog Field Service Engineers are critical to our customer care and support initiatives. Report product quality issues to assigned Senior Field Service…,Field Service Engineer,Toledo, OH
68,"Omega, Inc.","Today we offer 100,000 products for temperature, humidity, pressure, strain, force, flow, level, pH, conductivity, data acquisition, and electric heating.",Manufacturing Engineer,Sunbury, OH
69,NetScout System Inc.,"We are looking for RF Engineers who have experience in radio frequency technologies (LTE, UMTS/GSM, EVDO/CDMA) to assist with our RF data collection projects &…",RF Support Engineer,Cleveland, OH
70,Gooch & Housego (Ohio),"Experimental Design and Data reduction. BS in Physics or related field, MS or higher preferred. Knowledgeable in the use of Test and Measurement equipment.",Product Engineer,Cleveland, OH
71,Cardinal Health,Gather data requirements from business users and stakeholders. Design and build data warehousing solutions based on business needs.,"Engineer, Software Engineering (BI Developer)",Twinsburg, OH
72,Cardinal Health,"Data Analytics Engineer is responsible for understanding, preparing, processing and analyzing data to make data valuable and useful for operations decision…","Advisor, Data Engineer",Dublin, OH
73,Louis Stokes Cleveland VA Medical Center,Constructs mobile applications and integrates information from networks of distributed sensors or other data sources into new medical devices.,Biomedical Software Engineer,Cleveland, OH
74,Comtec Information Systems,Build data ingestion & transformation processes to support industry leading data science applications in predictive modeling and machine learning deployments.,Data Engineer,Cincinnati, OH
75,Lubrizol Corporation,"Mechanical Engineer, Research Engineer, Developer, Engineer, Engineering, Research, Technology. Collect data and assist in interpreting results and provide…",Mechanical Engineer - Research & Development Summer 2020,Wickliffe, OH
76,State of Ohio Jobs,Must operate computer &/or laptop to input & retrieve bridge data. Collects & reviews pertinent data in order to prepare for site inspections.,Bridge Specialist 2 - Cuyahoga County - 20056082,Garfield Heights, OH
77,Giesecke & Devrient,"Is seeking a Product Development Engineer to join our growing team in Twinsburg, OH. The R&D Engineer / Product-Materials Developer will research, develop,…",Product Development Engineer,Twinsburg, OH
78,CT Consultants,"Collection and analysis of data. We are currently looking for a vibrant self-motivated Engineer to join our team. This position is based in Mentor, OH.",Engineer 1,Mentor, OH
79,Affymetrix,"Responsible for data analysis for new product validations, manufacturing scale-up and troubleshooting. Makes/records detailed observations, analyzes data and…",Manufacturing Engineer 1,Cleveland, OH
80,Comet Group,We take data protection seriously. The processing of your data complies with general data security standards based on the latest technology.,Field Service Engineer,Hudson, OH
81,Eagle Composites,"Quality Engineer - Quality Project Leader (QPL). Review SPC data to chart, analyze and implement any corrective actions. Based on major areas of involvement:",Quality Engineer,West Chester, OH
82,Chemstress Consultant Company,The Senior Electrical Engineer is responsible for gathering and analyzing technical data used to prepare basic electrical engineering designs for client…,Senior Electrical Engineer,Akron, OH
83,MEDsys Software Solutions,The ideal Software Automation Engineer is an experienced automation engineer who is passionate about solving challenging business problems and building…,Software Automation Engineer,Toledo, OH
84,Giesecke+Devrient,More than 40 sales and partner offices as well as 20+ certified production and personalization sites and data centers ensure customer proximity worldwide.,Quality Assurance Engineer,Twinsburg, OH
85,Acuative Corporation,"Responsible for design, configuration, implementation, and testing for the data network of our client. Candidate will also work as highest escalation for…",Network Engineer,Strongsville, OH
86,AK Steel,Data analysis skills necessary for data driven decision making. AK Steel has an immediate opportunity for a Metallurgist / Materials Engineer at our Coshocton…,Metallurgist / Materials Engineer,Coshocton, OH
87,RoviSys,"Our Software Engineers and Developers rely on strong software development skills to address technology decisions, data management, scalability, security and…",Software Engineer/Developer,Aurora, OH
88,"BGI, LLC","Leverage data aggregation, statistical analysis, and data mining algorithms. As a Data Science Software Engineer, you will apply algorithms to heterogeneous…",Mid-Level Data Science Software Engineer,Akron, OH
89,Selas Heat Technology Company,"Facility consolidation rationalization and integration, IT data collection and manufacturing automation, and other facility and process related activities.",Manufacturing Engineer,Streetsboro, OH
90,Quotient Technology Inc.,"Drive the production of analytic capabilities in data management, modeling and algorithms. Devise, develop, test and deploy new data models to expand current…",Data Engineer,Cincinnati, OH
91,Pison Stream Solutions,"Expertise in data and problem analysis. Pison Stream Solutions is looking for a full-time Engineer to join our team in Brecksville, Ohio. What’s in it for you?",Engineer,Cleveland, OH
92,Chmura Economics & Analytics,We have an exciting opportunity for a Infrastructure Engineer to join our Data Science and Technology team. You’ll work with an amazing team of economists and…,Infrastructure Engineer,Cleveland, OH
93,Matco,Become an expert on Matco’s Business Intelligence data warehouse to learn how to mine data on field failures both by quantity and cost.,Mechanical Engineer Intern (Summer 2020),Stow, OH
94,ViaSat,"Scripting, automation, data visualization & dashboarding. Data analytics & cloud application engineering. Experience with GPU Programming, Cloud Technology,…",Software Engineer Intern,Cleveland, OH
95,OWENS CORNING,"The Product Development Engineer manages the development, implementation and support of new technologies related to Roofing Components packaging products.",Product Development Engineer,Granville, OH
96,Continental Structural Plastics,"We are seeking a Quality Engineer for our Carey, Ohio Plant. Interface with plant and corporate engineering to ensure transfer to launch of new products are in…",Quality Engineer,Findlay, OH
97,Emission Monitoring Service Inc.,Performing drift assessments (entering data into calibration book). Calibration of TVA (entering data into handheld & in calibration book).,Monitoring Technician,Cadiz, OH
98,Johnson Matthey,"Basic computer skills, including data entry, are required. Johnson Matthey’s Catacel Technology Center, located in Ravenna, Ohio, engineers and manufactures…",Production Operator (2nd Shift),Ravenna, OH
99,Hirschvogel Incorporated,"Investigate design proposals for improving equipment performance or to obtain data for development, standardization, and quality control.",Production Engineer Machining,Columbus, OH
100,Verizon,"Intelligent Edge Network (iEN), Unified Transport, Voice and Data, and Internal Data Core networks. Field Engineer detailed, often complex, network builds for…",Field Engineer,Cleveland, OH
101,Qbase,"Experience performing hands-on data integration, data linking, fuzzy matching, and data transformations (ETL). Work independently with minimal supervision.",Data Engineer,Beavercreek, OH
102,"Honda R&D Americas, Inc.",Quality Services Department (QSD) Materials Engineer – Engineering Development Program (EDP). Confer with engineers and other personnel to resolve system…,Materials Engineer- Engineering Development Program - June 2020,Anna, OH
103,Toyo Tires,Apply for Field Engineer Commercial using the link below: We are currently seeking a hands-on results-oriented Field Engineer to join our Commercial truck tire…,Tire Field Engineer - Commercial Tires,Akron, OH
104,Komatsu,"Effectively communicate and liaise between Product Support, Product Engineering, and Joy Global Service Centers to assist in collecting data to validate and…",Product Support Engineer,Cleveland, OH
105,BETTCHER INDUSTRIES INC,Being adaptable and overcoming obstacles are key qualities of an effective Design Engineer. Ability to collect and analyze data using a wide range of analytical…,Design Engineer,Vermilion, OH
106,The J. M. Smucker Company,"Provide data on project-related quality issues. For more than 120 years, The J.M. Smucker Company has brought families together to share memorable meals and…",Process Engineer,Akron, OH
107,Google,We're proud to be our engineers' engineers and love voiding warranties by taking things apart so we can rebuild them. It is built into the DNA of our products.,Data Center Security Manager,New Albany, OH
108,Electric Power Systems,"Commissioning Engineer | Area Engineer Managed-Task services as follows: We specialize in commissioning, start up, and maintenance testing for Utility,…",Commissioning Engineer,Cleveland, OH
109,STERIS,Supports senior engineer in Investigation of new test technologies and tools. Works on specific tasks under direction of manager or senior test engineer.,Software Test Engineer,Mentor, OH
110,Pythian,"In-depth knowledge of popular database and data warehouse technologies from Microsoft, Amazon and/or Google (Big Data & Conventional RDBMS), Microsoft Azure SQL…",Big Data Architect,United States,
111,CTS Corporation,"Utilize PLM system to manage design data and communicate the data throughout the global organization. Mentor less experienced engineers, designers or analysts.",Lead Design Engineer (automotive),Columbus, OH
112,Hull & Associates Inc,"Perform computations and process data using computer software or other established methods; Scheduling, equipment management, data management, file management…",Civil Engineer - Dublin or Newark OH,Newark, OH
113,MORGAN ADVANCED MATERIALS,"Assists in the compilation of data, generation of reports, and preparation of presentations. Ability to apply logical or scientific thinking to define problems,…",Process Engineer,Fostoria, OH
114,Verizon,"Experience in leading large scale data center projects. You will help Verizon move desktops, applications, and infrastructure from on-prem data centers to AWS.",Systems Engineer,Twinsburg, OH
115,Goodyear,Translate product needs to experimental data or design parameters. Communicate and solve problems by interpreting and analyzing data. MUST be willing to travel.,Development Engineer - Race Construction,Akron, OH
116,STERIS,"The engineer is responsible for assisting in CAPAS, NCR’s, and complaint mitigation. The Sustaining Engineer is responsible for all design aspects of our…",Sustaining Engineer,Mentor, OH
117,Integrated IT Group,We are currently seeking a self-motivated and dedicated individual to join our expanding Field Engineer team. Integrated IT Group is a comprehensive provider of…,IT Field Engineer,Twinsburg, OH
118,MTD Products Inc,"Analytical skills to analyze emission data and understand emission software and hardware are valuable. In this role, the Emissions Compliance Engineer must…",Emissions Compliance Engineer,Valley City, OH
