,company_name,job_summary,job_title,City,State
935,"Wiss, Janney, Elstner Associates","Ability to record data clearly and write passages for reports, letters, etc. Organize field data and assist with research to facilitate analysis, problem…","2020 Internship Cleveland, OH",Cleveland, OH
936,Root Insurance Company,"You’ll leverage data from disparate sources, the talent and insights of your product team as well as designers and engineers working across multiple projects in…",Director of Product,Columbus, OH
937,Veeam Software,"Join Veeam, the #1 Cloud Data Management provider, today. We understand the criticality of the move to the cloud, which adds complexity in not only managing and…",Technical Support Engineer,Columbus, OH
938,CyberArk,"Perform bi-weekly meetings with the territory SE and Professional Services Engineers to assess the status of all existing accounts, and to expedite the rollout…",Account Executive,Cleveland, OH
939,STERIS,"Assist engineers with installation, testing, and validation of new production equipment. The full affirmative action program, absent the data metrics required…",Automation Technician,Mentor, OH
940,"ZIN Technologies, Inc.","Reviews and analyzes released engineering change data and coordinates changes with engineering, quality, support, manufacturing and engineering data control…",Management Configuration Manager,Cleveland, OH
941,GE Aviation,Prepare and present technical data to internal and external customers. Document technical data generated for the assigned projects and/or tasks consistent with…,Materials Science Engineer,Evendale, OH
942,American Trim,"Communicate with shift supervisor, tooling engineers, quality engineers and other work cell people on opposite shift concerning production problems, quality and…",TP Automated Press Operator 1st Shift,Sidney, OH
943,L&T Technology Services Ltd.,Able update project related data as required in applicable systems and ensure timely reporting and response to stakeholders. Should have valid driving license.,Senior Infotainment Test Engineer,Raymond, OH
944,Everstream,Maintain colocation and data center As-Builts/Rack Diagrams/DLRs and incorporate into change process. Are you a seasoned IP network engineer eager to work in a…,Design Engineer,Cleveland, OH
945,JAC Products,"Certified Quality Engineer (CQE) or equivalent is preferred. Successful Product Launch / Production Start-up experience including all documentation, testing,…",Quality Engineer (QE),Napoleon, OH
946,Budzar Industries,Review with Project Engineer the scope of design. Review the dimensional and design data from suppliers and make necessary changes to the models and drawings.,Mechanical Designer,Willoughby, OH
947,"Auto-Valve, Inc.","Identifies and requests engineering data (drawings, specs, parts lists, etc.). Inputs data into the quote module for documenting material costs, subcontract…",Estimating Engineer,Dayton, OH
948,TT Electronics,Evaluates scrap and rework data with implementation of corrective action. Ability to use manufacturing data to implement process change.,Manufacturing Engineer - Experienced,Perry, OH
949,SMS group Inc,"Design, develop and deploy machine control systems, integrated automation including robotics and servo controls, HMI systems, and data collection systems…",Electrical Automation Engineer,Middleburg Heights, OH
950,Quest Diagnostics,"Engineer Software III - Deerfield, OH req34493. Gathers data to holistically diagnose problems before acting. Consistently makes good choices by evaluating data…",Engineer Software III,Township of Deerfield, OH
951,Transportation Research Center (TRC),Test Engineer with over 5 years of test engineering experience in required test and confirmation per area of specialty.,Test Engineer,East Liberty, OH
952,Tark Inc.,"Data entry into ERP, Excel, Word, etc. Data analysis, assembling plots/charts and report writing. The Quality Engineer is responsible for completing QMS…",Quality Engineer,Dayton, OH
953,INFINIDAT,This position is partnered directly with a Pre-Sales Systems Engineer (SE) in the assigned territory. Ability to move from the boardroom to the data center with…,"Enterprise Account Manager, Data Storage - Ohio",Ohio,
954,"MacAulay-Brown, Inc. (MacB)",These systems use FPGAs to collect data from and control hardware. It is desired that the candidate have experience working with FPGA's for data acquisition and…,Hardware Engineer,Dayton, OH
955,L&T Technology Services Ltd.,"Analyze user research data to understand our customers' needs and desires for infotainment systems (in vehicle displays, information, entertainment, controls,…",HMI Design Engineer,Raymond, OH
956,Silfex,Analyzes equipment performance data and develops focused projects to reduce unplanned downtime by implementing Preventive and Predictive Maintenance programs.,Facilities Chemical Equipment Engineer,Eaton, OH
957,Cardinal Health,"Assisting organizations acquired by Cardinal health to migrate into our cloud-based solutions by moving critical data, processes, and workflows.",Office 365 Engineer,Dublin, OH
958,AT&F,Quality Engineer (2nd Shift) | Orrville. Collecting and analyzing data to drive process improvements. AT&F is looking to expand their Quality and Technical…,Quality Engineer - (2nd Shift) - Orrville,Orrville, OH
959,Indago,"Wireless systems, data broadcast and receiving systems, error correction, design and simulation. Founded in 2015 by a multi-disciplinary team of designers,…",Electrical Engineer - Medical Devices,Cleveland, OH
960,Radiance Technologies Inc.,"Familiarity with how data flows through a network and the OSI model. The Entry Level Reverse Engineer would be the ground troops of the team, taking on the…",Entry Level Reverse Engineer,Dayton, OH
961,Essilor,Support the deployment of automated data extraction tools to compile data models and publish onto a local server or cloud based data architecture as needed.,Process Engineer- Coating,Columbus, OH
962,Ferrovial Services North America,Ensures data in the MMIS is accurate. Works with Project Engineer to schedule work to be performed. The Superintendent works in collaboration with the Project…,"Superintendent (Road Maintenance) - Newport, MI",Akron, OH
963,Olympus,"Assist Engineers with process and product development. Ability to calculate surface feet per minute and proper federates using manufacturers' catalogs, data…",Machinist II,Norwalk, OH
964,"City of Dublin, Ohio","Completes research projects, including identifying data requirements, collecting and reviewing data, analyzing results and develops finding and recommendations.",Civil Engineer II - Construction,Dublin, OH
965,Cooper Tire & Rubber Company,"Must be able to define problems, collect data, establish facts, and draw valid conclusions. Under the direction of an Industrial Engineer or Industrial…",Industrial Engineer Co-Op (Summer 2020),Findlay, OH
966,Wade Trim,Perform data analysis of continuous flow and rainfall data. Perform routine calculations under senior engineer. Obtain drawings from local municipalities.,Engineer Summer Intern,Cleveland, OH
967,"Pernix Consulting, LLC",3 years of software engineering related to front-end and back-end applications and or data services. Pernix is seeking both Full Stack Engineers & Full Stack…,Full Stack Developer - Remote,United States,
968,Insight Global,This Oracle database holds data for the government customer and provides tools for reports and high-end graphics to support our nation’s intelligence data.,Software Engineer,Dayton, OH
969,KEYW Corporation,"Experience documenting ontologies, data models, schemas, formats, data element dictionaries, software application program interfaces and other technical…",Software Engineer/Statistician,Dayton, OH
970,Veeam Software,"Recognition—we prefer to promote engineers internally. You’ll work on the edge of IT and virtualization, getting trained in what you don’t know and recognized…",Windows Technical Support Engineer,Columbus, OH
971,Nolte Precise Manufacturing,"Prepares periodic reports by collecting, analyzing and summarizing data. Nolte Precise Manufacturing, located in Colerain, is in need of a quality engineer.",Quality Engineer,Cincinnati, OH
972,Therma-Tru,Assist Engineers with product and component design. Our Engineers work closely with cross function groups on innovative product engineering projects offering a…,2020 R&D Engineering Co-op Program,Maumee, OH
973,CONGER CONSTRUCTION,Participates in project related meetings to report out on change order and submittal data. The Project Engineer is responsible for managing and tracking all…,Project Engineer,Lebanon, OH
974,Cardinal Health,Acquires and analyzes data using appropriate standard quantitative methods to facilitate process analysis and improvements.,Principal Supplier Quality Engineer,Dublin, OH
975,VeoRide,"A quantitatively oriented decision maker, with an interest in using data to drive efficiency and improve performance. A leader with a developed sense of ethics.",General Manager - Cleveland,Cleveland, OH
976,Procter and Gamble,"Performing data discovery to understand data sources. You will work with data analysts and data scientists to understand business needs, data needs, and outcome…",IT-Data Wrangler,Cincinnati, OH
977,ABB,Collects data and supports production of the engineering design (e.g creates drafts for the Project Engineer to approve). Are you ready to work with a purpose?,College Student Internship- Fall 2020 - Automation Engineer,Cleveland, OH
978,FLUOR-BWXT PORTSMOUTH,"Design Engineer III (HR - 3754). Utilize vendor data and work with personnel from other disciplines, as required, for performance of designs.",Design Engineer III,Piketon, OH
979,First Solar,Maintain effective communication with production associates and manufacturing engineers. Able to apply statistical tools to analyze data and provide conclusions…,Manufacturing Engineering Technician II (Submodule) A Crew,Perrysburg, OH
980,CAS,"Understand data models and make recommendations to existing data models as needed. Provide software engineering to interact with, format, standardize, and…",Software Engineer,Columbus, OH
981,Deloitte,Minimum of three years of prior data engineer experience. Strategy & Analytics – Project Delivery Specialist – Big Data Engineer. Deloitte is led by a purpose:,Big Data Engineer - Project Delivery Specialist,Columbus, OH
982,Northrop Grumman,"Establish and maintain an excellent rapport with AFRL project managers, engineers, scientists, subject matter experts, and industry contractor partners for all…",NGTS Project Management Analyst / Secret / Interim Secret,Ohio,
983,ITW Welding,The Manufacturing Engineers will have ideas or specific needs for such things as jigs/fixtures or workstations. Have completed the following courses:,Manufacturing Engineer Intern,Troy, OH
984,CT Consultants,"Collection and analysis of data. The entry-level Civil Engineer will be an ambitious, independent- thinker focused on providing site design for a diverse range…",Entry Level Civil Engineer,Columbus, OH
985,Google,We're proud to be our engineers' engineers and love voiding warranties by taking things apart so we can rebuild them.,"Site Manager, Hardware Operations",New Albany, OH
986,ClarkDietrich Building Systems,Collaborates with Engineers and Architects. Ability to manage analytical data using spreadsheets and databases. Responsible for managing contractual issues.,Project Manager Plant Superintendent,Warren, OH
987,Earnin,"2+ years of data modeling, ETL development, Query Optimization experience with relational databases, preferably AWS RDS. You can help make a difference.",Data Engineer-DB,Cincinnati, OH
988,"Innovative Staff Solutions, Inc.",Drive the data collection and analytics to identify opportunities for improvement. Supports the business in decision making through data and interpretation from…,Continuous Improvement Engineer,Dayton, OH
989,Collage.com,"Review code and mentor other engineers. Architecture (such as Backbone, Vue, React + Redux/Mobx, etc.), unidirectional data flow, and minimal class/object…",Senior Front-end Software Engineer,Akron, OH
990,Jam City,"Assist the data engineers in managing billions of rows of data. Building reports, dashboards and data visualizations to monitor the health and accuracy of our…",Data Analyst (Quality Control),Toronto, OH
991,ComResource,"IT Network is responsible for designing, implementing, operating and maintaining the Organization local and wide area networks and the Organization telephone…",Network Engineer,Columbus, OH
992,CVS Health,"Advanced skills with data warehouses and data visualization software such as Tableau. Integration of primary and secondary data sources, despite data needing to…",Senior Analyst Client Reporting,Cincinnati, OH
993,PTC Alliance,"Ability to define problems, collects data, establishes facts, and draw valid conclusions. The Maintenance Supervisor will have working supervision of the Trade …",Electrical Engineer,Alliance, OH
994,JPMorgan Chase,"Advanced knowledge of application, data and infrastructure architecture disciplines. Advanced knowledge of application, data and infrastructure architecture…",Software Engineer - Mainframe,Columbus, OH
995,Hobart Brothers Company,Familiar with thin client and data acquisition server. This will be a key position within the reliability department due to increased automation within the…,Automations Engineer,Troy, OH
996,"iHeartMedia, Inc.",Extensive knowledge of Diary data analysis; Provides direction to DJ and audio engineer on content. Demonstrated ability to use tools to gather and analyze…,"Senior Vice President, Programming - Mansfield, Ohio",Mansfield, OH
997,Veeva Systems,Veeva Systems is looking for an energetic and enthusiastic functional QA Engineer to join our rapidly growing team. Design and implement test strategies.,QA Engineer,Columbus, OH
998,JP Morgan Chase,"Experience implementing Spark (Big Data technology). Advanced knowledge of application, data and infrastructure architecture disciplines.",Java Software Engineer - Spark & Big Data,Columbus, OH
999,TE Connectivity,"Generate and maintain project documentation including schematics, drawings, test data, and reports. With 80,000 employees, including more than 8,000 engineers,…",R&D Product Development Engineer,Mansfield, OH
1000,PACCAR,"Kenworth Chillicothe has an immediate opening for an Environmental Engineer. Track waste-to-landfill data, and act on opportunities to minimize waste generation…",Environmental Engineer,Chillicothe, OH
1001,"POWER Engineers, Inc.",Mid Level PTE Field Engineer. Mid Level PTE Field Engineer. Technical software for testing purposes and data review: This position is based in our St.,Mid Level PTE Field Engineer,Akron, OH
1002,ITW,The Manufacturing Engineers will have ideas or specific needs for such things as jigs/fixtures or workstations. Have completed the following courses:,Manufacturing Engineer Intern,Troy, OH
1003,First Solar,Maintain effective communication with production associates and manufacturing engineers. Able to apply statistical tools to analyze data and provide conclusions…,Manufacturing Engineering Technician II (AM Shift),Perrysburg, OH
1004,"Kudu Dynamics, LLC","Big data environments (Hadoop, ElasticSearch, Presto, Apache Kudu, MinIO). Knowledge of datacenter computer hardware market, and ability to take gross…",IT Manager,United States,
1005,Cuyahoga Metropolitan Housing Authority (CMHA),"Microsoft Certified Systems Engineer (MCSE) (Preferred). Responsible for strategic planning, and for designing new andtroubleshooting existing data networks…",Network Administrator,Cleveland, OH
1006,Facebook,Provide prioritization of data center projects across a multiple building site. Less than 10% occasional travel to Data Centers and vendors as required.,Facility Project Manager,New Albany, OH
1007,Emerson,"Works with Reliability Management and Senior Engineers to ensure the products defined Reliability measures are met. Oct 1, 2019, 7:34:07 PM.",Reliability Engineer,Sidney, OH
1008,Johns Manville,This key position includes responsibility for supervision of salaried employees including process engineers and front line supervisors.,Production Superintendent (Process Area Owner),Toledo, OH
1009,Goodyear,Engineer must have desire and capability to seek out existing or develop new technologies that will advance the state of curing at Goodyear.,Mechanical/Mechatronics Engineer - Principal - Curing,Akron, OH
1010,Fusion Talent,Fusion Talent is in search of a Quality Engineer to join one of our key clients. This opportunity is truly unique for a Quality Engineer where you will use a…,Quality Engineer,Lebanon, OH
1011,"SCS, Inc.","Electrical Engineer Degree Preferred, but not required. Maintain good records, documents, and reports various data. Must keep equipment and machinery operating.",Electrical Engineer/ PLC Specialist,Perrysburg, OH
1012,Dimensional Control Systems,"Performs project data management, documentation, and reports for model accuracy and project status. The AutoCad 2D/3D Specialist position will work as part of a…",Plant System Layout Engineer,Toledo, OH
1013,State of Ohio Jobs,"Licensed as registered professional engineer by Ohio State Board of Registration for Professional Engineers & Surveyors; As Transportation Engineer 2, 85642;",Transportation Engineer 3 - Construction,Ohio,
1014,Arconic,"Ability to make difficult decisions with sometimes and incomplete set of data. Maintain a culture that is aligned with Arconic's EHS goals and objectives, with…",Senior Safety & Health Engineer,Canton, OH
1015,Battelle,"Experience in data analysis, familiarity with basic statistical methods, data visualizations, biological signal processing methods and algorithms.",Neurotechnology Research Scientist,Columbus, OH
1016,First Solar,Maintain effective communication with production associates and manufacturing engineers. Able to apply statistical tools to analyze data and provide conclusions…,Manufacturing Engineering Technician II - Laser (D Crew),Perrysburg, OH
1017,Eaton,"Advocate for data quality across the data lake. Detailed knowledge of data engineering principles for Marklogic, Cloudera Big Data (Hadoop), and Oracle…",Chief Enterprise Architect,Cleveland, OH
1018,JP Morgan Chase,"The candidate is a world class infrastructure engineer, who will work on J.P. As a team, you and your peers will be responsible for driving results, collecting…",Infrastructure Engineer,Westerville, OH
1019,Olympus,"He/she should be expected to also work independently with minimal supervision in the lab, summarizing data, and writing technical reports.",Engineering Co-Op,Norwalk, OH
1020,Akron Children's Hospital,"Professional Engineer (PE) is preferred. Provides direction, coaches, trains, develops, and supports facilities staff (facility managers, construction engineers…",Facilities Energy Engineer,Akron, OH
1021,Invacare Corporation,Successful experience in data file generation for 3D modeling systems. Work with engineers and marketing staff in dynamic conceptual stages of projects.,Designer II,Elyria, OH
1022,AmTrust Financial Services,"As a Software Development Engineer in Test, your Responsibility will be working with software engineers to build advanced test suites, create new test harnesses…",Software Development Engineer in Testing II,Cleveland, OH
1023,Johnson & Johnson Family of Companies,"Have a strong support network of seasoned team engineers and mentors, guiding your technical and career development. Proud to be an equal opportunity employer.","Assistant/Associate Engineer, Engineering Development Program- Electrical/Software/Systems- Full Time",Cincinnati, OH
1024,Procter and Gamble,As a Data Scientist you will work closely with Scientists and Engineers to translate business challenges into clear problem statements.,Data Scientist-R&D,Cincinnati, OH
1025,Cognizant Technology Solutions,"Hiring “ Regulatory Engineer for Blue Ash, OH location”. Information and collect data that will be necessary for marketing approval and.",Regulatory Engineer,Blue Ash, OH
1026,Clopay Building Products,"Review customers’ specifications or requirements, and if required, work with product engineer to assure accuracy of shop drawing.",CAD Specialist,Troy, OH
1027,"Railhead, Inc.","Extracting data for reporting purposes. Partners with developers and engineers to reduce re-occurring incidents. System start-up, initialization and shut down.","Multi-functional Field Service Engineer / DBA - Charlottesville, VA",United States,
1028,NewCareers,"In addition, the engineer will be part of the team that implements, manages, and improves quality system is compliance with by analyzing data, reporting trends,…",Quality Engineer - Design & Process,Mentor, OH
1029,CTL ENGINEERING,"Creates strong internal partnership for gathering of data, working through proposal data and getting questions answered for presentations/proposals.","Business Development Manager- Think Big, We Do.",Cincinnati, OH
1030,Cooper Tire & Rubber Company,"Uses statistical, physical and classical mathematics to reduce and analyze experimental data. Designs, documents, and maintains standardized formats and…",Test Development Engineer,Findlay, OH
1031,Everstream,Knowledge of data centers and data center operations. Maintain colocation and data center As-Builts/Rack Diagrams/DLRs and incorporate into change process.,Core Engineer - 3rd Shift,Cleveland, OH
1032,KBRWyle,"Experience using MATLAB or Python to analyze data, report scientific results, and -automate lab equipment. The ideal candidate exhibits excellent communication…",Microwave Engineer,Dayton, OH
1033,Hikma Pharmaceuticals,"Maintain the Master Data and execute product, equipment, and system evaluations using a risk based approach including performing required calculations;",Engineer III Validation,Columbus, OH
1034,Whirlpool Corporation,"Facilitates tracking of all environmental data & responsible for the execution of associated targets. Currently, we are seeking qualified candidates for an…","Environmental, Health and Safety Engineer",Clyde, OH
1035,Ohio Screw Products,Reviews data to determine material and labor requirements and prepares itemized lists. Conducts special studies to develop and establish standard hour and…,Screw Machine Process Engineer/Estimator,Elyria, OH
1036,Wacker Chemical Corporation,"Knowledge and/or experience desired in evaluation of process data with statistical tools like Minitab. This role is located in Charleston, TN.",Process Development Engineer - Crushing,Dayton, OH
1037,Mettler Toledo,Create and utilize data analysis to support service operations team *. The Industrial Systems Engineer Intern role is designed to support the activities in…,Industrial Systems Engineer Intern (Summer 2020),Columbus, OH
1038,Abbott Laboratories,Integrate financial data with technical data. Develop manufacturing asset structure for data collection and data contextualization.,Controls Engineer,Columbus, OH
1039,The Scotts Miracle-Gro Company,"We are looking for a Senior Analyst, Infrastructure Engineer who will join our Information Technology team. Analyst, Infrastructure Engineer creates, maintains,…","Senior Analyst, Infrastructure Engineer",Marysville, OH
1040,APR Consulting Inc,Has been engaged to identify a Network Engineer II. Advanced problem solving skills including conceptual and analytical thinking and capable of working on…,Network Engineer II,Columbus, OH
1041,Perspecta,"Our team of engineers, analysts, developers, investigators, integrators and architects work tirelessly to create innovative solutions.",Systems Engineering Director,Cleveland, OH
1042,Recruiters Network,Technically savvy and able to work with data scientists and data analytics folks to translate marketing questions and needs into queries and analysis of data.,Media Analyst - Storyteller,Columbus, OH
1043,Community Blood Center/Community Tissue Services,"Collect and analyze data using appropriate tools. We are looking for a creative, innovative, self-motivated engineer with knowledge, talents and experience in…",MANUFACTURING ENGINEER - RESEARCH & DEVELOPMENT,Kettering, OH
1044,Nissin Precision North America,"Prepares graphs or charts of data or enters data into computer for analysis. Records test data, applying statistical quality control procedures.",3rd shift Quality Engineer,Englewood, OH
1045,Chase,"Data protection, replication, reconciliation, and distribution. Experience with Spark/Spark Streaming (Big Data). BS/BA degree or equivalent experience.",Software Engineer - Big Data,Columbus, OH
1046,State of Ohio Jobs,"Licensed as registered professional engineer by Ohio State Board of Registration for Professional Engineers & Surveyors; As Transportation Engineer 2, 85642;",Transportation Engineer 3 - Bridges - 20056196,Garfield Heights, OH
1047,TTM Technologies - North America,"Inform Supervisor, or Process Engineer any discrepancies found in material, product, or equipment Perform other tasks as assigned by management.",Production Associate - 2nd Shift,North Jackson, OH
1048,Grange Insurance Company,"Plan and create required test data for test execution purposes. Review business requirements, data requirements and technical specification in order to test the…",Sr. Ruby Engineer,Columbus, OH
1049,Ply Gem Siding,"Maintains system, facility, equipment, tooling, and product data bases by writing computer programs / drawings. Performs other duties as assigned.",Facility Engineer,Sidney, OH
1050,Cleveland-Cliffs Inc.,"Accurately follow procedures, record data, create required reports, and provide timely feedback to Supervisor and/or Engineering personnel.",Control Room Operator,Toledo, OH
