,company_name,job_summary,job_title,City,State
703,Faurecia,"Perform measurements and data collection on engineering samples, record SPC data and coordinate line trail data collection. The ideal candidate will have/be:",Quality Engineer,Franklin, OH
704,Universal Stainless,Salary Exempt Maintenance Engineer Maintenance. Manage and Analyze maintenance data from CMMS System. FLSA Status Reports To/Position Department.,Maintenance Supervisor,North Jackson, OH
705,Diebold Nixdorf,Monitor all data integrity performance and adopt appropriate tools. Analyze data from various sources and develop logical models for business intelligence.,Warehouse Engineer,North Canton, OH
706,Covia Corp,"This person will ensure reliable network operation across multiple data centers, plants, production facilities and offices. But our real strength is our people.",Senior Network Engineer,Independence, OH
707,General Electric,Experience with data architecture and data engineering principles. Work with Analytics team to incorporate advanced statistical and data science models directly…,Sr Data Visualization Engineer,Evendale, OH
708,TTM Technologies - North America,Assist Process Engineers in running chemical process evaluations. Immediately report any and all quality issues with panels and chemical baths to supervisor and…,Chemical Technician - 1st Shift,North Jackson, OH
709,STERIS,"Communicate clearly, both verbally and written, with Engineers, Quality personnel, supervisors, and fellow team employees. Complies with all quality standards.",Associate Welder,Mentor, OH
710,Emerson,Administer surveys to capture data for continuous improvement. The Quality Services Engineer position will partner with Business Unit functions and other…,Quality Services Engineer,Sidney, OH
711,HYUR Staffing Services,"Engineers tools, fixture and gauging modifications. Coordinates part inspection procedures with Quality Engineers. 3.0 Education and/or Experience Requirements:",Manufacturing Engineer II,Cincinnati, OH
712,Technical Assurance,"Licensed Professional Engineer (PE) (Preferred). Technically competent with field data collection tools. Structural Engineer - TechnicalAssurance Inc.*, a…",Structural Engineer,Columbus, OH
713,BioSource Recruiters,"Statistics, capability studies and data analysis. Develops and deploys software, forms and instructions for recording, evaluating, and reporting quality and…",Quality Engineer,Piqua, OH
714,Sterling-Hoffman Executive Search,"Set up data for estimates in computer programs. Establish and maintain effective relationships with suppliers, manufacturers, engineers and contractors in the…",Electrical Estimator,Cleveland, OH
715,Elliot Tool Technologies,"As the Project Engineer, you’ll be: Preliminary data shows it is 2 times more productive than the competing product. Our average tenure is 11 years.",Project Engineer,Dayton, OH
716,Tremco Incorporated,Collect data for process wast reduction. Work alongside Process Engineers on Capital Expense Projects. Tremco's Commercial Sealants & Waterproofing division is…,2020 Spring Engineering Co-op,Cleveland, OH
717,Praxair,Reviews and checks project specific drawings and data sheets to ensure compliance with design criteria and standards. Bachelor’s Degree in Engineering required.,"Design Engineer - Wooster, OH",Wooster, OH
718,"Ashland, LLC","Communication results to production and process engineers. Responsible for accuracy of data and precision of test equipment. Business at our Ashland, OH.",QA Laboratory Technician (Entry Level),Ashland, OH
719,Battelle,"Experience in data visualization, signal processing, statistical techniques, and technical writing. We encourage new ideas with our large Internal Research and…",Semiconductor Test Engineer,Columbus, OH
720,PARKER HANNIFIN CORP,"Analyze and post-process test data 8. Experience with 2D or 3D CAD software, data acquisition preferred. Interfaces with lab technicians, engineers, quality,…",Summer Term 2020-Intern Engineering-Electrical Design,Elyria, OH
721,Battelle,"Aid in the design and implementation of machine learning, data mining, data fusion, and data engineering techniques applied to cyber security problems.",Data Scientist 2,Columbus, OH
722,Trimble Inc.,We are seeking a Product Support Engineer with the Caterpillar Trimble joint-venture organization (CTCT). You will be part of an international team providing…,Product Support Engineer,Dayton, OH
723,GE Aviation,"As the Metallic Materials Application Engineer (MAE), you will: GE Aviation is looking for Engineers to join our fast-growing Advanced Military Engineering…",Metallic Materials Application Engineer,Evendale, OH
724,AVA Consulting,Advanced problem solving skills including conceptual and analytical thinking and capable of working on complex problems where analysis of situations or data…,Network Engineer - II,Columbus, OH
725,Facebook,Maintain/troubleshoot the tool for Critical Facility Engineers. 3+ years experience in Manufacturing or Data Center operations.,Maintenance Planning Coordinator,New Albany, OH
726,Onshore Momentum,Design and build data pipelines for handling both real-time data streams and batch based integrations. Manager of Data Architecture and Design.,Contract – Cloud Data Engineer – hourly rate open based on qualifications,Columbus, OH
727,Path Robotics,This engineer will apply a strong theoretical background with practical considerations to solve challenging problems. Proficiency in Python and C/C++.,Intern - Computer Vision Engineer,Columbus, OH
728,Jacobs,"Identify and implement modifications to data systems, reduction algorithms and procedures for maximum efficiency and data quality. Not more than 50 pounds, 20%.",Wind Tunnel Aerodynamic Engineer,Marysville, OH
729,BCS Data Center Operations,"The Data Center Engineer, Level 2 (DCE-2) conducts extensive hand-on operations and maintenance work in a data center and/or critical environment facility.",Data Center Engineer,Cincinnati, OH
730,Arzel Zoning Technology,"Guarding resources, sharing data and signalling threads.). Cleveland company seeks a “maker” and “do-er” type electrical/computer/software engineer to join our…",Electrical Engineer/ Computer Engineer,Cleveland, OH
731,GE Aviation,Data Engineer will be part of the Self-Service Data team in the Chief Data Officer Organization (CDOO). Data Engineer should have the below competencies:,Sr Staff Data Engineer,Cincinnati, OH
732,Applied Research Solutions,"BS in Computer Engineering, Computer Science, Management Information Systems, Physics, Data Engineering, Data Scientist, or closely related field.",Data Integration Engineer,Dayton, OH
733,Total Quality Logistics (TQL),This will include writing SQL to verify data was successfully saved in the database. The QA Engineer will own and be accountable for test planning and test…,Software QA Engineer,Cincinnati, OH
734,Laird Technologies,"Supports design and manufacturing engineers with cost analysis interpreted, to support partner decision making. Supports month end closing including:",Cost Accountant,Cleveland, OH
735,"AtriCure, Inc.","ASQ Certified Quality Engineer and/or Auditor. Assists in the further development of quality engineers. Experience training production associates, inspectors,…","Senior Quality Engineer, Operations Receiving Inspection",Cincinnati, OH
736,New Avenue Architects & Engineers,Perform occasional project site visits for field research or data collection. New Avenue Architects & Engineers is expanding and is currently seeking a…,Architectural Designer,Columbus, OH
737,"Cornerstone Research Group, Inc.",Refine concepts based on experiments and resulting data analysis. We are seeking scientists and engineers to join our research team.,Research Engineer,Miamisburg, OH
738,Universities Space Research Association,Analyzing data from spaceflight combustion experiments; USRA is seeking an Aerospace Engineer/Combustion Scientist to support NASA-sponsored combustion research…,"Engineer, Aerospace (Combustion Scientist for measurement and characterization of aerosol matter from fires in space)",Cleveland, OH
739,Crane Co.,"Construct test set-ups according to test procedures, schematics, written and verbal instruction provided by Test Engineer, Mechanical Engineer.",Sr. Test Technician,Elyria, OH
740,Super Systems Inc.,Alert Network Engineers and Administrators of any hiccups or issues. Apply knowledge to ensure everything is working properly.,Data Center Technician,Miamisburg, OH
741,Tronair,"Prepares reports that collect, analyze, and summarize data. Maintaining American Society of Quality certified quality engineer qualification.",Quality Engineer,Swanton, OH
742,Cunningham Broadcasting Corporation,"Consult and communicate with engineering management and other engineers on technical issues as required. This includes server-based record and play-out systems,…",Broadcast Engineer,Dayton, OH
743,Teijin Carbon Fibers Inc.,"We are seeking a Quality Engineer for our Carey, Ohio Plant. Interface with plant and corporate engineering to ensure transfer to launch of new products are in…",Quality Engineer,Carey, OH
744,WANNEMACHER ENTERPRISES INC,"Ability to define problems, collects data, establish facts, and draw valid conclusions. Plans utilization of facilities, equipment, materials, and personnel for…",Industrial Engineer,Van Wert, OH
745,Xylem,Creo (Pro Engineer) and Windchill preferred. Some experience with 3D CAD modeling software and data management tools; A leading global water technology company.,Intern - Mechanical Engineer - Summer 2020,Yellow Springs, OH
746,Olon Ricerca Bioscience LLC,"Ability to work independently and collectively with diverse groups comprised of chemists, engineers, and technicians.",QA Auditor 1,Concord, OH
747,Oshkosh Defense,Utilize ERP systems to create part numbers following the proper naming process and data entry requirements. Work with cross functional teams to manipulate and…,Associate Systems Designer,United States,
748,Bruce & Merrilees,2+ years of prior Construction Project Engineer experience. 350+ Team Members Strong | 200+ Annual Projects | 71 Years & Thriving. Some of the Work You’ll Do:,Assistant Project Manager,Toledo, OH
749,Battelle,"Primary responsibilities include supporting senior test engineers in test planning, test article design and manufacturing, test conduct, data collection,…",Associate Field Test Engineer,Columbus, OH
750,Upstart,2+ years of professional experience as a data scientist or software engineer. Applying to a role on the Data Science team at Upstart:,Machine Learning Engineer,Columbus, OH
751,JSW Steel USA - Ohio,"Configuration of data collection system and MES integration; The Automation engineer is primarily responsible for new product introductions, process improvement…",Automation Engineer,Mingo Jct, OH
752,Bridgestone APM,"Maintain sales and engineering data in GLOVIA and ICaras. Prepare sales forecasts based on assigned responsibilities, using customer supplied data and external…","Account Representative (Upper Sandusky, OH or Dickson, TN)",Upper Sandusky, OH
753,Battelle,"Industrial Designers and Human Factors Engineers; Neural devices, medical device design, signal processing and data analysis, physiological data analysis, or…",Medical Devices Biomedical Engineering Intern (Summer 2020),Columbus, OH
754,Verita Telecommunications Corp,"VTC Design Group's primary objectives are to successfully research, bid, engineer and permit fiber optic cable placement projects throughout the US.",Construction Administrator,Brooklyn Heights, OH
755,Bry-Air,"Generate and maintain product application notes, product application data sheets, and other documentation. From this position, an individual would most likely…",Applications Engineer,Sunbury, OH
756,MRI Software,This role will help train and develop junior engineers and engage in other leadership responsibilities. MRI Software is seeking a Mid-Level Back-End Engineer…,Mid-Level Back-End Software Engineer,Cleveland, OH
757,Great Lakes Assemblies,Develop and analyze statistical data and product specifications to determine standards and to establish quality and reliability of finished products.,Quality Engineer,East Liberty, OH
758,Ricoh,The Solutions Engineer (SE) is the technical lead for both pre and post sales implementation of Ricoh's solutions portfolio.,Solutions Engineer Software & Strategic Solutions,Richfield, OH
759,"Cornerstone Research Group, Inc.","We are seeking scientists and engineers to join our team. Experience with data analytics (Hadoop, R, or similar) is preferred. Other duties may be assigned.",Artificial Intelligence and Machine Learning Developer,Miamisburg, OH
760,Pioneer Industrial Systems,"Possess organizational skills, maintain a neat and organized work environment, keep accurate time entry and customer billing data.",Mechanical Design Enginner,Pioneer, OH
761,Key Bank- Corporate,"Experience in designing and engineering enterprise security solutions across the application, data, and infrastructure domains. Role specific tasks may include:",SIEM Engineer,Brooklyn, OH
762,"ViewRay, Inc.","This includes all software that is used on the Planning, Delivery and Data Management sides of the system. Ability to work effectively as part of the diverse…",Clinical Applications Trainer,Oakwood Village, OH
763,GE Aviation,"Work with data engineers on data quality assessment, data cleansing and data analytics. The Data Science & Analytics Intern will give to the development and…",Data Science & Analytics Intern - Summer 2020,Cincinnati, OH
764,Ohio State University Medical Center,Senior Process Engineer (Job Opening 453435) - The Senior Process Engineer serves as an internal consultant leading process improvement initiatives across the…,Senior Process Engineer,Columbus, OH
765,SharedLabs INC,"Work closely with test engineers, emphasizing the importance of responsible, quality testing practices. Should understand end-to-end mortgage data needs and…",Test/Quality Assurance strategist,Cleveland, OH
766,Trimble Inc.,"Corp IS Network Engineer Act as network lead for planning, designing, and implementing networked systems. The candidate will be involved in troubleshooting and…",IS Network Engineer 3,Mayfield Heights, OH
767,Stress Engineering Services Inc,"Data Analysis (Minitab, JMP, R, Python, or etc.). As a Mechanical Engineer you will participate in projects involving failure analysis, design/process…",Mechanical Engineer,Cincinnati, OH
768,Kroger General Office,Professional knowledge of data modeling and design and business process engines. The technology engineer mentors and coaches others to establish and improve…,DevOps Engineer,Blue Ash, OH
769,The Ruhlin Company,"Creates correspondence to owners, contractors, subcontractors, engineers, architects, etc. The Ruhlin Company is seeking to hire Project Engineers for its Civil…",Project Engineer,Sharon Center, OH
770,Fifth Third Bank,"The Solutions Engineer position is part of our BreakFree Solutions team and reports to the Vice President, Services. Make banking a Fifth Third better®.",BreakFree Solutions Engineer,Ohio,
771,Jobot,"We are a K12 analytic, assessment & data management solutions provide a foundation for standards-based learning and teacher data. This Jobot Job is hosted by:",Software Engineer,Cincinnati, OH
772,Activ8 Recruitment and Solutions,Minimum Requirements for Manager of Design Engineer: RESPONSIBILITIES of Design Engineer Manager - Automotive Parts (Metal):,Design Engineer Manager (OH/TK1/27544),Dayton, OH
773,Hikma Pharmaceuticals,"SAP Master Data, development/ registration protocols, reports, batch records etc.). Influence in establishing product specifications based on process and data…","Sr. Process Engineer, Third Party Management",Columbus, OH
774,"Tyler Technologies, Inc.","Web services and working with JSON and XML data payloads. As a database software engineer at Tyler Technologies, you will apply your current skills today while…",Database Software Developer,Dayton, OH
775,Silfex,"CZ Mechanical Equipment Engineer - Eaton, Ohio. Ensure the integrity of data in the CMMS program. The Mechanical Equipment Engineer will also maintain current…",CZ Mechanical Equipment Engineer,Eaton, OH
776,Silfex,Analyzes equipment performance data and develops focused projects to reduce unplanned downtime by implementing Preventive and Predictive Maintenance programs.,Facilities Engineer 4 - 1776,Eaton, OH
777,Lincoln Electric,"Develop predictive reliability and correlation models bases on warranty, test data and POF. Engineer safe, high quality, cost effective, ergonomic, and…",Reliability Mechanical Engineer,Cleveland, OH
778,Fluor-B&W,"Supports Radiation Protection functional areas such as sampling, data capture, entry and analysis support, documentation, procedure update, report preparation,…",RP Engineer Sr./Principal (HR - 3834),Piketon, OH
779,Essilor,"We currently have a Maintenance Engineer career opportunity at our Columbus, Ohio location. The Maintenance Engineer supports equipment maintenance programs to…",Maintenance Engineer,Columbus, OH
780,StandardAero,? Analyzes and summarizes compiled data from test and inspection reports. ? Develops and initiates quality measure of performance standards and methods for…,Quality Engineer,Cincinnati, OH
781,ALTRAN,The Senior Mechanical Engineer will work as an individual contributor and technical lead. The Senior Mechanical Engineer performs broad based mechanical design…,Senior Mechanical Engineer,Cleveland, OH
782,Cardinal Health,Experience with Run book automation and data integration. What Software Engineering contributes to Cardinal Health. Works on complex projects of large scope.,ServiceNow Software Engineer,Dublin, OH
783,OpenText,"As an Enterprise Monitoring Engineer; Experience working in a team-oriented, collaborative environment with engineers across the globe.",Senior System Engineer,Brook Park, OH
784,ABB,Collects data and supports production of the engineering design (e.g creates drafts for the Project Engineer to approve). Are you ready to work with a purpose?,College Student Internship- Spring 2020 - Automation Engineer,Cleveland, OH
785,Accuray,"Detector correction, real time data acquisition, data flow and diagnostics in a complex pipeline setup. Software Engineer needed for software development of a…",Sr. SW Engineer,Cleveland, OH
786,ProLink Staffing,Validate accuracy of simulation models in comparing test data. The Hardware Systems Validation Engineer supports research and development efforts for automated…,Hardware Systems Validation Engineer,Marysville, OH
787,Michael Baker International,"Under limited supervision, the Transportation Engineer (Civil P.E.). Assists Project Managers and more experienced Engineers in ensuring that project/task…",Transportation Engineer - Highway/Roadway,Cleveland, OH
788,A.R.E. Accessories,CQE (Certified Quality Engineer) or other ASQ certification is beneficial. Employ statistical techniques and rationale in decision-making activities driven by…,Quality Manager,Massillon, OH
789,Yellowbrick Data,Domain experience in the enterprise data warehousing and analytics market. Keep up on the competitive landscape within the data warehouse Ohio Valley market.,"Systems Engineer, Ohio Valley",Cleveland, OH
790,Shared Services,"Software Engineers in implementing data migration tasks between various systems; Software Engineer II’s, through collaboration with Senior Engineers, architect…",Software Engineer II,Northwood, OH
791,"Anthem, Inc.","Establishes and maintains excellent knowledge of data warehouse database design, data definitions, system capabilities, programming languages, and data…",Engineer Lead,Ohio,
792,"CANON MEDICAL RESEARCH USA, INC","Ability to define problems, collect data, analyze data, establish facts, and draw valid conclusions. Design and implement solutions to complex data management…","Senior Software Engineer, MR",Mayfield Village, OH
793,Engineered Profiles LLC,"Developing and maintaining shop floor data collection system. The Quality Engineer, under the direction of the Quality Director, will develop and maintain the…",Quality Engineer,Columbus, OH
794,Capgemini,"4.Embedded real-time software engineering (requirements analysis, design, testing), data structures, algorithms, and C++ language.",Applications Consultant 2 - Firmware Engineer,Cleveland, OH
795,Röchling Group,"The Automotive division designs and engineers components and system solutions in the fields of aerodynamics, propulsion and new mobility. A job at Full time.",Quality Auditor - 3rd Shift,Akron, OH
796,JP Morgan Chase,"Serve as an Informatica Administrator, responsible for managing and maintaining ICDW (Integrated Customer Data warehouse) and INFO1 (Information one) ETL…","Associate, Infrastructure Engineer",Columbus, OH
797,Mercy Health,"Server Engineer II, Intel / Windows. Healthcare knowledge/background including data privacy practices and laws. This is what we were meant to do - Together!",Server Engineer II,Cincinnati, OH
798,Health Source Group,Ability to understand and work with product teams to engineer requirements. Extensive experience and knowledge in one of the core technologies such as Microsoft…,Net Solution Architect,Cleveland, OH
799,Oshkosh Corporation,"Three (3) or more years of experience as a data architect, data or systems engineer, or other related discipline . Persons,"" as defined in these regulations.",Data Architect,United States,
800,Silfex,"Supplier Quality Engineer - Eaton, Ohio. Manage supplier responsibilities for customer data inquiries, problem investigations, and corrective actions.",Supplier Quality Engineer,Eaton, OH
801,Airgas,"May assist in development, oversight and training of Equipment Engineers and Applications Engineers. Interface internally with regional account managers, bulk…",Applications Engineer,Cleveland, OH
802,Chase,"Mastery of application, data and infrastructure architecture disciplines. 5+ years’ experience as a Director within analytical or large scale data platforms,…",Lead Software Engineer - Big Data,Columbus, OH
803,Gentherm,"Quality Engineer, Investigation, Thermal Engineering, Medical, CAPA, Engineering, Legal, Healthcare, Management. We take a human approach with everything we do.",Quality Engineer - Complaint Investigator,Cincinnati, OH
804,AxoGen,"Prepare reports and presentations by collecting, analyzing, and summarizing data; The specific duties of the Quality Engineer include but are not limited to:",Quality Engineer,Vandalia, OH
805,"Murata Machinery USA, Inc.","Ability to define problems, collect data, establish facts, and draw valid conclusions. Assist other Field Service Engineers with various assignments to receive…",FIELD SERVICE ENGINEER I- OH,Cleveland, OH
806,Aclara,"We're big data gurus and in the field problem solvers. We're at the intersection of communications, data technology, energy, and national resource engineering.",Senior Software Engineer,Solon, OH
807,Huntington Bank,"Provide Subject Matter Expertise supporting Symantec Data Loss Prevention (DLP) services that discover sensitive data at rest in databases, collaboration tools,…",Data Protection Analyst,Columbus, OH
808,Riverside Research,Riverside Research is seeking a full time or part-time C++ Software Engineer to advance state-of-the-art software implemented data links and wireless networks.,C++ Software Design Engineer - Entry Level,Beavercreek, OH
809,Key Bank- Corporate,"Will collaborate with teams on monitoring infrastructure availability, data analysis tools, and performance alerting, critical to Key technology stacks and…",Dynatrace Monitoring Engineer,Brooklyn, OH
810,Implementation Engineers,"Excellent data analysis and statistical skills. Implementation Engineers has partnered with large global companies to improve throughput and productivity,…",Senior Value Stream Transformation Consultant,Cleveland, OH
811,ConstructConnect,"Create and manage data for assigned sources. This position involves telephone work, internet research, document management and data entry.",Data Entry Specialist,Cincinnati, OH
812,Michael Baker International,"Engineer In Training (E.I.T) or FE Exam scheduled. Perform data collection, field investigations, calculations, preparation of report tables/figures and report…",Traffic E.I.T.,Columbus, OH
813,"Involta, LLC","Typically with guidance from a senior network engineer, project lead or manager. To protect the security of Involta and its customers, it is necessary that this…",Network Specialist,Youngstown, OH
814,Rovisys Automation & Information Solutions,"Work in a team environment with engineers and designers from RoviSys, partners, and clients to provide state of the art software solutions to address technology…",Lead Software Engineer/Developer,Aurora, OH
815,Quanex Building Products,Operate and maintain CAD equipment and data in an efficient productive manner. 10+ years of experience as an electrical or manufacturing engineer or related…,Control Engineer,Cambridge, OH
816,Insight2Profit,"Then consider becoming the Software Development Engineer in Test (SDET). Responsible for coordinating test data setup, environment readiness, test execution and…",Senior Development Engineer in Test (SDET),Beachwood, OH
817,ITW,"Familiar with thin client and data acquisition server. Hobart Brothers, an Illinois Tool Works Company, located in Troy, Ohio, just 20 minutes north of Dayton,…",Automations Engineer,Troy, OH
818,Trimble Inc.,"Core technologies in positioning, modeling, connectivity and data analytics enable customers to improve productivity, quality, safety, and sustainability.",Senior Automation Engineer,Mayfield Heights, OH
