,company_name,job_summary,job_title,City,State
354,Procter & Gamble,"Strong analytical skills, able to leverage complex data to identify opportunities, recognize problems, and draw logical conclusions. The Value of a P&G Career.",Network Engineer,Cincinnati, OH
355,Riverside Research,Riverside Research is seeking a full time or part-time software designed radio engineer to facilitate state-of-the-art data links and wireless networks.,Software Defined Radio Systems Engineer - Mid Level,Beavercreek, OH
356,Frontier Communications Corporation,"This is achieved through the support of additional resources - such as Pre-Sale Technicians and Sales Engineers and Post-Sale Project Managers, Engineers, and…",Territory Account Executive I,Bowling Green, OH
357,Bruner Corporation,O Ensuring the accuracy and timeliness of daily and weekly production reports and assisting in quantitative and graphical analysis of production data to…,Project Engineer,Columbus, OH
358,Colgate-Palmolive,"The Project Engineer will provide engineering expertise and execution for the continuous improvement of plant detergent processing, surfactant sulfonation and…",Senior Project Engineer,Cambridge, OH
359,"Quadax, Inc.","Understanding of design, build and manage data pipelines for data structures encompassing data transformation, data models, schemas, metadata and workload…",Data Architect,Middleburg Heights, OH
360,IEC Infrared Systems,? Parallel and serial data (e.g. Successful candidate is self-motivated with excellent communication and organizational skills. ? Brushed vs Brushless (BLDC).,Electrical Engineer,Middleburg Heights, OH
361,Ameritas,Ameritas Investment Partners is seeking a Investments Data Engineer Intern. Understands foundational concepts of data development and operational procedures…,AIP Intern-Investment Data Engineer,Cincinnati, OH
362,Chase Brass & Copper Co. LLC,"The Mechanical Engineer Co-Op/Intern will work directly with a current Engineer (mentor) in areas such as project management, problem solving and root cause…",Intern-Mechanical Engineer,Montpelier, OH
363,Interstate McBee,Strong data analysis skills using statistical tools (e.g. Reverse engineer and develop diesel fuel systems and engine components (e.g. Lift up to 40 pounds.,Design Engineer,Cleveland, OH
364,Gooch & Housego,Experimental Design and Data reduction. This position involves the introduction of new electro-optic products to G&H’s product line as well as support of…,Product Engineer,Cleveland, OH
365,STERIS,Review collected data to perform statistical analysis and recommend process / product changes to improve quality. Perform all other duties as assigned.,Senior Quality Engineer,Mentor, OH
366,Northern Technologies International Corporation,"Generate project reports, data analysis and summaries to communicate results to contractors and clients. Assistance in running tests on R&D assemblies, working…",Field Application Engineer,Beachwood, OH
367,Rockwell Automation,"Uses personal computer to obtain, organize, and analyze data to prepare charts and reports. This role is in printed circuit board assembly and working on…",Senior Manufacturing Engineer,Twinsburg, OH
368,Geauga County Engineer,"Use proper research methods in gathering data; Assists customers and others with data research, records, etc. Must possess a valid Ohio Driver’s license;",Civil Engineer I,Chardon, OH
369,PatientPoint,Full time position Data Engineer. Build data ingestion & transformation processes to support industry leading data science applications in predictive modeling…,Data Engineer,Cincinnati, OH
370,Whirlpool Corporation,"Controls Engineer, Findlay Manufacturing Plant. Collect data from plant automation. As a Controls Engineer, you will lead new controls/plant automation projects…",Controls Engineer,Findlay, OH
371,TARGET,You will collaborate with Senior Systems Engineers to perform Root Cause Analysis for equipment failures. Utilize handheld devices and asset management system…,MAINTENANCE MECHANIC,West Jefferson, OH
372,Blu Perspective,"The Quality Engineer – Improvement Facilitator. Work directly with Inspection leadership to evaluate each specific defect, analyze reported data and…",Quality Engineer,Findlay, OH
373,CTG (Computer Task Group),Experience with administration or development within common Data Analytics cloud platforms: Strong datacenter architecture skills specific to data / database…,Infrastructure Delivery Specialist,Brooklyn, OH
374,Airgas,"May assist in development, oversight and training of Equipment Engineers and Applications Engineers. Interface internally with regional account managers, bulk…",Applications Engineer,Cleveland, OH
375,Penske,"Ability to analyze data and conduct extensive research required. 5 years of experience as a Logistics Engineer or comparable experience designing, developing,…",Senior Warehousing Engineer,Beachwood, OH
376,"Eccrine Systems, Inc.",Analyzing data and sharing conclusions within the organization. The R&D Engineering Co-op will collaborate with scientists and engineers in tasks and…,Student Co-op - R&D Engineer; Sensors (Spring 2020; Full-time),Cincinnati, OH
377,"Involta, LLC","IT Systems Engineer – Exchange Administrator works as a bridge between customers and engineering teams. Familiarity with data management, including SAN storage…",Systems Engineer- Exchange Administrator,Akron, OH
378,OEConnection,"When reported, data will not identify any specific individual. In just 18 years, OEC has grown globally to more than 1,000 employees with a double-digit revenue…",Software Engineer,Richfield, OH
379,Davey Resource Group,"Select and interpret data, based on design intent. Collaborate with others (project managers, other engineers, clients, technicians, and administration) to…",Entry Level Telecommunications Designer,Kent, OH
380,Encore Technologies,Install and support data network solutions. 10+ years’ experience installing and supporting data network solutions. Must be eligible to work in the U.S.,Network Engineer,Wilmington, OH
381,Dogwood Services Inc.,Reviews completed work to ensure accuracy and compliance with codes and design data. Updates the Chief Process Engineer when problems arise and any personnel…,Piping Design Supervisor,Cleveland, OH
382,"Honda R&D Americas, Inc.",Ability to analyze data and perform trend analysis. The purpose of this program is to educate incoming Engineers on the various facets that create HAM’s…,Engineering Development Program - May 2020 - Safety Engineer,Marysville, OH
383,Bridgestone APM,"Is seeking an experienced Industrial Engineer to join their robust team located in Upper Sandusky, OH. Analyze statistical data and product specifications…",Industrial Engineer,Upper Sandusky, OH
384,Expedient,"Expedient is hiring a Data Center Infrastructure Engineer in Columbus. Perform Telco cross-connect installations (POTS, DS1, DS3, Ethernet, Fiber) to include…",Data Center Infrastructure Engineer,Columbus, OH
385,Procter & Gamble,"The Platform Engineering role will utilize leading edge technologies in MES, DevOps, IoT, Edge computing, Cloud data stores, and Machine Data Analytics.",IT Platform Engineer,Cincinnati, OH
386,Jefferson Industries Corporation,"Collects production data and applies standard scientific and statistical methods to document, analyze and design production process improvements.",KAIZEN ENGINEER,West Jefferson, OH
387,Masergy Communications,"Client data gathering, documentation and technical service order entry. The Solutions Engineer is responsible for pre-sales technical support of Masergy’s…",Solutions Engineer,Ohio,
388,STERIS,"Statistical data base literacy desirable. Prepare presentations with appropriate data and conclusions. The full affirmative action program, absent the data…",Operations Engineer,Mentor, OH
389,Vertiv Co.,"Knowledgeable and proficient with various data analysis and problem solving techniques. Proficient with word processing, (relational) database, data analysis,…",Product Quality Engineer,Delaware, OH
390,Goodyear,"Requires sense of urgency and deliver fact-based data. Conduct global manufacturing and capacity improvement initiatves, such as throughput optimization,…",Senior Industrial Engineer - Simulation,Akron, OH
391,"Honda R&D Americas, Inc.","This would include assisting with problem and data analysis, countermeasures, test set-up, data acquisition, test monitoring and recording activities.",2020 SUMMER - ELECTRICAL ENGINEERING STUDENT OPPORTUNITIES,Raymond, OH
392,US Other Agencies and Independent Organizations,"Professional registration as an engineer. This position is in the Office of Research and Development, Center for Environmental Solutions and Emergency Response,…",Biologist/General Engineer/Physical Scientist,Cincinnati, OH
393,The Talent State Consultant,"Ability to develop supplier development strategies and improvement plans, using available supplier performance data, as well as current and future business…",Supplier Quality / Development Engineer,Mansfield, OH
394,GE Aviation,Document and communicate results of technical data generated. Assure proper documentation and communication of technical data generated for the assigned…,"Engineer, Controls Engineering - hire date early to mid 2020",Evendale, OH
395,Overhead Door Corporation,"Effectively leverage business process understanding, customer data analysis, and quality engineering tools to influence and support business partners to drive…",Quality Engineer,Mount Hope, OH
396,"Area Temps, Inc.","Prepare spreadsheets for compiling and organizing installation data. Must have strong data entry, reporting, and analytical skills.",Client Compliance Sevices Support,Bedford Heights, OH
397,T-CETRA LLC,Create mock data responses from web services. The successful Middleware Engineer will gain valuable experience and participate in QA test case passing processes…,Middleware Developer (DIRECT HIRE),Dublin, OH
398,"SigmaTEK Systems, LLC","SigmaNEST leads the world in nesting systems for fabrication, providing unsurpassed material utilization, motion optimization, manpower efficiency,…",Director of Customer Experience,Cincinnati, OH
399,Procter & Gamble,"Your skills should show experience in design of experiments and a mastery of various statistical methodologies such as multivariate statistics, linear and non…","R&D Statistician, PhD",Cincinnati, OH
400,Giesecke+Devrient,"The Senior Production IT Systems Engineer troubleshoots production computer systems and equipment, both hardware and software, as well as maintains product and…",Production IT Systems Engineer II,Twinsburg, OH
401,US Department of Veterans Affairs,"Professional registration or licensure - Current registration as an Engineer Intern (EI), Engineer in Training (EIT)1, or licensure as a Professional Engineer …",Supervisory General Engineer (Chief of Engineering),Cleveland, OH
402,The Scotts Miracle-Gro Company,Gathering and analyzing data to make recommendations for process improvements to operators and management. Here at Scotts Miracle-Gro there is no such thing as…,"Intern, Process Engineer",Marysville, OH
403,"Vertical Knowledge, LLC","Since day one, our Software Engineers have helped tackle the complex and interesting challenge of discovering value hidden in the world’s data.",Software Engineer,Chagrin Falls, OH
404,BWX Technologies,"Analysis of quality trending data. Quality Assurance Engineer 1 - BWX Technologies, Inc. Quality Assurance Engineer responsible for engineering support of…",QA Engineer 1,Barberton, OH
405,"Honda R&D Americas, Inc.","Experience with HILS and control software rapid-prototyping tools (Matlab/Simulink, dSPACE toolchain, etc.), data acquisition systems (INCA, CANalyzer, etc.).",VEHICLE CONTROL HILS ENGINEER,Raymond, OH
406,The Ohio State University,Working Title Client Support Engineer. Please click either the Next button or you can go to different pages of the application by selecting the page from the…,Systems Developer/Engineer,Columbus, OH
407,Transystems,Work/collaborate with drainage and roadway engineers. Team oriented engineer with strong communication skills. Other duties may be assigned.,Entry Level Bridge Engineer - Cleveland Job,Cleveland, OH
408,Zones,"Workplace Modernization, Network Optimization, Data Center Transformation, and Security Fortification. Treat Client data and infrastructure as if your life…",Data Center Technician,Cleveland, OH
409,"NuVasive, Inc.","Support design for manufacturability analysis with CNC Programmers and Quality Engineers, and provide input to Development (Design) Engineers.",Associate Manufacturing Engineer,Dayton, OH
410,Solize USA Corporation,"Analyze user research data to understand our customers' needs and desires for infotainment systems (in vehicle displays, information, entertainment, controls,…",HMI Research Engineer /Ergonomics Engineer -4036,Marysville, OH
411,BioSource Recruiters,"The Supplier Development Engineer is responsible for identifying technical problems with suppliers, implementing, monitoring and reporting on supplier…",Supplier Development Engineer,Mansfield, OH
412,CDW,"Senior Consulting Engineers at CDW are smart, hard-working Engineers who enjoy teaming with other best and brightest Engineers on highly visible, technically…",Senior Consulting Engineer - Microsoft Unified Communications,Cleveland, OH
413,"EFI Global, Inc.","Consults with management, engineers, and other agencies regarding industrial health problems and solutions. Skilled in organization and interpretation of field…",Industrial Hygienist Advisor Sr,Columbus, OH
414,Battelle,"Aid in the design and implementation of machine learning, data mining, data fusion, and data engineering techniques applied to cyber microelectronics security…",Cyber Trust & Analytics Engineer Graduate Intern (Summer 2020),Columbus, OH
415,Simmers Crane Design & Services,"Ability to collect and interpret data. We work in many different industries such as steel, automotive, power generation, etc. The Civil Structural Engineer…",Civil Engineer,Salem, OH
416,Cameron Craig Group,"The Quality Assurance Engineer (QAE) is an integral part of the Quality team. The QAE will be part of the team that implements, manages, and improves company…",Quality Assurance Engineer,Mentor, OH
417,SNI Technology,Automated test plan creation by creating Gherkin scripts and translating Gherkin into automated test Use of SQL for manual data validation.,"Test Engineer - 5077 in Orville, OH",Orrville, OH
418,Goodyear,"Perform data queries, analyze data in Excel spreadsheets or other forms. Conduct plant compound sample management including requests, lab studies & test data…",Engineering Technician,Akron, OH
419,DuPont,The Quality Engineer generates and maintains quality data and metrics and drives continuous improvement. ISO 9001:2015) and the controls necessary to achieve…,Quality Engineer,Dayton, OH
420,Cardinal Health,"Builds data marts and data models to support Data Science and other internal customers. Help design data models, perform associated data engineering activities…",Cloud/Data Engineer,Dublin, OH
421,Cedar Point,"Has primary responsibility to ensure all systems, all data types, software, hardware, configurations and documentation are backed up properly.",Sr. Systems Engineer,Sandusky, OH
422,"Honda R&D Americas, Inc.","This would include assisting with problem and data analysis, countermeasures, test set-up, data acquisition, test monitoring and recording activities.",2020 SPRING - ELECTRICAL ENGINEERING STUDENT OPPORTUNITIES,Raymond, OH
423,TRC,"TRC is seeking a motivated entry-level engineer to join the air quality consulting group in its Cincinnati, OH office.",Entry level Air Quality Engineer,Cincinnati, OH
424,General Electric,"In addition, as the Additive CAD Engineer, you will: This position is for the Additive CAD Engineer role at GE Aviation's Additive Technology Center.",Additive CAD Engineer,West Chester, OH
425,STERIS,The Senior Engineer has greater authority over assignments and decisions required to complete work and will serve as a mentor to the lower classification…,Senior Engineer,Mentor, OH
426,Applied Optimization,"To be a key member of an interdisciplinary research and development team that generates simulation data, analyzes experimental data and, implements next…",Mechanical Engineer,Fairborn, OH
427,Recruiters Network,"The Quality Assurance Engineer (QAE) is an integral part of the Quality team. The QAE will be part of the team that implements, manages, and improves company…",Quality Assurance Engineer,Mentor, OH
428,CGB Enterprises Inc,"Data mining permits, regulations, plans and compliance documents to determine impacts on company operations and practices. Are you passionate about compliance?",Environmental Analyst,Cincinnati, OH
429,Battelle,"Aid in the design and implementation of machine learning, data mining, data fusion, and data engineering techniques applied to cyber microelectronics security…",Cyber Trust & Analytics Engineer Graduate Co-Op (Spring 2020),Columbus, OH
430,"SigmaTEK Systems, LLC","SigmaNEST leads the world in nesting systems for fabrication, providing unsurpassed material utilization, motion optimization, manpower efficiency,…",SigmaTEK Talent Network,Cincinnati, OH
431,Confidential Priviately-Held Company,Develops applications for data migration and maintenance. This position will work with application and system engineers to create scalable and repeatable SQL…,SQL Server DBA,Columbus, OH
432,"Amotec, Inc.","Experience in manufacturing data collection and analysis including statistical methods, Design of Experiments, and the use of statistical software or Microsoft…",Manufacturing Engineer Opening,Berlin Heights, OH
433,Veeva Systems,"Veeva is currently seeking a talented Sustaining Engineer in Columbus, Ohio, to join our Data Platform Team. As a Sustaining Engineer, you will be charged with…",Sustaining Engineer – Data Platform,Columbus, OH
434,Seamless.AI,3 - 5+ years of professional (not academic) experience in data science and/or big data. Strategic thinker and problem solver to develop data science strategies…,Data Scientist/Engineer,Columbus, OH
435,Olympus,"He/she should be expected to also work independently with minimal supervision in the lab, summarizing data, and writing technical reports.",Co-Op,Norwalk, OH
436,Knorr-Bremse North America,"Engineer 2-3, Product (Driver Assistance). Ability to assimilate data quickly. Interface with customers, software developers, systems engineers and management…","Engineer 2-3, Product (Driver Assistance)",Elyria, OH
437,Veeam Software,Recognition—we prefer to promote engineers internally. So if you’re looking for a fast-moving tech support engineer role with a team that’s outpacing the…,Junior Technical Support Engineer,Columbus, OH
438,STERIS,Review collected data to perform statistical analysis and recommend process / product changes to improve quality. Perform all other duties as assigned.,"Senior Quality Engineer, Healthcare",Mentor, OH
439,Root Insurance Company,"Data science or data analysis. As a telematics engineer you’ll be working to improve or change how we collect, upload, and analyze trips.",iOS Telematics Engineer,Columbus, OH
440,City of Columbus,"Prepares technical reports and support data; Possession of a valid Engineer Intern certificate. Under general supervision of a Professional Engineer, is…",Engineer-In-Training II (Vacancy),Columbus, OH
441,Minerva Analytics,Works with engineers + analysts to resolve bugs. Develop test data necessary to execute test cases. Educate other engineers on how to write effective tests for…,QA Tester,Minerva, OH
442,City of Cincinnati,"Analyze and interpret field data. The position will supervise professional engineers, engineer interns and other staff who are primarily dedicated to managing…",SUPERVISING ENGINEER,Cincinnati, OH
443,RCI for Confidential Companies (hosted jobs),Troubleshootand debug automotive hybrid powertrain systems while training quality andmanufacturing engineers about the product.,Design Engineer,Dayton, OH
444,EWI,"Work with and support engineers, technicians, and engineering managers across multiple disciplines. Ensure that project execution (periodic stakeholder…",Welding Engineer- Project Manager,Columbus, OH
445,"Advint, LLC",Communicating with engineers and other coworkers. Experience operating automated test or data acquisition systems. Following verbal and written instructions.,Electronics Assembler,Reynoldsburg, OH
446,Kirila Fire,"Draws charts for representation of statistical data. Work directly with engineers to produce drawings from sketches, existing drawings and electronic images.",Mechanical Designer,Fowler, OH
447,Parker Hannifin Corporation,"Develops and manages the high level infrastructure for the collection, management, transfer and storage of process data 4. Bachelor degree (BS) in engineering;",Additive Manufacturing Engineer,Mentor, OH
448,PACCAR,"Models physical/application data requirements in a data model tool, such as ERWin data modeler • Teaches data modeling and data design concept to IT and…",Data Engineer,Chillicothe, OH
449,KORE,We are looking for a dynamic Data Engineer to help with KORE's data pipeline architecture and to help us get to a new level with our data analytics!,Data Engineer,Blue Ash, OH
450,PARKER HANNIFIN CORP,Bachelor’s degree (BS) (or Professional Engineer (PE) certificate) in engineering or a science technical discipline; Identifies mentoring and development needs;,"Aerospace - Project Engineer, Aircraft Carbon Brakes & Wheels",Avon, OH
451,PepsiCo,"Planned and unplanned downtime, rate, yield, and quality loss data collection methodology, analysis, interpretation and opportunity analysis.",Process Improvement Engineer,Cincinnati, OH
452,Consolidated Precision Products,The Process Engineer is a key member of engineering team. Metallurgist or Process Engineer in the DS/SX investment casting industry.,Process Engineer,Eastlake, OH
453,Current & GE Lighting,Provide technical guidance and mentoring to less experienced engineers. Lead data analysis and collaborate with product owners and managers to evolve cloud…,Lead Cloud Engineer - Connected Devices,Cleveland, OH
454,Lantratech,Prepare mathematical CAD surface data for vehicle body parts to conduct various Computer Aided Engineering simulation work;,CAE Engineer,Worthington, OH
455,Nidec Motor Corporation,"The Project Engineer directs and coordinates the planning, organization, control, integration, and completion of assigned engineering projects.",Project Engineer,Akron, OH
456,"TMSI, LLC",We are looking for a seasoned Software/Controls Engineer to join our team! Create programming libraries to interface to machine control and data acquisition…,Software Engineer - Industrial,Cleveland, OH
457,Leidos,"Leidos Inc., has an exciting opportunity for a Remediation Engineer. Responsibilities include review and analysis of engineering, hydrogeological, and chemical…",Remediation Engineer,Twinsburg, OH
458,"APPLIED SCIENCES, INC","Demonstrate a basic understanding of technical protocols and procedures, and record and report data with direct guidance. A mechanical aptitude is desirable.",Chemistry Technician,Cedarville, OH
459,"Opportunity Search, Inc.","Assess processes, perform measurements, and interpret data. The process engineer will research and purchase equipment or upgrades to existing equipment.",Process Engineer,Toledo, OH
460,Jobot,"We are a K12 analytic, assessment & data management solutions provide a foundation for standards-based learning and teacher data. This Jobot Job is hosted by:",Software Engineer,Cincinnati, OH
461,Acumen Solutions,"Document data and testing results. Experience with data management and manipulation. We are a global cloud consultancy combining the insight of our strategists,…",Integration Tester,Cleveland, OH
462,Lubrizol Corporation,Responsible (as part of a broader team) to ensure the core data networks at Lubrizol's main four regional data centers have the proper and cost-effective…,Network Engineer,Wickliffe, OH
463,Materion,"Computer proficiency, including spreadsheets and data analysis. Provide data analysis, statistical quality control, and statistical process control.",Manufacturing Engineer- Primary Operations,Elmore, OH
464,Facebook,"This position is full-time and based in our New Albany, OH data center. Deployment, configuration, and management of all network infrastructure on our data…","Network Engineer, Deployment & Support",New Albany, OH
465,SAINT-GOBAIN,"Expertise in Industrial 4.0 areas such a vision systems, automated inspection, and data analysis. Strong knowledge of Quality Sciences (RCCA, Problem Solving,…",Quality Engineer,Cleveland, OH
466,"Eccrine Systems, Inc.",Analyzing data and sharing conclusions within the organization. The R&D Engineering Co-op will collaborate with scientists and engineers in tasks and…,Student Co-op - R&D Engineer/Scientist; Device Integration (Spring 2020; Full-time),Cincinnati, OH
467,FLUOR-BWXT PORTSMOUTH,"Supports Radiation Protection functional areas such as sampling, data capture, entry and analysis support, documentation, procedure update, report preparation,…",RP Engineer Principal,Piketon, OH
468,Penske,Ability to analyze data and conduct extensive research required. The Logistics/Packaging Engineer is responsible for participating in logistics analysis and…,Logistics/Packaging Engineer,Beachwood, OH
469,JP Morgan Chase,"Data protection, replication, reconciliation, and distribution. Experience with Spark/Spark Streaming (Big Data). BS/BA degree or equivalent experience.",Software Engineer - Big Data,Columbus, OH
