company|description|position|reviews|Region|City|State
Micron Technology, Inc.|"Req. ID: 143828

Data Scientist

Micron Technology's vision is to transform how the world uses information to enrich life and our commitment to people, innovation, tenacity, collaboration, and customer focus allows us to fulfill our mission to be a global leader in memory and storage solutions. This means conducting business with integrity, accountability, and professionalism while supporting our global community.

As a Data Scientist at Micron's Smart Manufacturing and Artificial Intelligence Organization, you will be working on multidisciplinary projects using groundbreaking data science skills. You will be collaborating with a Worldwide Data Science Team to design and build Big Data tools, models, and analytics to unlock business value from data in-sights. You will have the opportunity and expectation to continuously improve skills and explore new top tier technology and creatively deliver solutions to manufacturing operations to meet our best in class goals.

Responsibilities and Tasks



Work with an international team of data scientists, data engineers, software engineers, process and equipment engineers, process integration engineers, yield enhancement engineers, R&D, etc. in a collaborative manner to develop new data science solutions that improve quality, improve yield, reduce deviations, improve manufacturing cycle time, reduce cost, extend manufacturing capabilities, etc.
Draw from a broad background of data-mining techniques in mathematics, statistics, information technology, machine learning, data engineering, design of experiments (DOE), visualization, etc. to discover insightful patterns in semiconductor manufacturing data
Work on projects and develop solutions that would be of high impact to various areas at all manufacturing fabs
Work closely with IT and Suppliers on data management, requirements gathering, accessing and preparing necessary data, and working with data scientists to build machine learning models.
Developing new or improving prior data acquisition and ETL pipelines from various sources into the ecosystem.
Working with various scientific data such as equipment sensor data and logs, image and various types of signals, manufacturing process data, etc. to extract meaningful information for analytics
Crafting intuitive user interfaces for interactive data visualization to explain insights from data

Qualifications

At least 5 years of work experience in data science solution implementation
Full stack development experience prefers though not a must
PhD in Mathematics, Statistics, Machine Learning or related field
Superb communication skills with a demonstrable ability to lead multiple teams/projects in parallel, reporting to senior leaders
Strong analytical and creative problem-solving skills
Strategically focused, impact oriented, highly organized and adaptable.


About Us

As the leader in innovative memory solutions, Micron is helping the world make sense of data by delivering technology that is transforming how the world uses information. Through our global brands Micron, Crucial and Ballistix we offer the industry's broadest portfolio. We are the only company manufacturing today's major memory and storage technologies: DRAM, NAND, NOR and 3D XPoint memory. Our solutions are purpose built to leverage the value of data to unlock financial insights, accelerate scientific breakthroughs and enhance communication around the world.

Micron Benefits

Employee Rewards Program, Healthcare, Paid time off (Combined Sick and Vacation Time), Retirement savings plans, Paid maternity/paternity leave, Employee Assistance Program, Professional development training, Workplace wellness programs, Micron Health Clinic (Boise only), Fitness Center / Activity rooms (Boise only), Tuition Reimbursement, Micron Corporate Discounts, Casual Dress attire.

All qualified applicants will receive consideration for employment without regard to race, color, religion, sex, sexual orientation, gender identity, national origin, veteran or disability status.

For US Sites Only: To request assistance with the application process and/or for reasonable accommodations, please contact Micron's Human Resources Department at 1-800-336-8918 or 208-368-4748 and/or by completing our General Contact Form

All qualified applicants will receive consideration for employment without regard to race, color, religion, sex, sexual orientation, gender identity, national origin, veteran or disability status.

For US Sites Only: To request assistance with the application process and/or for reasonable accommodations, please contact Micron's Human Resources Department at 1-800-336-8918 or 208-368-4748 and/or by completing our General Contact Form

Keywords: Boise || Idaho (US-ID) || United States (US) || SGA || Experienced || Regular || Information Systems and Technology || #LI-JF1 || Tier 4 ||SDL2017"|data scientist|4|West|Boise| ID
Vacasa|"Why Vacasa

We started with just one home and an idea: to bring homeowners and renters together with smart technology and caring local teams. Today, we're the largest full-service vacation rental company in North America thanks to the people who give us their best every day. You'll fit right in here if you're curious, entrepreneurial, and thrive in a rapid-growth environment.

Why Data Science at Vacasa

We apply complex theories to real-world problems, designing data-driven systems to make the business-critical decisions humans aren't capable of. Our close-knit team lives for experimentation, celebrates when we find the answer, and learns together if it's different than we predicted.

What we're looking for

If you are a data scientist but you're also more than a data scientist, this role might be for you. We're looking for someone who is highly analytical and data driven, but also business-minded, practical and user focused to serve in this role that is inherently cross-functional.

What you'll do

You'll use your data science skills and user empathy to uncover insights that will fuel our next round of product innovation. Your day to day might consist of digging deep into web analytics data, evaluating the results of an SEO experiment, our using python and jupyter notebook or even Spark to build a simple machine learning model to predict which guests are going to re-book. Sitting on a cross-functional team composed of UX, engineering, data science, product management, marketing, and analytics, you'll get to see a lot and bring your own ideas and analyses to help us do everything better.

Skills you'll need

Python - Intermediate to advanced
SQL - Intermediate to advanced
Machine-learning - Intermediate level
Statistics - Intermediate level
Ecommerce experience a plus
Experience with web analytics data a plus

What you'll get

Health/dental/vision insurance—100% coverage option
401K retirement savings plan with up to a 6% company match
Vacation time
Paid sick leave and holidays
Career advancement opportunities
Employee discounts
All the equipment you'll need to be successful
Great colleagues and culture
"|data scientist|5|West|Boise| ID
Micron|" Req. ID: 146013   Micron Technology’s vision is to transform how the world uses information to enrich life and our commitment to people, innovation, tenacity, collaboration, and customer focus allows us to fulfill our mission to be a global leader in memory and storage solutions. This means conducting business with integrity, accountability, and professionalism while supporting our global community. As a Smart Manufacturing & AI Data Scientist at Micron Technology, Inc., you will work in a world-class team of data engineers, business intelligence experts, and software engineers to discover data insights that are unobservable in traditional business solutions. You will draw from a broad background of data-mining techniques in mathematics, statistics, information technology, machine learning, data engineering, design of experiments, visualization, and text mining to discover insightful patterns in data. In this position, you will take on exciting projects from across enterprise business processes to bring data science methods to opportunities in sales, supply chain, finance, corporate strategy, marketing, and other business areas. Responsibilities include, but not limited to:Strong understanding of business strategy to develop a clear vision of data scienceCollaborate with data scientists, data engineers and business process experts to access existing data in data warehouse and big data environmentsThe ability to develop, tune, and deploy predictive models that explain or predict business outcomesPrepare and deliver presentations with data visualizations and business conclusions Minimum Qualifications:Masters in Computer Science, Engineering, Economics, Mathematics, Statistics or another Research Science, or a BS and at least two years relevant experienceStrong knowledge and experience with R, Python or other statistical softwareFamiliarity with core techniques in statistical and machine learning, including regularized regression, time series analysis, decision trees, boosting algorithms, neural networks, frequentist and Bayesian inference, power calculation and experimental design, clustering, collaborative filtering, NLP, cross-validation and bootstrapping, and data visualizationYou have strong interpersonal skills and maintain positive relationships with colleaguesYou are proactive and collaborate effectively in a rapidly changing environment About UsAs the leader in innovative memory solutions, Micron is helping the world make sense of data by delivering technology that is transforming how the world uses information. Through our global brands — Micron, Crucial and Ballistix — we offer the industry’s broadest portfolio. We are the only company manufacturing today’s major memory and storage technologies: DRAM, NAND, NOR and 3D XPoint™ memory. Our solutions are purpose built to leverage the value of data to unlock financial insights, accelerate scientific breakthroughs and enhance communication around the world. Micron BenefitsEmployee Rewards Program, Healthcare, Paid time off (Combined Sick and Vacation Time), Retirement savings plans, Paid maternity/paternity leave, Employee Assistance Program, Professional development training, Workplace wellness programs, Micron Health Clinic (Boise only), Fitness Center / Activity rooms (Boise only), Tuition Reimbursement, Micron Corporate Discounts, Casual Dress attire.  All qualified applicants will receive consideration for employment without regard to race, color, religion, sex, sexual orientation, gender identity, national origin, veteran or disability status.For US Sites Only: To request assistance with the application process and/or for reasonable accommodations, please contact Micron’s Human Resources Department at 1-800-336-8918 or 208-368-4748 and/or by completing our General Contact FormKeywords: Boise || Idaho (US-ID) || United States (US) || Technology Development || College || Regular || Engineering || #LI-SC2 || Tier 4 || "|data scientist|0|West|Boise| ID
