company|description|position|reviews|Region|City|State
Vacasa|"Why Vacasa

We started with just one home and an idea: to bring homeowners and renters together with smart technology and caring local teams. Today, we're the largest full-service vacation rental company in North America thanks to the people who give us their best every day. You'll fit right in here if you're curious, entrepreneurial, and thrive in a rapid-growth environment.

Why Data Science at Vacasa

We apply complex theories to real-world problems, designing data-driven systems to make the business-critical decisions humans aren't capable of. Our close-knit team lives for experimentation, celebrates when we find the answer, and learns together if it's different than we predicted.

What we're looking for

If you are a data scientist but you're also more than a data scientist, this role might be for you. We're looking for someone who is highly analytical and data driven, but also business-minded, practical and user focused to serve in this role that is inherently cross-functional.

What you'll do

You'll use your data science skills and user empathy to uncover insights that will fuel our next round of product innovation. Your day to day might consist of digging deep into web analytics data, evaluating the results of an SEO experiment, our using python and jupyter notebook or even Spark to build a simple machine learning model to predict which guests are going to re-book. Sitting on a cross-functional team composed of UX, engineering, data science, product management, marketing, and analytics, you'll get to see a lot and bring your own ideas and analyses to help us do everything better.

Skills you'll need

Python - Intermediate to advanced
SQL - Intermediate to advanced
Machine-learning - Intermediate level
Statistics - Intermediate level
Ecommerce experience a plus
Experience with web analytics data a plus

What you'll get

Health/dental/vision insurance—100% coverage option
401K retirement savings plan with up to a 6% company match
Vacation time
Paid sick leave and holidays
Career advancement opportunities
Employee discounts
All the equipment you'll need to be successful
Great colleagues and culture
"|data scientist|5|West|Boise| ID
Micron|" Req. ID: 146013   Micron Technology’s vision is to transform how the world uses information to enrich life and our commitment to people, innovation, tenacity, collaboration, and customer focus allows us to fulfill our mission to be a global leader in memory and storage solutions. This means conducting business with integrity, accountability, and professionalism while supporting our global community. As a Smart Manufacturing & AI Data Scientist at Micron Technology, Inc., you will work in a world-class team of data engineers, business intelligence experts, and software engineers to discover data insights that are unobservable in traditional business solutions. You will draw from a broad background of data-mining techniques in mathematics, statistics, information technology, machine learning, data engineering, design of experiments, visualization, and text mining to discover insightful patterns in data. In this position, you will take on exciting projects from across enterprise business processes to bring data science methods to opportunities in sales, supply chain, finance, corporate strategy, marketing, and other business areas. Responsibilities include, but not limited to:Strong understanding of business strategy to develop a clear vision of data scienceCollaborate with data scientists, data engineers and business process experts to access existing data in data warehouse and big data environmentsThe ability to develop, tune, and deploy predictive models that explain or predict business outcomesPrepare and deliver presentations with data visualizations and business conclusions Minimum Qualifications:Masters in Computer Science, Engineering, Economics, Mathematics, Statistics or another Research Science, or a BS and at least two years relevant experienceStrong knowledge and experience with R, Python or other statistical softwareFamiliarity with core techniques in statistical and machine learning, including regularized regression, time series analysis, decision trees, boosting algorithms, neural networks, frequentist and Bayesian inference, power calculation and experimental design, clustering, collaborative filtering, NLP, cross-validation and bootstrapping, and data visualizationYou have strong interpersonal skills and maintain positive relationships with colleaguesYou are proactive and collaborate effectively in a rapidly changing environment About UsAs the leader in innovative memory solutions, Micron is helping the world make sense of data by delivering technology that is transforming how the world uses information. Through our global brands — Micron, Crucial and Ballistix — we offer the industry’s broadest portfolio. We are the only company manufacturing today’s major memory and storage technologies: DRAM, NAND, NOR and 3D XPoint™ memory. Our solutions are purpose built to leverage the value of data to unlock financial insights, accelerate scientific breakthroughs and enhance communication around the world. Micron BenefitsEmployee Rewards Program, Healthcare, Paid time off (Combined Sick and Vacation Time), Retirement savings plans, Paid maternity/paternity leave, Employee Assistance Program, Professional development training, Workplace wellness programs, Micron Health Clinic (Boise only), Fitness Center / Activity rooms (Boise only), Tuition Reimbursement, Micron Corporate Discounts, Casual Dress attire.  All qualified applicants will receive consideration for employment without regard to race, color, religion, sex, sexual orientation, gender identity, national origin, veteran or disability status.For US Sites Only: To request assistance with the application process and/or for reasonable accommodations, please contact Micron’s Human Resources Department at 1-800-336-8918 or 208-368-4748 and/or by completing our General Contact FormKeywords: Boise || Idaho (US-ID) || United States (US) || Technology Development || College || Regular || Engineering || #LI-SC2 || Tier 4 || "|data scientist|0|West|Boise| ID
Amazon|Excited by using massive amounts of data to develop Machine Learning (ML) and Deep Learning (DL) models? Want to help the largest global enterprises derive business value through the adoption of Artificial Intelligence (AI)? Eager to learn from many different enterprises use cases of AWS ML and DL? Zealous to be key part of Amazon, who has been investing in Machine Learning for decades, pioneering and shaping the worlds AI technology?At Amazon Web Services (AWS), we are helping large enterprises build ML and DL models on the AWS Cloud. We are applying predictive technology to large volumes of data and against a wide spectrum of problems. Our Professional Services organization works together with our AWS customers to address their business needs using AI.AWS Professional Services is a unique consulting team. We pride ourselves on being customer obsessed and highly focused on the AI enablement of our customers. If you have experience with AI, including building ML or DL models, wed like to have you on our team. You will get to work with an innovative company, with great teammates, and have a lot of fun helping our customers.This role will focus specifically on AWS most complex and largest customers in the world to help solve a wide range of business problems. Consultants will provide deep and broad insight to customers and partners to help remove constraints that prevent them from leveraging AWS services to create strategic value.A successful candidate will be a person who enjoys diving deep into data, doing analysis, discovering root causes, and designing long-term solutions. It will be a person who likes to have fun, loves to learn, and wants to innovate in the world of AI.Major responsibilities include:· Understand the customers business need and guide them to a solution using our AWS AI Services, AWS AI Platforms, AWS AI Frameworks, and AWS AI EC2 Instances .· · Assist customers by being able to deliver a ML / DL project from beginning to end, including understanding the business need, aggregating data, exploring data, building & validating predictive models, and deploying completed models to deliver business impact to the organization.· · Use Deep Learning frameworks like MXNet, Caffe 2, Tensorflow, Theano, CNTK, and Keras to help our customers build DL models.· · Use SparkML and Amazon Machine Learning (AML) to help our customers build ML models.· · Work with our Professional Services Big Data consultants to analyze, extract, normalize, and label relevant data.· · Work with our Professional Services DevOps consultants to help our customers operationalize models after they are built.· · Assist customers with identifying model drift and retraining models.· · Research and implement novel ML and DL approaches, including using FPGA.· This is a customer facing role. You will be required to travel to client locations and deliver professional services when needed.Note: If you do not live in a market where we have an open Data Scientist position, please feel free to apply. Our Data Scientists can live in any location that has an AWS office.Basic Qualifications· A Bachelor or Masters Degree in a highly quantitative field (Computer Science, Machine Learning, Operational Research, Statistics, Mathematics, etc.) or equivalent experience· 4+ years of industry experience in predictive modeling, data science and analysis· Previous experience in a ML or data scientist role and a track record of building ML or DL models· Experience using Python and/or R· Experience using ML libraries, such as scikit-learn, caret, mlr, mllib· Experience in writing and tuning SQL· Experience with SparkML· Experience working with GPUs to develop model· Experience handling terabyte size dataset· Experience using data visualization toolsPreferred Qualifications· PhD in a highly quantitative field (Computer Science, Machine Learning, Operational Research, Statistics, Mathematics, etc.)· 4+ years of industry experience in predictive modeling and analysis· Skills with programming languages, such as Java or C/C++· Ability to develop experimental and analytic plans for data modeling processes, use of strong baselines, ability to accurately determine cause and effect relations· Consulting experience and track record of helping customers with their AI needs· Publications or presentation in recognized Machine Learning, Deep Learning and Data Mining journals/conferences· Experience with AWS technologies like Redshift, S3, EC2, Data Pipeline, & EMR· Combination of deep technical skills and business savvy enough to interface with all levels and disciplines within our customers organization· Demonstrable track record of dealing well with ambiguity, prioritizing needs, and delivering results in a dynamic environment· Experience diving into data to discover hidden patterns· Able to write production level code, which is well-written and explainableAmazon is an Equal Opportunity Employer Minority / Women / Disability / Veteran / Gender Identity / Sexual Orientation / Age.|data scientist|0|West|Boise| ID
Idaho National Laboratory|"DescriptionJob Information

Job Title: Data Scientist

Grade: 200/210

Org: Advanced Data Analytics

Contact: (see application details)

Work Location: Idaho Falls, ID (Town, Work Schedule - 9X80's)

Mission/Vision Statement

Changing the World's Energy Future by Breaking Ground on New Technology

Mission: Discover, demonstrate and secure innovative nuclear energy solutions, other clean energy options and critical infrastructure.

Vision: INL will change the world's energy future and secure our critical infrastructure.

Equal Employment Opportunity

Idaho National Laboratory (INL) is an Equal Employment Opportunity (EEO) employer. It is the policy of INL to provide equal employment opportunities to all qualified applicants without regard to race, color, religion, sex, sexual orientation, gender identity, national origin, age, protected veteran or disabled status, or genetic information.

Women and People of Color are strongly encouraged to apply.</p>Responsibilities

The Department is an international leader in the application of scientific methods, techniques and tools to address the performance and operational challenges of mission-critical industries. The Department employs specialized methods and state-of-the-art data analysis and modeling tools to support the INL's mission by ensuring the nation's safe, competitive, and sustainable use of engineered systems in many domains by applying our capabilities to impactful issues in risk, reliability, and operational performance.

You will: Support the Department and INL in research and development activities. Demonstrate effective research skills and the ability to collaborate and partner with other government agencies, academia, and private sector companies to achieve project objectives. Work with a multi-disciplinary team of scientists and engineers on challenging work scope. Communicate effectively both verbally and in writing with management, co-workers, and with customers. Publish results of research and development in a mix of refereed publications and conference proceedings. Work effectively with other research teams to develop and manage cross-cutting technical programs for a variety of customers.

The position specifically seeks a data scientist with the following qualifications. Software skills are desirable.

Basic Qualifications (Required):
 MS or PhD in Engineering, Mathematics, Computer Science, Physics, Autonomy, Artificial Intelligence or related technical disciplines
 Ability to obtain a U.S. Security Clearance
 Minimum of 3 years demonstrated ability with data science platforms and software (e.g., Tableau, Jupyter Notebook, R, Python, Matlab, SAS, etc.)
 Demonstrated ability with SQL, noSQL, and graph databases
 Demonstrated experience in data science, data analysis, and software development
 Experience with cloud services and cloud-based analytics is a plus (AWS, Azure, Databricks, etc.)
 Minimum of 2 years of experience contributing to winning proposals and funded projects for research customers at DOD and/or DOE
 Strong demonstrated communications skills and experience presenting to stakeholders and customers
 Must be a self-starter, with a focus on continuous learning; and enjoys collaborating to discovery innovative ways to solve challenges
 Must be able to work in a culturally diverse environment</p>

QualificationsBachelor's degree and 2 years relevant experience, or Master's degree and 1 year relevant experience, or Doctorate with 0 years' experience. Degree must be in a field closely related to statistics, computer science, physics, engineering, or data analytics.

Must be able to obtain and maintain a DOE Security Clearance.

Selective Service Requirements

To be eligible for employment at INL males between ages 18 and 25 must register (or must have registered) with the Selective Service System (SSS). This includes U.S. born and naturalized citizens, parolees, undocumented immigrants, legal permanent residents, asylum seekers, refugees, and all males with visas of any kind which expired more than 30 days ago. The few individuals who are exempt from this requirement are those on current non-immigrant visas. For more information see www.sss.gov .</p> </p>Employee Job Functions

Employee Job Functions are physical actions and/or working conditions associated with the position. These functions may also constitute essential functions for the job position which the employee must be able to fulfill, with or without accommodation. Information provided below is to help describe the job so that the applicant has a reasonable understanding of the job duties/expectations. An applicant's ability to perform and/or tolerate these actions and conditions will be discussed and workplace accommodations may be made on a case-by-case basis following an individualized assessment of the applicant and other considerations, including but not limited to any governing safety standards.

Special Senses: Visually demanding work.

Work Conditions: Stairs.

Please Apply Before:December 14, 2019 (Midnight)

Environmental, Safety and Health Statement

Must be familiar with, and comply with all relevant health and safety requirements. Must be knowledgeable of emergency action policies and procedures, methods for reporting/resolving work practices or conditions to available cognizant professionals.

Other Information

When applying to positions please provide a resume and answer all questions on the following screens. Applicants, who fail to provide a resume or answer the questions, may be deemed ineligible for consideration.

INL Overview

INL is a science-based, applied engineering national laboratory dedicated to supporting the U.S. Department of Energy's mission in nuclear energy research, science, and national defense. With more than 4,300 scientists, researchers and support staff, the laboratory works with national and international governments, universities and industry partners to discover new science and develop technologies that underpin the nation's nuclear and renewable energy, national security and environmental missions.

The Idaho Falls Area

Idaho Falls is conveniently situated near many national treasures such as Yellowstone National Park, Teton National Park, Jackson, WY, etc. For more information about the area, please visit www.visitidahofalls.com and www.visitidaho.org."|data scientist|5|West|Idaho Falls| ID
Micron Technology|"Req. ID: 139947

Micron Technology’s vision is to transform how the world uses information to enrich life and our commitment to people, innovation, tenacity, collaboration, and customer focus allows us to fulfill our mission to be a global leader in memory and storage solutions. This means conducting business with integrity, accountability, and professionalism while supporting our global community.

As a Data Scientist Intern at Micron, you will learn about the exciting field of complex data analysis, using state of the art solution to monitor and improve next generation memory solutions. We will enable this with ground breaking approaches and next generation data analysis solutions.Responsibilities:

Reviewing and analyzing experimental DOEs looking for measurement anomalies and quarantining process tools that are out of controlPossess a continuous improvement process (CIP) attitude, looking for ways to improve the predictive model, and how to make a difference today!Recognize, identify, and raise awareness of data anomalies with the motivation of ""who needs to know this now!""We want our intern to use statistical modeling that seek the problems that inhibit yield improvementYou will uncover patterns in the data from which predictive models, actionable insights or solutions can be developed with the mindset of ""how can I improve this?""""Learn how our customers use the data today with the intent of improving the user experienceDevelop a good understanding of how the feedback loops work with key customers by building positive relationshipsWe expect active participation in technical meetings and then synthesize from it new opportunities or novel approaches

Successful candidates for this position will have:

Pursuing a MS/PhD Degree in Computer Science, Data Science, Machine Learning, or related field. Semiconductor industry experience is helpful; however, other engineering or related disciplines may be considered. Gradution date cannot be prior to September 2020. This internship is intended for Summer 2020.Machine learning and other advanced analytical methodsHadoop, Snowflake, Teradata and/or another SQL databasesGood data summary and social skills with a strong attention to detailWorking with time series data, images, and data with frequently changing distributions is a plusWe need strong critical thinking, prioritization, and analytical skills while providing insights to drive strategic direction

About Us

As the leader in innovative memory solutions, Micron is helping the world make sense of data by delivering technology that is transforming how the world uses information. Through our global brands - Micron, Crucial and Ballistix - we offer the industry's broadest portfolio. We are the only company manufacturing today's major memory and storage technologies: DRAM, NAND, NOR and 3D XPoint™ memory. Our solutions are purpose built to leverage the value of data to unlock financial insights, accelerate scientific break throughs and enhance communication around the world.

We recruit, hire, train, promote, discipline and provide other conditions of employment without regard to a person's race, color, religion, sex, age, national origin, disability, sexual orientation, gender identity and expression, pregnancy, veteran’s status, or other classifications protected under law. This includes providing reasonable accommodation for team members' disabilities or religious beliefs and practices.

Each manager, supervisor and team member is responsible for carrying out this policy. The EEO Administrator in Human Resources is responsible for administration of this policy. The administrator will monitor compliance and is available to answer any questions on EEO matters.

To request assistance with the application process, please contact Micron’s Human Resources Department at 1-800-336-8918 (or 208-368-4748).

Keywords: Boise || Idaho (US-ID) || United States (US) || Technology Development || Intern || Internship || Engineering || Not Applicable ||"|data scientist intern|6|West|Boise| ID
