company|description|position|reviews|Region|City|State
United Global Technologies|"The Data Analytics Report Builder will assist in the design and implementation of analytics reporting capabilities for the client. Reports will primarily be designed and delivered using Power BI and other Microsoft based technologies.

Must be able to work with customers on requirements gathering, report building, and report deploying.

Must understand what visualizations best represent data and overall dashboard design.

Must have strong knowledge of Power BI data querying and modeling capabilities.

Must be able to design, build, and deploy Power BI reports based off of multiple data sets.

Must be able to maintain and enhance active Power BI reports.

Must be able to train business users on using Power BI reports.

Must be able to manage multiple priorities while maintaining consistency.

Must be able to work in groups and communicate well.

Broad experience in data visualization and reporting technologies (including non- digital) is preferred.- provided by Dice"|data analyst|5|West|Idaho Falls| ID
Intuit|"OverviewAre you passionate about data? Do you enjoy working with other smart people to find trends and patterns in the data? Do you want to work in a data-driven environment where your effort impacts the success of the customers? We are looking for a savvy Data Analyst to join our close knit team of data professionals. You look to expand your knowledge and experience in data extraction, visualization, and story-telling. You must be courageous but not a bully, strong but not rude and humble but not timid. In a couple words, emotionally intelligent.ResponsibilitiesPartner

Consult and provide data driven recommendations on key business decisions and initiativesProactively monitor and communicate opportunities on key performance indicators and metricsBuild cross-functional relationships with business units to ensure long-term partnership successSupport our Product Managers, Sales Leaders, Software Developers, Data Engineers, Data Scientists and key business partners on business initiatives and ensure successful partnerships with each teamPartner with the data warehouse team in gathering requirements, designing, testing, and supporting the ongoing development of the data warehouseDrive a data fluent culture by educating and mentoring others in the field of data analysis


Build

Manage and track a variety of tasks and projects at one timeEngage with Agile framework / Scrums / Sprints / JIRADevelop and maintain reports / dashboards / analysis using Periscope Data, Tableau, and other BI development toolsDocument and adhere to standard analytics and reporting processesCommunicate findings clearly to stakeholders through intelligent visualizations, interpretation and story-tellingParticipate in the development process through the lense of data availability, consistency and completeness

Qualifications

Excellent analytical and problem-solving skillsExperienced with writing SQLExperienced with BI and analytics tools (Tableau, Power BI, Periscope Data, Excel, etc.)Proficient with Excel pivot tables, v-lookups, and functionsAbility to process requests, implement recommended solutions, and complete requests in a timely fashionExcellent verbal and written communication skillsBe self-directed and able to function both independently and as part of a teamMust be highly organized with a strong attention to detailAbility to handle multiple projects and meet deadlinesKnowledgeable with data warehouse concepts (Kimball)
"|senior business data analyst|5|West|Eagle| ID
Amazon|Excited by using massive amounts of data to develop Machine Learning (ML) and Deep Learning (DL) models? Want to help the largest global enterprises derive business value through the adoption of Artificial Intelligence (AI)? Eager to learn from many different enterprises use cases of AWS ML and DL? Zealous to be key part of Amazon, who has been investing in Machine Learning for decades, pioneering and shaping the worlds AI technology?At Amazon Web Services (AWS), we are helping large enterprises build ML and DL models on the AWS Cloud. We are applying predictive technology to large volumes of data and against a wide spectrum of problems. Our Professional Services organization works together with our AWS customers to address their business needs using AI.AWS Professional Services is a unique consulting team. We pride ourselves on being customer obsessed and highly focused on the AI enablement of our customers. If you have experience with AI, including building ML or DL models, wed like to have you on our team. You will get to work with an innovative company, with great teammates, and have a lot of fun helping our customers.This role will focus specifically on AWS most complex and largest customers in the world to help solve a wide range of business problems. Consultants will provide deep and broad insight to customers and partners to help remove constraints that prevent them from leveraging AWS services to create strategic value.A successful candidate will be a person who enjoys diving deep into data, doing analysis, discovering root causes, and designing long-term solutions. It will be a person who likes to have fun, loves to learn, and wants to innovate in the world of AI.Major responsibilities include:· Understand the customers business need and guide them to a solution using our AWS AI Services, AWS AI Platforms, AWS AI Frameworks, and AWS AI EC2 Instances .· · Assist customers by being able to deliver a ML / DL project from beginning to end, including understanding the business need, aggregating data, exploring data, building & validating predictive models, and deploying completed models to deliver business impact to the organization.· · Use Deep Learning frameworks like MXNet, Caffe 2, Tensorflow, Theano, CNTK, and Keras to help our customers build DL models.· · Use SparkML and Amazon Machine Learning (AML) to help our customers build ML models.· · Work with our Professional Services Big Data consultants to analyze, extract, normalize, and label relevant data.· · Work with our Professional Services DevOps consultants to help our customers operationalize models after they are built.· · Assist customers with identifying model drift and retraining models.· · Research and implement novel ML and DL approaches, including using FPGA.· This is a customer facing role. You will be required to travel to client locations and deliver professional services when needed.Note: If you do not live in a market where we have an open Data Scientist position, please feel free to apply. Our Data Scientists can live in any location that has an AWS office.Basic Qualifications· A Bachelor or Masters Degree in a highly quantitative field (Computer Science, Machine Learning, Operational Research, Statistics, Mathematics, etc.) or equivalent experience· 4+ years of industry experience in predictive modeling, data science and analysis· Previous experience in a ML or data scientist role and a track record of building ML or DL models· Experience using Python and/or R· Experience using ML libraries, such as scikit-learn, caret, mlr, mllib· Experience in writing and tuning SQL· Experience with SparkML· Experience working with GPUs to develop model· Experience handling terabyte size dataset· Experience using data visualization toolsPreferred Qualifications· PhD in a highly quantitative field (Computer Science, Machine Learning, Operational Research, Statistics, Mathematics, etc.)· 4+ years of industry experience in predictive modeling and analysis· Skills with programming languages, such as Java or C/C++· Ability to develop experimental and analytic plans for data modeling processes, use of strong baselines, ability to accurately determine cause and effect relations· Consulting experience and track record of helping customers with their AI needs· Publications or presentation in recognized Machine Learning, Deep Learning and Data Mining journals/conferences· Experience with AWS technologies like Redshift, S3, EC2, Data Pipeline, & EMR· Combination of deep technical skills and business savvy enough to interface with all levels and disciplines within our customers organization· Demonstrable track record of dealing well with ambiguity, prioritizing needs, and delivering results in a dynamic environment· Experience diving into data to discover hidden patterns· Able to write production level code, which is well-written and explainableAmazon is an Equal Opportunity Employer Minority / Women / Disability / Veteran / Gender Identity / Sexual Orientation / Age.|data scientist|0|West|Boise| ID
Idaho National Laboratory|"DescriptionJob Information

Job Title: Data Scientist

Grade: 200/210

Org: Advanced Data Analytics

Contact: (see application details)

Work Location: Idaho Falls, ID (Town, Work Schedule - 9X80's)

Mission/Vision Statement

Changing the World's Energy Future by Breaking Ground on New Technology

Mission: Discover, demonstrate and secure innovative nuclear energy solutions, other clean energy options and critical infrastructure.

Vision: INL will change the world's energy future and secure our critical infrastructure.

Equal Employment Opportunity

Idaho National Laboratory (INL) is an Equal Employment Opportunity (EEO) employer. It is the policy of INL to provide equal employment opportunities to all qualified applicants without regard to race, color, religion, sex, sexual orientation, gender identity, national origin, age, protected veteran or disabled status, or genetic information.

Women and People of Color are strongly encouraged to apply.</p>Responsibilities

The Department is an international leader in the application of scientific methods, techniques and tools to address the performance and operational challenges of mission-critical industries. The Department employs specialized methods and state-of-the-art data analysis and modeling tools to support the INL's mission by ensuring the nation's safe, competitive, and sustainable use of engineered systems in many domains by applying our capabilities to impactful issues in risk, reliability, and operational performance.

You will: Support the Department and INL in research and development activities. Demonstrate effective research skills and the ability to collaborate and partner with other government agencies, academia, and private sector companies to achieve project objectives. Work with a multi-disciplinary team of scientists and engineers on challenging work scope. Communicate effectively both verbally and in writing with management, co-workers, and with customers. Publish results of research and development in a mix of refereed publications and conference proceedings. Work effectively with other research teams to develop and manage cross-cutting technical programs for a variety of customers.

The position specifically seeks a data scientist with the following qualifications. Software skills are desirable.

Basic Qualifications (Required):
 MS or PhD in Engineering, Mathematics, Computer Science, Physics, Autonomy, Artificial Intelligence or related technical disciplines
 Ability to obtain a U.S. Security Clearance
 Minimum of 3 years demonstrated ability with data science platforms and software (e.g., Tableau, Jupyter Notebook, R, Python, Matlab, SAS, etc.)
 Demonstrated ability with SQL, noSQL, and graph databases
 Demonstrated experience in data science, data analysis, and software development
 Experience with cloud services and cloud-based analytics is a plus (AWS, Azure, Databricks, etc.)
 Minimum of 2 years of experience contributing to winning proposals and funded projects for research customers at DOD and/or DOE
 Strong demonstrated communications skills and experience presenting to stakeholders and customers
 Must be a self-starter, with a focus on continuous learning; and enjoys collaborating to discovery innovative ways to solve challenges
 Must be able to work in a culturally diverse environment</p>

QualificationsBachelor's degree and 2 years relevant experience, or Master's degree and 1 year relevant experience, or Doctorate with 0 years' experience. Degree must be in a field closely related to statistics, computer science, physics, engineering, or data analytics.

Must be able to obtain and maintain a DOE Security Clearance.

Selective Service Requirements

To be eligible for employment at INL males between ages 18 and 25 must register (or must have registered) with the Selective Service System (SSS). This includes U.S. born and naturalized citizens, parolees, undocumented immigrants, legal permanent residents, asylum seekers, refugees, and all males with visas of any kind which expired more than 30 days ago. The few individuals who are exempt from this requirement are those on current non-immigrant visas. For more information see www.sss.gov .</p> </p>Employee Job Functions

Employee Job Functions are physical actions and/or working conditions associated with the position. These functions may also constitute essential functions for the job position which the employee must be able to fulfill, with or without accommodation. Information provided below is to help describe the job so that the applicant has a reasonable understanding of the job duties/expectations. An applicant's ability to perform and/or tolerate these actions and conditions will be discussed and workplace accommodations may be made on a case-by-case basis following an individualized assessment of the applicant and other considerations, including but not limited to any governing safety standards.

Special Senses: Visually demanding work.

Work Conditions: Stairs.

Please Apply Before:December 14, 2019 (Midnight)

Environmental, Safety and Health Statement

Must be familiar with, and comply with all relevant health and safety requirements. Must be knowledgeable of emergency action policies and procedures, methods for reporting/resolving work practices or conditions to available cognizant professionals.

Other Information

When applying to positions please provide a resume and answer all questions on the following screens. Applicants, who fail to provide a resume or answer the questions, may be deemed ineligible for consideration.

INL Overview

INL is a science-based, applied engineering national laboratory dedicated to supporting the U.S. Department of Energy's mission in nuclear energy research, science, and national defense. With more than 4,300 scientists, researchers and support staff, the laboratory works with national and international governments, universities and industry partners to discover new science and develop technologies that underpin the nation's nuclear and renewable energy, national security and environmental missions.

The Idaho Falls Area

Idaho Falls is conveniently situated near many national treasures such as Yellowstone National Park, Teton National Park, Jackson, WY, etc. For more information about the area, please visit www.visitidahofalls.com and www.visitidaho.org."|data scientist|5|West|Idaho Falls| ID
Micron Technology|"Req. ID: 139947

Micron Technology’s vision is to transform how the world uses information to enrich life and our commitment to people, innovation, tenacity, collaboration, and customer focus allows us to fulfill our mission to be a global leader in memory and storage solutions. This means conducting business with integrity, accountability, and professionalism while supporting our global community.

As a Data Scientist Intern at Micron, you will learn about the exciting field of complex data analysis, using state of the art solution to monitor and improve next generation memory solutions. We will enable this with ground breaking approaches and next generation data analysis solutions.Responsibilities:

Reviewing and analyzing experimental DOEs looking for measurement anomalies and quarantining process tools that are out of controlPossess a continuous improvement process (CIP) attitude, looking for ways to improve the predictive model, and how to make a difference today!Recognize, identify, and raise awareness of data anomalies with the motivation of ""who needs to know this now!""We want our intern to use statistical modeling that seek the problems that inhibit yield improvementYou will uncover patterns in the data from which predictive models, actionable insights or solutions can be developed with the mindset of ""how can I improve this?""""Learn how our customers use the data today with the intent of improving the user experienceDevelop a good understanding of how the feedback loops work with key customers by building positive relationshipsWe expect active participation in technical meetings and then synthesize from it new opportunities or novel approaches

Successful candidates for this position will have:

Pursuing a MS/PhD Degree in Computer Science, Data Science, Machine Learning, or related field. Semiconductor industry experience is helpful; however, other engineering or related disciplines may be considered. Gradution date cannot be prior to September 2020. This internship is intended for Summer 2020.Machine learning and other advanced analytical methodsHadoop, Snowflake, Teradata and/or another SQL databasesGood data summary and social skills with a strong attention to detailWorking with time series data, images, and data with frequently changing distributions is a plusWe need strong critical thinking, prioritization, and analytical skills while providing insights to drive strategic direction

About Us

As the leader in innovative memory solutions, Micron is helping the world make sense of data by delivering technology that is transforming how the world uses information. Through our global brands - Micron, Crucial and Ballistix - we offer the industry's broadest portfolio. We are the only company manufacturing today's major memory and storage technologies: DRAM, NAND, NOR and 3D XPoint™ memory. Our solutions are purpose built to leverage the value of data to unlock financial insights, accelerate scientific break throughs and enhance communication around the world.

We recruit, hire, train, promote, discipline and provide other conditions of employment without regard to a person's race, color, religion, sex, age, national origin, disability, sexual orientation, gender identity and expression, pregnancy, veteran’s status, or other classifications protected under law. This includes providing reasonable accommodation for team members' disabilities or religious beliefs and practices.

Each manager, supervisor and team member is responsible for carrying out this policy. The EEO Administrator in Human Resources is responsible for administration of this policy. The administrator will monitor compliance and is available to answer any questions on EEO matters.

To request assistance with the application process, please contact Micron’s Human Resources Department at 1-800-336-8918 (or 208-368-4748).

Keywords: Boise || Idaho (US-ID) || United States (US) || Technology Development || Intern || Internship || Engineering || Not Applicable ||"|data scientist intern|6|West|Boise| ID
Micron Technology, Inc.|"Req. ID: 143828

Data Scientist

Micron Technology's vision is to transform how the world uses information to enrich life and our commitment to people, innovation, tenacity, collaboration, and customer focus allows us to fulfill our mission to be a global leader in memory and storage solutions. This means conducting business with integrity, accountability, and professionalism while supporting our global community.

As a Data Scientist at Micron's Smart Manufacturing and Artificial Intelligence Organization, you will be working on multidisciplinary projects using groundbreaking data science skills. You will be collaborating with a Worldwide Data Science Team to design and build Big Data tools, models, and analytics to unlock business value from data in-sights. You will have the opportunity and expectation to continuously improve skills and explore new top tier technology and creatively deliver solutions to manufacturing operations to meet our best in class goals.

Responsibilities and Tasks



Work with an international team of data scientists, data engineers, software engineers, process and equipment engineers, process integration engineers, yield enhancement engineers, R&D, etc. in a collaborative manner to develop new data science solutions that improve quality, improve yield, reduce deviations, improve manufacturing cycle time, reduce cost, extend manufacturing capabilities, etc.
Draw from a broad background of data-mining techniques in mathematics, statistics, information technology, machine learning, data engineering, design of experiments (DOE), visualization, etc. to discover insightful patterns in semiconductor manufacturing data
Work on projects and develop solutions that would be of high impact to various areas at all manufacturing fabs
Work closely with IT and Suppliers on data management, requirements gathering, accessing and preparing necessary data, and working with data scientists to build machine learning models.
Developing new or improving prior data acquisition and ETL pipelines from various sources into the ecosystem.
Working with various scientific data such as equipment sensor data and logs, image and various types of signals, manufacturing process data, etc. to extract meaningful information for analytics
Crafting intuitive user interfaces for interactive data visualization to explain insights from data

Qualifications

At least 5 years of work experience in data science solution implementation
Full stack development experience prefers though not a must
PhD in Mathematics, Statistics, Machine Learning or related field
Superb communication skills with a demonstrable ability to lead multiple teams/projects in parallel, reporting to senior leaders
Strong analytical and creative problem-solving skills
Strategically focused, impact oriented, highly organized and adaptable.


About Us

As the leader in innovative memory solutions, Micron is helping the world make sense of data by delivering technology that is transforming how the world uses information. Through our global brands Micron, Crucial and Ballistix we offer the industry's broadest portfolio. We are the only company manufacturing today's major memory and storage technologies: DRAM, NAND, NOR and 3D XPoint memory. Our solutions are purpose built to leverage the value of data to unlock financial insights, accelerate scientific breakthroughs and enhance communication around the world.

Micron Benefits

Employee Rewards Program, Healthcare, Paid time off (Combined Sick and Vacation Time), Retirement savings plans, Paid maternity/paternity leave, Employee Assistance Program, Professional development training, Workplace wellness programs, Micron Health Clinic (Boise only), Fitness Center / Activity rooms (Boise only), Tuition Reimbursement, Micron Corporate Discounts, Casual Dress attire.

All qualified applicants will receive consideration for employment without regard to race, color, religion, sex, sexual orientation, gender identity, national origin, veteran or disability status.

For US Sites Only: To request assistance with the application process and/or for reasonable accommodations, please contact Micron's Human Resources Department at 1-800-336-8918 or 208-368-4748 and/or by completing our General Contact Form

All qualified applicants will receive consideration for employment without regard to race, color, religion, sex, sexual orientation, gender identity, national origin, veteran or disability status.

For US Sites Only: To request assistance with the application process and/or for reasonable accommodations, please contact Micron's Human Resources Department at 1-800-336-8918 or 208-368-4748 and/or by completing our General Contact Form

Keywords: Boise || Idaho (US-ID) || United States (US) || SGA || Experienced || Regular || Information Systems and Technology || #LI-JF1 || Tier 4 ||SDL2017"|data scientist|4|West|Boise| ID
