company|description|position|reviews|Region|City|State
XPO Logistics|"Logistics done differently.

You are always looking for a better, more efficient way to improve productivity. At XPO Logistics, we are looking for people who can effectively incorporate strategies to help people work smarter. As the Senior Data Engineer, you will be responsible for defining, designing and implementing data pipelines, data engineering solutions, and analytics components to support strategic initiatives and ongoing business processes. You will develop solutions that leverage, integrate with and expand upon the company's Business Intelligence (BI) platform technologies and patterns. Become a part of our growing, dynamic team and we'll help you build a career you can be proud of.

Pay, benefits and more.

We are eager to attract the best, so we offer competitive compensation and a generous benefits package, including full health insurance (medical, dental and vision), 401(k), life insurance, disability and the opportunity to participate in a company incentive plan.

What you’ll do on a typical day:

Deliver and drive efforts in developing BI/data solutions focused on data engineering and analytics using Python, Machine Learning, RDBMS, R, SQL, Data Modeling, Java, Unix Scripting, AWS, Microstrategy, Power BI and MPP databases
Troubleshoot technical issues in existing processes and current development work, solicit assistance from other roles and groups and drive resolution to ensure the integrity of platform quality and project timelines
Understand and improve shared standard patterns, templates, and artifacts for BI and data warehouse platform architecture, data science development approaches, data models and new technology adoption and rollout
Collaborate with IT and business teams to identify and document use cases, performance, and capability requirements and criteria for successful solution delivery
Mentor other team members on technical skills, best practices, problem-solving approaches, and standard patterns used at XPO Logistics
Proactively generalize and share technical approaches and best practices among other developers, and simplify and communicate completed work to broader audiences across the company
Help support data consumers to ensure they have reliable access to trusted data including periodic responsibility for 24/7 on-call production support

What you need to succeed at XPO:

At a minimum, you’ll need:


Bachelor’s degree in Computer Science, MIS, Engineering or related field
5 years of experience in data engineering and analytics, and delivering business solutions that rely on business intelligence, data warehousing, data science or similar domains

It’d be great if you also have:


Master’s degree
Data Science specialization from Coursera, Udacity, Data Camp, etc.
R and Python certifications; Certified Business Intelligence Professional from TDWI; Data Management Professional from DAMA; certifications in data modeling and data engineering
6 years of experience in data engineering and analytics, and in delivering solutions in at least two of the following: data science, big data, R or Python, and machine learning
Experience in handling 1000+ lines of complex SQL codes to deliver data-based solutions in both development and data analysis work
Knowledge of cloud solutions (preferably in Amazon suite of products) and data analytics and visualization using R and Python (Numpy, Pandas, Scipy, Scikit-learn, Tensorflow and Keras)
Familiarity with and working knowledge of Data Management Book of Knowledge (DMBOK) core concepts (general data management, governance, architecture, development, security, quality, metadata management, MDM, etc.)
Ability to build logical data models, physical data models and normalizing techniques with 3NF (using tools like ERWin)
Ability to work with MPP databases like Netezza, Redshift or Teradata, and data pipelines using Informatica (Power Center and Power Exchange) and python/data glue
Ability to analyze, summarize and characterize large or small data sets with varying degrees of fidelity or quality, and identify and explain any insights or patterns within them

Be part of something big. #LI-RL1

XPO is a leading provider of cutting-edge supply chain solutions to the most successful companies in the world. We help our customers manage their goods most efficiently using our technology and services. Our greatest strength is our global team – energetic, innovative people of all experience levels and talents who make XPO a great place to work.

We are proud to be an Equal Opportunity/Affirmative Action employer. Qualified applicants will receive consideration for employment without regard to race, sex, disability, veteran or other protected status.

The above statements are intended to describe the general nature and level of work being performed by people assigned to this classification. They are not intended to be construed as an exhaustive list of all responsibilities, duties and skills required of personnel so classified. All employees may be required to perform duties outside of their normal responsibilities from time to time, as needed.</br>"|senior data scientist|5|Midwest|Southfield| MI
FCA Fiat Chrysler Automobiles|"FCA US LLC College Intern Program offers a unique opportunity for highly motivated, innovative, and inspired individuals to work on a challenging assignment where contribution, teamwork, and communication are vital to the success of the organization. As a leading-edge company, we can provide real world challenges and rewarding intern experiences to candidates from a variety of colleges and universities while providing a competitive salary.

Interns are assigned to an organization department based on the candidate's background, skill set and interests. The assignments are project-oriented, meaningful to the department and allow the intern to take responsibility for a major task. Interns experience sense of personal accomplishment and contribution, and experience the corporate business culture through work assignments and structured activities. They gain the communication and etiquette skills required in business while sharing knowledge gained from recent courses. They also enhance their computer skills and learn new systems and software. Each 2020 Intern assignment consists of challenging projects with specific goals, providing opportunities for personal growth and development. Interns that demonstrate outstanding qualities may be invited back the following year for a second internship or to interview for full-time positions in various new hire programs.

Summer internships are primarily located at the FCA US Headquarters and Technology Center in Auburn Hills, Michigan, other facilities in the Detroit metropolitan area, and business centers located throughout the country. Interns may qualify for a housing allowance and/or travel assistance. During the internship, Interns will have the opportunity to participate in many activities designed specifically to enhance their knowledge of FCA and our products.

The student selected for the Citizen Data Scientist Internship will gain experience in requirement gathering, planning, execution, and delivery of data science and machine learning-based projects. This delivery may include creating data visualizations. The bulk of the work will be in areas of data exploration and preparation, data collection and integration. The Citizen Data Scientist will get to gain experience with machine learning (ML) and statistical modeling and data pipe-lining and deployment. The Citizen Data Scientist will assist in cataloging the FCA enterprise wide data catalog, focusing on technical and business documentation. Example projects could include creating a predictive model of when to place an incentive on a model and/or understanding current market conditions related to inventory.
Job responsibilities include but not limited to:

Collaborates with business analysts and product owners to ensure understanding of business requirements
Data Exploration and Preparation: 



Apply statistical analysis and visualization techniques to various data
Generate and test hypotheses about the underlying mechanics of the business process


Data Collection and Integration: 



Understand new data sources and process pipelines
Catalog and document their use in solving business problems


Data Cataloging: 



Assisting in the creation of a data catalog that will understand all the relevant data and metadata in the FCA environment, this will include gathering business process and technical information


Machine Learning and Statistical Modelling: 



Apply various ML and advanced analytics techniques to perform classification or prediction tasks
Testing of ML models, such as cross-validation, A/B testing, bias and fairness


"|data scientist intern|5|Midwest|Detroit| MI
FCA Fiat Chrysler Automobiles|"
The Data Scientist will perform analysis and modeling for all demand generation and conversion elements including product, placement, price, and promotion in support of the short and long-term goals of the Sales & Marketing and Supply Chain teams.
Job responsibilities include but are not limited to:

Perform data mining and predictive analytics to help answer questions to identify key areas within the various function for performance improvement and predict future outcomes and trends
Design, deploy and provide ongoing evaluations of the statistical models and data mining techniques for predictive learning applications
Establish scalable, efficient, automated processes for large-scale data analyses, model development, model validation, and model implementation
Discover patterns and anomalies in data using ad-hoc query/visual discovery
Based on findings, make recommendations to management on possible actions to ensure the desired outcome
Collaborate with internal teams to generate ideas and strategies based on data-driven insights and recommendations
Partner with the data teams to assemble data from multiple systems and sources, which includes evaluation of data accuracy and completeness
Short-term deliverables include:

Collaborate with marketing to develop a robust model to predict the future state of the demand funnel and then integration Media Mix Modeling outcomes to recommend actions to close the gap
Develop models to quantify the relationship between price position's and conversions and collaborate with internal and external teams to enhance incentive program effectiveness models
Collaborate with SCM to develop a model for predictive future dealer orders




"|data scientist|5|Midwest|Auburn Hills| MI
Adam Kay Group|"
Posted Date:
11/13/2019 

Job Category:
Computing/MIS 

Position Title:
Data Scientist 

Salary Range:
$100,000.00 - $120,000.00 

Location:
St. Joseph, MI 

Description:
My SW Lower Michigan client is in need of a Data Scientist to join their team. This person will part of the Enterprise Analytics team, will help build an assortment of models that will have a direct impact into the relationship between our customers and the company. The goal is to anticipate needs and add value. You will implement machine learning algorithms, drive data science analysis for decision making, and build efforts through to production. Perform exploratory and targeted data analyses using statistics and various other methods.

Skills for this position will include:

- Master’s degree (required) in Computer Science, Engineering, Operations Research, Math, Finance, or other quantitative discipline (e.g. Statistics, Data Science, etc.).



At least 3 years of professional experience.
Experience modeling language such as R or Python, and/or other statistical software such as SAS.
Knowledge of various Machine Learning techniques.
Experience with relevant statistical measures (e.g., confidence intervals, significance of error measurements, multivariate testing, etc.) in data analysis projects.
Experience with SQL.

No remote, contract/ C2C or sponsorship is available for this position. Must be authorized to work in the US without expiration and willing to work and live in SW Lower Michigan.
 
"|data scientist|0|Midwest|Saint Joseph| MI
Fahrenheit IT|"Id: 181497 Location: Southfield, MI Job Type: Contract Data Scientist



*Candidates must be authorized to work in the U.S. for any employer. No 3rd parties/C2C** Local candidates only.


The Data Scientist will help our client discover the information hidden in vast amounts of data and help support our client's business. The primary focus will be in applying data mining/statistical techniques, creating patterns and predictions. Ensuring validity of data. using statistical languages to develop and launch descriptive, predictive and prescriptive analysis. Work closely with the business to understand business needs.

Essential Functions

Perform operational support

Work on major projects and responsible for deliverables

Data mining using state-of-the-art methods

Processing, cleansing, and verifying the integrity of data used for analysis

Performed ad-hoc analysis and presenting results in a clear manner

Expert in building Power BI Dashboards and KPIs

Enhancing data collection procedures to include information that is relevant for building analytic systems

Extensive experience writing algorithms, statistical models, and predictions

Model creation using Python

Data visualization using MS Power BI

Work with business users to conduct user acceptance testing

Required Qualifications

5+ years experience as a Data Scientist

Master of Python, R, and MS Power BI programming experience

Skilled in SQL development data models, ETL, Queries

Data visualization using (dashboards/KPI's) MS Power BI

Expert in Statistics and Data Science, building Machine Learning models

Expert in MS Power BI setups, roles, security, work spaces creation

Expert in classification, regression, clustering, anomaly detection, decision tree, Nave Bayes, Support Vector Machines

Bachelors Degree - provided by Dice"|data scientist|0|Midwest|Southfield| MI
Donatech Corporation|"Data Governance Analyst Work across all areas in Client (e.g. Purchasing, Product Development, etc.).


Ensure data quality, data management, data policies and risk management around the handling of data at Client are followed. Ensure Ford's data is profiled to identify PII and other data attributes for security, understand content and opportunities to improve it with standards. Work with various stakeholders to make recommendations to improve data quality, data standardization and data transformation.

Responsibilities:

Data usage/data management/data protection including:

Perform data profiling of sources to assess data quality and work on mitigation strategies and cleansing solutions Populate Metadata content and associate terms in the Business Glossary to develop the Informatica Enterprise Data Catalog Resolve data issues in the appropriate forums and work cross functionally to develop solutions Collaborate with Data, Analytics and IT teams and guide them on data standards and the use of Informatica tools Identify relationships in data to assist in providing insights Establish repeatable, sustainable processes to maintain data and metadata Understand company and regulatory guidelines regarding data privacy, usage and retention (PII, GDPR, SPII) Deliver training and communications for new Informatica capability and Data Governance processes Automate solutions to enable data protection for inter-related systems data Utilize skills in Informatica Software: Data Quality, Profiling and Data Management tools, SQL and Data discovery techniques.

Skills Required:

Skills in Informatica: Analyzer, MDM, EIC, EDL, EDC, BDM, IDQ, PowerCenter Skills in Java, NoSQL, HADOOP, IBM Data Stage/Quality Stage Data Management tools, SQL and Data discovery techniques.

Skills Preferred:

Knowledge of Application Development Lifecycle Strong collaboration and communications skills, ability to engage with others Ability to resolve complex problems and break them down to create and implement an action plan Ability to lead data related project activities Self-Starter who can work in ambiguous situations and drive to a solution Strong organizational skills and ability to advance multiple work streams concurrently

Experience Required: 8 + years of progressive responsibilities in Data Integration/Data Management

Experience Preferred: Ability to work within analytical frameworks in a Big Data environment (Data Lake, EDW, Data Warehouse architectures)

Education Required: Bachelor's Degree in Computer Science, Statistics, Finance or a related technical field

Education Preferred: Masters Degree"|data scientist|0|Midwest|Dearborn| MI
Amway Inc.|"Internship Job Title: Data Science Intern

What is special about this team: The Data Science team supports some of the top initiatives for Amway, primarily through predictive analytics and machine learning predictive models.

How would an intern contribute to the team’s success: You will work on high profile projects add/or pilot programs that will drive key strategic decisions in an objective and agile manner. You will help the team continue to advance the work being done with machine learning predictive models and will be responsible for drawing insights from large, multi-sourced data sets.

An example of a typical project is: Developing machine learning models to be deployed in digital properties, designing experiments and subsequently measuring the impact of the models.

What skills and background will be important to be successful in this internship:

 Desired Skills: Critical Thinking, ability to work independently and in a team. Effective communication and presentations skills.

 Desired Degree: Analytics, Data Science, Computer Science

Location of Internship: Ada, Michigan"|data scientist intern|5|Midwest|Ada| MI
Datawatch|"Position Description:

The analyst will have significant autonomy in conducting research and selecting modeling methodologies.
You will have the opportunity to work with some of the brightest global subject matter experts that are transforming the automobile industry.


Responsibilities include, but are not limited to:



Work with Optimization Solutions group, Operations and Finance teams to support optimal pricing reflecting the risk/return tradeoff.
Employ statistical/econometric procedures to produce quarterly forecasts of vehicle loan characteristics to be included in pricing model.
Develop tracking methodologies and reports to monitor model accuracy and evaluate performance.
Prepare analysis to back-test and compare competing modeling methodologies.
Responsible for maintenance and enhancements of all developed models.
Utilize structural models to simulate business performance over different competitive and economic scenarios.
Support deployment of upgraded analytical tools to dynamically price vehicle financing.
Utilize optimization software to evaluate pricing methodologies.
Use data mining techniques to find opportunities within the pricing area.
Develop/evaluate marketing strategies to take advantage of pricing opportunities.
Utilize deep learning technology to extract vehicle features.
Work with various data sources and platforms (PC, Mainframe, Unix/Linux, Teradata, Hadoop) to gather data.
Execute both descriptive and inferential ad hoc requests in a timely manner

Skills Required:

Demonstrated skills in conducting complex statistical analysis in a business or academic environment
Demonstrated skills in large scale data manipulation and mining/pattern recognition
Strong oral and written communication skills.
Strong programing skills in Python, C / C++/C# , Matlab, R, Pyspark

Skills Preferred:

Knowledge of theoretical/empirical techniques commonly used in industrial organizations (e.g. game theory, contract theory, oligopoly theory)
Knowledge on models with limited dependent variables (e.g. choice models, selection models)
Ability to translate complex quantitative methods into easily understood results for all levels of business customers.
Ability to handle multiple projects within a given timeframe

Experience Required:

Strong knowledge of optimization techniques (e.g. linear/nonlinear/dynamic programming)
Demonstrated proficiency in Monte Carlo simulation and other simulation techniques
Extensive experience on parallel/grid computing, and programming in a variety of software platforms

Experience Preferred:

Some SAS programming experience required, proficiency in SAS is a definite plus.
Some SQL programming experience required.
Experience with Microsoft EXCEL, PowerPoint and Word. Ability to create and manipulate pivot tables and graphs a plus.

Education Required:

Master in quantitative areas, such as Economics, Computer Sciences, Physics, Statistics , Mathematics, Engineering

Education Preferred:

Ph.D. in a quantitative field such as Computer Science, Statistics, Economics, Mathematics, Physics, Operations Research, Cognitive Neuroscience, Quantitative Social Science, Quantitative Finance, Engineering etc.


Altair Engineering Inc. is a global technology company providing software and cloud solutions in the areas of product design and development, high performance cloud computing, and data intelligence. We enable organizations across broad industry segments to compete more effectively in a connected world while creating a more sustainable future. We believe a critical component of our success has been our company culture, based on our core values of innovation, envisioning the future, communicating honestly and broadly, seeking technology and business firsts, and embracing diversity. With more than 2,800 employees, Altair is headquartered in Troy, Michigan, USA and operates 81 offices throughout 25 countries. Altair serves more than 8,000 customers across broad industry segments. Altair ProductDesign is a global, multi-disciplinary product development consultancy which is a wholly owned subsidiary of Altair Engineering. To learn more please visit www.altair.comSDL2017"|data scientist|0|Midwest|Troy| MI
