,company_name,job_summary,job_title,City,State
0,JobRobin,"Data preparation, processing and augmentation. Experience using scikit learn, pandas. Automation of data processing for production environment.",Data Scientist,New York, NY
1,PwC,"Python (Numpy, Pandas, etc.), Spark, cloud-based solutions such as GCP DataFlow; We work with a variety of data mediums including text, audio, imagery, sensory,…",AI Data Scientist / Data Engineer,New York, NY
2,Disney Streaming Services,"Knowledge of the Python data ecosystem using pandas and numpy. Familiar with metadata management, data lineage, and principles of data governance.","Sr. Software Engineer, Data Platform",New York, NY
3,AIG,"Strong coding skills, practical sense for data structures and transfer, and intuition for the asset management data and computation practices will be…",Sr. Software Developer - Quant Equity Research,New York, NY
4,Digitalogy,"Experience with open source software for data ingestion and data processing. Experience working in teams of analysts, data engineers, statisticians, and data…",Data Scientist,New York, NY
5,Spotify,"We’re looking for Data Scientists to join us at multiple levels. Work closely with cross-functional teams of data scientists, product managers, designers and…","Data Scientist, Marketplace – all levels",New York, NY
6,Qualia Investments,We are hiring a Data Scientist or Quantitative Analyst to help rapidly deploy models for our market intelligence platform.,Data Scientist,New York, NY
7,BerlandTeam,"We’re actively looking to recruit a Junior Data Scientist with 1-3 years of experience who, among other things, can support the team in developing scalable data…",Junior Data Scientist,New York, NY
8,Butterfly Network,Deep experience with Python data science ecosystem: We are looking for a highly motivated and experienced data scientist to drive data-driven strategy and…,Data Scientist,New York, NY
9,IBM,"As a Data Scientist at IBM, you will help transform data into tangible business value by analyzing information, communicating outcomes and collaborating on…","Data Scientist - Tech Re-Entry - Armonk, NY",Armonk, NY
10,Viome,"Python (numpy, scipy, pandas), SQL. We are looking for an experienced and independent Data Scientist in our NYC office.",Data Scientist,New York, NY
11,4th-IR,"Strong python skills, especially numpy, matplotlib, sklearn, pandas, flask, requests. Familiarity working with diverse data types:",Data Scientist,New York, NY
12,Cloudera,You should have spent at least 3 years as a practicing data scientist or machine learning engineer. We expect that you have extensive experience using python (+…,Data Scientist,Brooklyn, NY
13,G-Research,"Demonstrable proficiency in statistical data analysis and data visualisation. Advanced knowledge of Python and PySpark, in particular packages such as Pandas,…",Data Science Internship,New York, NY
14,Jobot,"Excellent Python (numpy, pandas, scikit-learn, etc.). If you are a Data Scientist, then please read on…. We collect data about applicants through our cloud…","Data Scientist - Python, R, SQL",New York, NY
15,AllianceBernstein,"Hands on experience in the use of essential python libraries such as pandas, numpy, sklearn and other modern data science tools is a strong plus.",Quantitative Analyst – Structured Products,New York, NY
16,Matrix Resources,"At least one core programming expertise, such as python (NumPy, SciPy, Pandas), R, Scala. Conduct original research on large proprietary and open source data…",Senior Data Scientist,New York, NY
17,BNY Mellon,"Reporting to the Head of Investment Management (IM) Data Solutions, the Data Scientist will lead, design and architect solutions to complex data integration,…",Data Scientist,New York, NY
18,Square,"Python (numpy, pandas, sklearn, xgboost, TensorFlow). As a Senior Data Scientist at Square working on Risk, you will lead projects that derive value from our…","Data Scientist, Risk",New York, NY
19,Revlon,Experience with Python data science ecosystem: We are looking for a highly motivated and experienced data scientist to drive data-driven strategy and product…,Data Scientist,New York, NY
20,PepsiCo,"As a Senior Data Scientist, you will play a critical role in executing the global ecommerce growth agenda. What PepsiCo Data Science & Analytics does:",Senior Data Scientist,New York, NY
21,Uber,"Familiarity with technical tools for analysis - Python (with Pandas, etc.), R, SQL, etc.; To solve these problems, data scientists leverage unique data sources…",2020 PhD University Graduate - Data Scientist - Uber Eats (New York),New York, NY
22,DataDog,"You have experience with tools such as Luigi, Spark, Scala, Python, Pandas, and Redshift. As a Data Scientist for the Internal Analytics Platform team, you will…",Data Scientist,New York, NY
23,"Remedy BPCI Partners, LLC.","4+ year’s professional experience as a data scientist or machine learning engineer. Utilize raw or aggregated data to build predictive models in SPARK, sql, or…",Data Scientist,New York, NY
24,Northeast Information Discovery,"Experience with SciPy, NumPY and Pandas python packages. Identify data needs, helping procure or generate data, curating and preparing data for training models.",Data Scientist Midlevel,Canastota, NY
25,Nearpod,"As Nearpod’s Data Science Scientist, you are organized, analytical, and detail oriented with experience maintaining solid processes and data integrity.",Data Scientist,Brooklyn, NY
26,Skyline AI,"Extract insights from our data, and generate predictions using data science techniques. We are constantly collecting new data sources, analyzing our many…",Data Engineer / Scientist,New York, NY
27,Disney Streaming Services,"Knowledge of the Python data ecosystem using pandas and numpy. Familiar with metadata management, data lineage, and principles of data governance.",Sr. Data Engineer,New York, NY
28,7Park Data,"We are looking for a talented and creative Data Scientist to join our data science team. As a Data Scientist, you will be responsible for the following:",Data Scientist,New York, NY
29,Spotify,"Coding skills for analytics and data extraction (SQL, R, Python, Pandas). We are seeking a Data Scientist or Senior Data Scientist to join our Product Insights…",Data Scientist / Senior Data Scientist – Spotify Free ML,New York, NY
30,Remedy Partners,"4+ year’s professional experience as a data scientist or machine learning engineer. Utilize raw or aggregated data to build predictive models in SPARK, sql, or…",Data Scientist,New York, NY
31,Well,"Demonstrated experience using Python for data analysis and machine learning (numpy, pandas, scikit-learn, xgboost, spacy, pytorch, stan/pymc3, etc.).",Data Scientist / Machine Learning Engineer,New York, NY
32,Simon Data,"Python or Java, not R or Matlab). We don't believe in theory-crafting models before we have collected the data that will power them, as well as built out the…",Data Scientist,New York, NY
33,Citizen,"Distilling questions, wrangling data, and driving decisions with data analytics. Work with Engineering to evangelize data best practices and implement data…",Data Scientist,New York, NY
34,Uber,"Familiarity with technical tools for analysis - Python (with Pandas, etc.), R, SQL, etc. Research, data science modeling, or engineering experience.",2020 PhD Data Scientist Internship - Uber Eats (New York),New York, NY
35,Spotify,"Spotify is seeking an exceptional Data Scientist to join its Licensing Finance team. Minimum 3 (5+ preferred) years of relevant experience, particularly in…","Data Scientist, Licensing Finance",New York, NY
36,Warner Music Group,"Tableau, Pandas, Jupyter Notebook, and AWS experience. An understanding of ETL processes and data engineering skills. A little bit about our team:",A&R Research Analyst Assistant,New York, NY
37,Spotify,You’re capable of mentoring more junior data scientist to set them up for success. Coding skills (such as Python). Work from our offices in New York.,"Senior Data Scientist, Growth Insights",New York, NY
38,Building Service 32BJ Benefit Funds,"Demonstrated mastery with Python and its data science ecosystem; Python, Anaconda stack (Jupyter Notebook, NumPy, Pandas, MatPlotLib/Bokeh, SciPy, Scikit-Learn)…",Data Engineer,New York, NY
39,Thasos Group,"Winner – “Best Alternative Data Provider, 2018” Inside Market Data. The Data Technician role is an entry-level position suitable for someone looking to break…",Data Technician (Full- or Part-Time),New York, NY
40,OpenX,We're looking for a Senior Data Scientist who: OpenX is seeking a Data Scientist to be responsible for executing critical R&D projects on a petabyte-scale…,Data Scientist II,New York, NY
41,Lyons Hathaway,"Have full stack experience in data collection, aggregation, analysis, visualization, productization, and monitoring of data science products.",Data Scientist,New York, NY
42,Spotify,We are looking for a Senior Data Scientist to join the Customer Support Product Insights team in our Premium Mission.,Senior Data Scientist – Customer Support Experience,New York, NY
43,Albert Einstein College of Medicine,Will work routinely and extensively with data analysis packages such as Pandas and scikit-learn. The Data Scientist will utilize their skills and competencies…,Data Scientist,Bronx, NY
44,Facebook,"Leverage data and business principles to solve large-scale web, mobile and data infrastructure problems. Python, R, Java, or C++).","Data Scientist, Infrastructure",New York, NY
45,Spotify,You have experience working with financial data and/or performing data reconciliations and quality assurance testing. Big Query / Google Cloud Platform.,"Data Analyst, Royalties and Accounting",New York, NY
46,HVH Precision Analytics,"Develop software solutions using Python, and/or R. Apply data mining and machine learning techniques and models to extract analytic insights from healthcare and…",Senior Data Scientist,New York, NY
47,Google,"10 years of relevant experience in data analysis or related field as a Statistician, Data Scientist, Computational Biologist, or Bioinformatician.",Data Scientist Technical Lead,New York, NY
48,Eyeview,"Python or R along with experience in the various machine learning, scientific computing, and data visualization libraries (numpy, scipy, sklearn, pandas,…",Data Scientist,New York, NY
49,PwC,"Python (Numpy, Pandas, etc.), Spark, cloud-based solutions such as GCP DataFlow; We work with a variety of data mediums including text, audio, imagery, sensory,…",AI Data Scientist / Data Engineer - Experienced Associate,New York, NY
50,Northeast Information Discovery,"Experience with SciPy, NumPY and Pandas python packages. Identify data needs, helping procure or generate data, curating and preparing data for training models.",Data Scientist Senior,Canastota, NY
51,WeWork,"C/C++, C#, Java, Python, R, SAS, MATLAB, Pandas. We are seeking a Senior Data Scientist to join our People Analytics Team. 5+ years of relevant work experience.",Senior Data Scientist,New York, NY
52,Weber Shandwick,"2-5 years data science experience in Python, Apache Spark, Tensorflow, Scikit-learn, pandas. As a data scientist at Bomoda, you would be directly involved with…",Data Scientist - Bomoda,New York, NY
53,HS Technologies,"Python, Numpy, Pandas, Sklearn, PyTorch, Tensorflow, R, SQL, Spark, SparkStreaming, HDFS, Hbase, Kafka. We are developing a system to reduce data pre-processing…",Head of Quantitative Research,New York, NY
54,NS1,"Data pipelining, ETL, data cleaning. The data sets are internet-scale (true big data). Jupyter Notebooks, Numpy, Pandas, Sklearn, or other relevant data science…",Data Scientist,New York, NY
55,Feather,Some Data Engineering experience or knowledge of ETL process preferred. Create a foundation for a data team and build the team over time by developing KPIs for…,Senior Data Scientist,New York, NY
56,SmartAsset,"We're looking for a data scientist who can help take our marketing to cutting-edge levels of data sophistication. Strong communication (oral, written) skills.",Marketing Data Scientist,New York, NY
57,Amplicare,"2+ years experience working with data science tools, such as Pandas, NumPy, MatLab, Jupyter Notebooks. 2+ years experience working with larger data sets (> 1TB)…",Senior Data Scientist,New York, NY
58,"Remedy BPCI Partners, LLC.","7+ year’s professional experience as a data scientist or machine learning engineer. Utilize raw or aggregated data to build predictive models in SPARK, sql, or…",Senior Data Scientist,New York, NY
59,EY,"Experience with common data science programming languages, such as Python R. We are looking for an ambitious, self-motivated data scientist or data engineer who…",Tax Staff – National Tax – Tax Technology and Transformation (TTT) – Data Scientist – Advanced Technologies - New York,New York, NY
60,Well,"Demonstrated experience using Python for data analysis and machine learning (numpy, pandas, scikit-learn, xgboost, spacy, pytorch, stan/pymc3, etc.).",Senior Data Scientist / Senior Machine Learning Engineer,New York, NY
61,American Express,"Firm grip of Python environment and libraries (scikit, nltk, pandas and numpy). Excellent data presentation and visualization skills. Oct 17, 2019, 1:05:39 AM.",Machine Learning Engineer,New York, NY
62,"Marsh & McLennan Companies, Inc.","As a Data Scientist, you will be: Pandas, Scikit-Learn, Matplotlib, TensorFlow, Jupyter and other Python data tools - Spark, HDFS, Kafka and other high volume…",Senior Data Scientist,New York, NY
63,Spotify,You have experience working with financial data including performing data reconciliations and quality assurance testing. Big Query / Google Cloud Platform.,"Data Analytics Manager, Royalties and Accounting",New York, NY
64,Well,"Demonstrated experience using Python for building statistical models with a focus on causal inference and Bayesian methods (stan, pymc3, numpy, pandas, scikit…",Senior Data Scientist (Statistical Modeling/Population Health),New York, NY
65,Remedy Partners,"7+ year’s professional experience as a data scientist or machine learning engineer. Utilize raw or aggregated data to build predictive models in SPARK, sql, or…",Senior Data Scientist,New York, NY
66,Spotify,Manage a team of data analysts / data scientists working with large data sets to solve complex problems in a dynamic environment.,"Data Analytics and Quality Assurance Manager, Royalties and Accounting",New York, NY
67,IBKR,Convert python scripts prepared by data scientists to production-grade reports. Experience with python as a primary language (non-scripting).,Python Developer (1967-NYC),New York, NY
68,Bloomberg,"Ability to implement statistics and machine learning models in Python 3 data science stack, particularly scikit-learn, numpy, statsmodels and pandas.",Senior Data Scientist - Enterprise Risk Management,New York, NY
69,Square,"Python ML stack (pandas, scikit-learn, etc.). Java, Python, Google Cloud Platform, AWS, Snowflake. Experience in designing and productionizing large-scale…","Machine Learning Engineer, Knowledge Platform",New York, NY
70,Spotify,We are looking for a Data Analytics Manager to work with our Publishing Royalties data team. Manage a team of data analysts / scientists and work with large…,"Data Analytics Manager, Publishing Royalties",New York, NY
71,Utopus Insights,"We are seeking a candidate for a data scientist position with a proven background in data mining, statistical prediction, and machine learning.",Data Scientist / Senior Data Scientist - Predictive Analytics,Valhalla, NY
72,W2O,"3-5 year's work experience as a data scientist. Hands-on experience using Python and NumPy/SciPy/Pandas/etc, for data processing.","Senior Director, Data Scientist - Client Operations",New York, NY
73,Fareportal Inc.,"Lead a team of machine learning engineers, data scientist, data engineers. You like to share your knowledge and guide other fellow data scientist and engineers.",Senior Lead Machine Learning Engineer/Data Scientist,New York, NY
74,ION,"Strong software development experience with languages such as Python, R, Scala, including strong proficiency with data manipulation libraries like pandas.",Data Engineer,New York, NY
75,Cigna,"Execute full stack model development process - data collection, aggregation, analysis, visualization, productionalization and monitoring performance of Data…",Data Science Director,New York, NY
76,SiriusXM,"Knowledge of the Python data ecosystem using pandas and numpy. Knowledge of data profiling, data modeling, and data pipeline development.","Engineer, Data",New York, NY
77,Munich Re America,"5+ years of experience in data engineering or data infrastructure role. Advanced experience of SQL and Python (data analysis libraries like pandas, numpy,…",Data Engineer,New York, NY
78,Schireson,"Exposure to data science tools/modules such as Jupyter Notebook, Pandas, Data Frames, Numpy, etc. Brainstorm, design, and develop innovative approaches to test…",QA Engineer,New York, NY
79,Boxed,5+ years in data science/machine learning experience. Work in a stack built primarily around Python and AWS. 2+ years of managing a team of data scientists.,VP of Data Science,New York, NY
80,Xaxis,"OUR TECH STACK FOR DATA SCIENCE: Well versed in Python, with a quantitative mind. You will be responsible for working with Data Science to scale their…","Engineer, Machine Learning - Copilot",New York, NY
81,Cigna,"Explore and visualize the data using tools such as Python modules including pandas, matplotlib, bokeh, and Seaborn, Tableau, and Looker.",Senior Data Scientist-Machine Learning/AI/NLP,New York, NY
82,EY,"Experience with common data science programming languages, such as Python R. We are looking for an ambitious, self-motivated data scientist or data engineer who…",Tax Services Senior – National Tax – Tax Technology and Transformation (TTT) – Data Scientist – Advanced Technologies - New York,New York, NY
83,J.P. Morgan,"Strong programing skills and data analysis proficiency, such as Python (numpy/pandas/scikit-learn), R, Java, C++, Scala, SQL, Matlab.",Asset & Wealth Management – Intelligent Digital Solutions – Data Science and Machine Learning Team – Analyst/Associate,New York, NY
84,Schireson,"Exposure to data science tools/modules such as Jupyter Notebook, Pandas, Data Frames, Numpy, etc. Brainstorm, design, and develop innovative approaches to test…",Senior QA Engineer,New York, NY
85,Siege Technologies,"Machine Learning/Data Science experience (such as R, Pandas, Sklearn, Tensorflow, Keras). We are seeking a highly motivated research scientist for our cyber…",Research Scientist/Software Engineer,Rome, NY
86,JP Morgan Chase,"SparkML, TensorFlow, Panda, NumPy, scikit-learn, NLTK, PySpark, R, Jupyter, Tableau, JPMC Athena, Impala, big data experience, data science and machine learning…",Data Science / Machine Learning / Big Data Engineer - Lead,New York, NY
87,JP Morgan Chase,"Familiarity with basic data table operations (SQL, Hive, etc.). Ability to develop and debug in Python, Java, C or C++. Proficient in git version control.",CIB Machine Learning Center of Excellence - Applied AI/ML Associate,New York, NY
88,AT&T,"Experience thinking critically about complicated algorithms and analyzing data sets using Python Pandas. At Xandr, our data is our life line - we can only be as…",Software Engineer II - Data Science Team,New York, NY
89,Xandr,"Experience thinking critically about complicated algorithms and analyzing data sets using Python Pandas. At Xandr, our data is our life line - we can only be as…",Software Engineer II - Data Science Team,New York, NY
90,SiriusXM,"Knowledge of the Python data ecosystem using pandas and numpy. Knowledge of data modeling, data access, and data storage techniques.","Senior Engineer, Data",New York, NY
91,National Football League,Manage / Work with Engineering team and data scientist. Manage and deliver data pipeline used for data analytics. Worked with structured and un-structured data.,"Lead, Data Solutions Architect",New York, NY
92,Citi,"This includes the full pydata stack, like pandas, scikit-learn, data viz, Airflow, and dashboarding with Dash/Panel/React. Ad hoc data science and ML projects.",MQA- Fixed Income/ETF Quantitative Analyst - AVP/VP,New York, NY
93,National Football League,"Strong python developer for building data factory pipelines. The data solutions engineer will build data pipeline for various data feeds (API, Json, CSV).",Senior Manager – Data Solutions Engineer,New York, NY
94,PulsePoint,"3+ years of full-time experience working as a Statistician/ Machine Learning Engineer/ Data Scientist. At PulsePoint™, data is at the core of everything we do…",Machine Learning Engineer,New York, NY
95,BondHouse,"Demonstrated ability to code in python from scratch and familiar with packages including numpy, pandas, scikit-learn etc. As a Quantitative Analyst You Will:",Senior Quantitative Analyst,New York, NY
96,New York Life Insurance Co,Fluency using Python for data related work (e.g. Any experience working with Data Warehouses and/or Data Marts. To be part of a growing and successful business.,Senior Data Engineer - Center of Data Science,New York, NY
97,Goldman Sachs,"The Clarity Money team is actively seeking a motivated Data Engineer with proven industry experience in machine learning, data engineering and building robust…",CIMD - Marcus by Goldman Sachs - Machine Learning Engineer,New York, NY
98,"Two Sigma Investments, LLC.","Working knowledge of Python (pandas) is a plus. Since 2001, we have used data science and technology to derive insights that forecast the future and discover…",Investment Management Strategy and Product Development,New York, NY
99,Remedy Partners,"3+ years in a data oriented technical role (software engineer, data engineer, etc.). Comfortable thinking about data and systems. Strive to be capable in:","Senior Analytics, Software Engineer",New York, NY
100,"Iteris, Inc.","Experience with NoSQL data stores (e.g. Experience with Pandas, Dask, or NumPy. Experience or interest in map based data visualizations.",Software Developer,United States,
101,"Greystone & Co., Inc.","Assist on our data science efforts, mostly via pandas and SciPy. We are Greystone Labs, an innovation team and lender composed of underwriters, software…",Back End Engineer,New York, NY
102,JP Morgan Chase,"Familiarity with basic data table operations (SQL, Hive, etc.). Ability to develop and debug in Python, Java, C or C++. Proficient in git version control.",CIB Machine Learning Center of Excellence - Applied AI/ML Director,New York, NY
103,Refinitiv,"Ability to track down complex data quality and data integration issues, evaluate different algorithmic approaches, and analyse data to solve problems.","Product Manager, Machine Learning Analytics",New York, NY
104,JP Morgan Chase,"Strong programing skills and data analysis proficiency, such as Python (numpy/pandas/scikit-learn), R, Java, C++, Scala, SQL, Matlab.",Asset & Wealth Management – Intelligent Digital Solutions – Data Science and Machine Learning Team – Vice President/ Executive Director,New York, NY
105,General Assembly,"We are looking for a Data Scientist to teach our full-time class: Expertise in SQL, Python, and related Python libraries (pandas, numpy).",Local Lead Data Science Immersive Instructor,New York, NY
106,EXL,"Excellent Python (numpy, pandas, scikit-learn, etc.). Create algorithms to extract information from large data sets. 2+ Years of Industry Experience.","Senior Analytics Consultant, Decision Analytics (Deep Learning)",New York, NY
107,Beeswax,"Experience with data warehouses such as Snowflake, Redshift or Presto and data processing platforms such as Spark. We were recently recognized on the Inc.",Lead Machine Learning Engineer,New York, NY
108,JP Morgan Chase,"Familiarity with basic data table operations (SQL, Hive, etc.). Ability to develop and debug in Python, Java, C or C++. Proficient in git version control.",CIB Machine Learning Center of Excellence - Applied AI/ML Lead,New York, NY
109,Storm Global Analytics,"Excellent Python (numpy, pandas, scikit-learn, etc.). Create algorithms to extract information from large data sets. Deep Learning Senior Analytics Consultant.",Deep Learning Senior Analytics Consultant,New York, NY
110,Protiviti,"Must at least be proficient with Python Scientific suite (NumPy, SciPy, Matplotlib and Pandas). Proven Data manipulation skill is required.",New York Technology Consulting Machine Learning Experienced Consultant,New York, NY
111,PwC,"Python (Numpy, Pandas, etc.), Spark, cloud-based solutions such as GCP DataFlow; We work with a variety of data mediums including text, audio, imagery, sensory,…",AI Data Scientist / Data Engineer,New York, NY
112,Disney Streaming Services,"Knowledge of the Python data ecosystem using pandas and numpy. Familiar with metadata management, data lineage, and principles of data governance.",Sr. Data Engineer,New York, NY
113,G-Research,"Demonstrable proficiency in statistical data analysis and data visualisation. Advanced knowledge of Python and PySpark, in particular packages such as Pandas,…",Data Science Internship,New York, NY
114,Jobot,"Excellent Python (numpy, pandas, scikit-learn, etc.). If you are a Data Scientist, then please read on…. We collect data about applicants through our cloud…","Data Scientist - Python, R, SQL",New York, NY
115,JobRobin,"Data preparation, processing and augmentation. Experience using scikit learn, pandas. Automation of data processing for production environment.",Data Scientist,New York, NY
116,Building Service 32BJ Benefit Funds,"Demonstrated mastery with Python and its data science ecosystem; Python, Anaconda stack (Jupyter Notebook, NumPy, Pandas, MatPlotLib/Bokeh, SciPy, Scikit-Learn)…",Data Engineer,New York, NY
