company_name,job_summary,job_title,City,State
Storm Global Analytics,"Excellent Python (numpy, pandas, scikit-learn, etc.). Create algorithms to extract information from large data sets. Deep Learning Senior Analytics Consultant.",Deep Learning Senior Analytics Consultant,New York, NY
Protiviti,"Must at least be proficient with Python Scientific suite (NumPy, SciPy, Matplotlib and Pandas). Proven Data manipulation skill is required.",New York Technology Consulting Machine Learning Experienced Consultant,New York, NY
Xandr,"Experience thinking critically about complicated algorithms and analyzing data sets using Python Pandas. At Xandr, our data is our life line - we can only be as…",Software Engineer II - Data Science Team,New York, NY
AllianceBernstein,"Hands on experience in the use of essential python libraries such as pandas, numpy, sklearn and other modern data science tools is a strong plus.",Quantitative Analyst – Structured Products,New York, NY
Disney Streaming Services,"Knowledge of the Python data ecosystem using pandas and numpy. Familiar with metadata management, data lineage, and principles of data governance.","Sr. Software Engineer, Data Platform",New York, NY
AIG,"Strong coding skills, practical sense for data structures and transfer, and intuition for the asset management data and computation practices will be…",Sr. Software Developer - Quant Equity Research,New York, NY
Matrix Resources,"At least one core programming expertise, such as python (NumPy, SciPy, Pandas), R, Scala. Conduct original research on large proprietary and open source data…",Senior Data Scientist,New York, NY
"Iteris, Inc.","Experience with NoSQL data stores (e.g. Experience with Pandas, Dask, or NumPy. Experience or interest in map based data visualizations.",Software Developer,United States,
