,company_name,job_summary,job_title,City,State
0,Seen by Indeed,Seen by Indeed is a free service that connects qualified job-seekers (that's you) with top companies hiring tech roles.,Data Engineer,Seattle, WA
1,Seen by Indeed,Seen by Indeed is a free service that connects qualified job-seekers (that's you) with top companies hiring tech roles.,Data Warehouse Engineer,Seattle, WA
2,Omni ePartners,"3+ years of experience in data modelling, ETL development and data warehousing. 1+ years of experience in using python for scripting, data manipulation, and…",Business Intelligence Engineer,Seattle, WA
3,"Akvelon, Inc.","Our client is looking for software and data engineers who are passionate about data and want to work in a multi-disciplinary team of Software Engineers, Data…","Data engineer - C#,SQL(MS1889)",Redmond, WA
4,People tech group,"Data Concepts (ETL, near-/real-time streaming, data structures, metadata and workflow management). Big Data (Hadoop, Hive, Map-Reduce).",Jr. Big Data Engineer,Redmond, WA
5,"Akvelon, Inc.","Big Data Engineer/ Data Scientist *. Big data analysis – big data tech – Hadoop, databricks, etc. Solid data base background preferably SQL.",Big Data Engineer (MS1892),Redmond, WA
6,"Transaction Network Services, Inc","The Splunk Data Engineer is responsible for supporting the efforts of the data science team and it’s overall mission of providing a platform for the ingestion,…",Data Engineer,Seattle, WA
7,NHL Seattle,NHL Seattle is seeking a Data Engineer who will manage the data used by decision-makers across the Hockey Operations organization.,Data Engineer,Seattle, WA
8,Homesite Insurance,"Direct the data layer implementation across the platform and website properties. Implement and manage analytics tools (Primarily Google Analytics 360, Google…",Data Analytic Engineer,Seattle, WA
9,Accelalpha,We are seeking an experienced Data Engineer for long term contract opportunity in Redmond WA. Experience in building Data Pipelines in Cloud (Preferrably AWS)…,Data Engineer,Redmond, WA
10,Starbucks,"With support from more senior data scientists, establish and foster close collaboration between data and decision scientists, engineers, business and leadership…","data scientist, Insights & Analytics - Seattle, WA",Seattle, WA
11,Expeditors,"Knowledge of data management fundamentals and data storage principles. Demonstrated strength in data modeling, ETL development, and data warehousingKnowledge of…",Data Engineer,Seattle, WA
12,Microsoft,"They have a passion for data analysis, statistical modeling, time series, change point detection, data mining, data engineering, and experimentation that…",Full Time Opportunities for Students or Recent Graduates: Cybersecurity,Redmond, WA
13,Facebook,"Interface with engineers, product managers and product analysts to understand data needs. Build data expertise and own data quality for allocated areas of…","Data Engineer, Analytics - Seattle",Seattle, WA
14,Google,We're proud to be our engineers' engineers and love voiding warranties by taking things apart so we can rebuild them. Ability to travel as required.,"Data Center Technician, Field Services",Kirkland, WA
15,Oath Inc,Oath’s Data Center Operations team includes a group of highly skilled and dedicated Data Center Engineers. The Data Center operations team is looking for a Data…,Associate Data Center Engineer,Quincy, WA
16,Healthentic Inc.,"At least 2 years of experience working with healthcare data and data processing, specifically dental, medical, pharmacy eligibility and claims data.",Healthcare Data Engineer,Seattle, WA
17,Liberty Mutual Insurance,"The hiring manager is open to an Associate Data Engineer / Data Engineer. As an Associate Data Engineer / Data Engineer, you will work collaboratively on a…",Associate / Data Engineer,Seattle, WA
18,Nintendo of America Inc.,"Experience with ETL data workflows. Experience with real-time data processing. Architect, prototype, and productize big data processing pipelines for analytics…",CONTRACT - Data Engineer (NTD),Redmond, WA
19,Nintendo of America Inc.,"2+ years supporting data warehousing and analytics projects, including using AWS technologies— Redshift, S3, EC2, etc.—and other big data technologies.",CONTRACT - Data Engineer,Redmond, WA
20,PACCAR Technical Center,"5+ years in relevant experience as data engineer, software engineer, business intelligence engineer, or equivalent developing DB schemas, creating ETLs, and…",Data Engineer,Mount Vernon, WA
21,Liberty Mutual Insurance,"Improve speed to market by focusing on current Agency & Strategic Partners data needs as well as building out the long-term strategic data solutions using AWS,…",Senior Data Engineer,Seattle, WA
22,Mphasis,"Understanding of data management including recovery, security and monitoring. Experience with working ETL platforms such as Data stage is desirable.",Data Engineer USA,United States,
23,ReNu Medical,"Ensure all data collection and entry is accurate and done correctly. Interact with Management, Engineers and Technicians as needed, and work cross functionally…",Team Leader / Entry Level Supervisor,Everett, WA
24,"Amazon.com Services, Inc.","Industry experience as a Data Engineer or related specialty (e.g., Software Engineer, Business Intelligence Engineer, Data Scientist) with a track record of…",Data Engineer I,Seattle, WA
25,Oath Inc,The Verizon Media Group’s Data Center Operations Team is a group of highly skilled and dedicated support technicians and engineers.,Associate Data Center Engineer - Shipping/Receiving,Quincy, WA
26,Talking Rain Beverage Company,Big Data and streaming analytics. Exploratory data analysis (EDA) & cleansing. Develop custom data models and algorithms to generate predictive insights.,Data Engineer,Issaquah, WA
27,PACCAR,"Build data pipelines (including data migration from legacy data sources, cleansing and transformation), data validation frameworks, job schedules with emphasis…",Data Engineer,Kirkland, WA
28,Infoblox,"3-5+ years of experience in data engineering, data science, and related data-centric fields using large-scale data environments.",Data Engineer,Tacoma, WA
29,"Brooks Sports, Inc","Lead and drive the re-structuring of the current data architecture, development and implementation of new data management projects & capabilities, data…","Data Engineer, Runner Performance Lab",Seattle, WA
30,Rational,"We are currently seeking a Data Engineer to join our tech client in Bellevue, WA. Support making sure data is secured and shared with only the appropriate…",Data Engineer,Bellevue, WA
31,Seattle Children's - Springbrook,"The Senior Data Engineer responsibilites include building a data processing pipeline that collects, connects, centralizes, and curates data from various…","Data Engineer, Senior",Seattle, WA
32,Warner Bros Careers,You will work with our Data & Analytics Technology team in ensuring data is transformed to feed enterprise data stores in the cloud.,"Data Science Engineer, Analytic Capabilities",Seattle, WA
33,Mitsubishi Aircraft Corporation,"We are seeking an experienced Flight Test Engineer. Process, analyze, and draw conclusions from post flight data. Support engineering with test plan creation.",Flight Test Engineer,Moses Lake, WA
34,Experfy,"4 years of hands-on experience as a Data Engineer in a Big Data environment (Spark, Hive, HDFS, Sqoop). Strong SQL knowledge and data analysis skills for data…","Big Data Engineer - Deloitte (Remote, Freelance/Contract)",Seattle, WA
35,"EtiVenture, Inc.",Qualifications of Senior Data Engineer: Requirements of Senior Data Engineer: Preferred Experience of Senior Data Engineer. Work references will be requested.,Senior Data Engineer,Seattle, WA
36,Tesla,You should be strong in developing Data Algorithms as well as data pipelines to make recommendations about content delivery.,Data Scientist/Machine Learning Engineer,Seattle, WA
37,Indeed,"Work side by side with world class QA Engineers, Automation Engineers, Software Engineers, Site Reliability Engineers, Tech Writers, and Product Managers.",Quality Assurance Engineer,Seattle, WA
38,Nintendo of America Inc.,Mentors and assists Associate Software Engineers. Proven experience in handling complex systems/processes where analysis of situations or data requires in-depth…,ETL Engineer,Redmond, WA
39,Banfield Pet Hospital,Refine workflow management process with data engineers. The primary purpose and function of the System Analyst Data and Analytics is to serve as the liaison…,"System Analyst, Data & Analytics",Vancouver, WA
40,Nintendo of America Inc.,"Design A/B testing experiments, and do end-to-end data analysis. Use predictive analytics and machine learning techniques to solve data modeling problems.",Engineer (NTD),Redmond, WA
41,Unify Consulting,"5+ years experience in data integration, data warehousing, and data modeling. Https://www.linkedin.com/jobs/cap/view/1248886204/?pathWildcard=1248886204&trk=job…",Data Engineer,Kirkland, WA
42,Oath Inc,Verizon Media Group’s Data Center Operations team includes a group of highly skilled and dedicated Facilities Engineers that perform all electrical and…,Data Center Facilities Engineer 1,Quincy, WA
43,Lydon Solutions,"The Project Data Engineer position is responsible for variety of tasks including assisting our client’s Construction Project Management team in collecting,…",Project Data Engineer,Kennewick, WA
44,Apple,You will engineer distributed data pipelines and use your understanding of data annotation and how it is used in building real world ML models to improve our…,Siri - Data Engineer,Seattle, WA
45,BOEING,"Assists in developing models, data bases and spreadsheets to analyze data (e.g., statistics, operations research, engineering economics), and provides summary…",Industrial Engineer,Everett, WA
46,Avani Systems,"Develop pipelines using copy activity from different sources like FTP, Windows Blob Storage, SQL SERVER, COSMOS big data etc. and scheduling the pipelines as…",Big Data Engineer,Seattle, WA
47,BOEING,"R&M engineer will use modeling, simulation and data analytics methodologies & tools including statistical and spatial Integration analyses.",Entry level Maintainability engineer to,Everett, WA
48,employHER,"Industry experience as a Data Engineer or related specialty (e.g. We are looking for a Data Engineer (BIE) with strong analytical, communication and project…",Data Engineer,Seattle, WA
49,Institute for Systems Biology,"Work as part of a dynamic team of internal and external data scientists, data engineers, biomedical scientists and physicians. Spark and Python, R or Scala.",Software Engineer/Data Scientist,Seattle, WA
50,Tableau,"As the Customer Solutions Data Engineer you will be responsible for expanding and optimizing our data and data pipeline architecture, as well as optimizing data…",Customer Solutions Data Engineer,Seattle, WA
51,Amazon.com,"Strong knowledge of data structures, algorithms, operating systems, and/or distributed systems. We’re therefore looking for most talented and innovative…",Software Engineer,Seattle, WA
52,Watson Furniture,This pivotal role leads the team in resolution of CAD data and bill-of-manufacturing issues in the factory. The Watson Engineering Manager ensures the integrity…,Engineering Manager,Poulsbo, WA
53,Nintendo of America Inc.,Detailed design and build of the enterprise data warehouse and data marts from inception through production support.,Senior Data Engineer,Redmond, WA
54,Structured Communication Systems,"The noise level in the data center environment is generally loud. Structured has immediate openings in Clackamas, Oregon and Bellevue, Washington for a Systems…",Systems Engineer – Tier I (Help Desk),Bellevue, WA
55,Homesite Group,"Direct the data layer implementation across the platform and website properties. Implement and manage analytics tools (Primarily Google Analytics 360, Google…",Data Analytic Engineer,Seattle, WA
56,"Highmark Concrete Contractors, LLC.","The Field Engineer assists and supports the Superintendent and Project Engineer on assigned project(s). Project Manager, Project Engineer, Superintendent,…",Field Engineer,Sammamish, WA
57,"Woot, Inc.","This person will build new business intelligence solutions as an owner end-to-end, at the same time, collaborate with data engineers and data scientists to…","Data Engineer II (Woot LLC, Seattle, WA)",Seattle, WA
58,Facebook,"In this role as a Data Engineer on the Analytics team, your primary responsibility will be to partner with key stakeholders, data scientists and software…",Data Engineer,Seattle, WA
59,JNIT TECHNOLOGIES INC,"Big data (Azure preferably, or else Hadoop). Phone to onsite/Skype for out of state. Scala or Spark (Heavy Scripting).",Big Data Engineer,Redmond, WA
60,Google,"From creating experiments and prototyping implementations to designing new architectures, Research Interns and Software Engineers work on challenges in…","Research Intern, 2020",Seattle, WA
61,BOEING,Boeing Commercial Airplane is seeking an Aviation Product Cybersecurity Engineer to join our team. Providing technical data and develop documentation in…,Cybersecurity Engineer - Entry Level,Seattle, WA
62,Quantcast,"As a Software Engineer, you’ll seek significant answers related to Machine Learning, Distributed Storage Systems, Big Data Platforms, API Development and Data…","Software Engineer, New Graduate 2020",Seattle, WA
63,Premera Blue Cross,The Corporate Data and Analytics team is looking to bring on a Data Engineer II . 1-2 years of experience as a Data Engineer I. And so are our employees.,Data Engineer II,Mountlake Terrace, WA
64,Microsoft,The Data Engineering team builds and operates an extensive data platform that associates telemetry and customer contact data.,Software Engineer 2 (Data Engineer),Redmond, WA
65,Zillow,"You will design and develop data visualizations that help us extract key insights from our data, which might otherwise go unnoticed.",Data Visualization Engineer,Seattle, WA
66,Tableau,We help people see and understand their data. Software Engineer Interns work on joint projects with Tableau Software Engineers over a summer or similar time…,Software Engineer Intern (Summer 2020),Seattle, WA
67,Novanta,"TEST ENGINEER – Reach Technology Manufacturing. Works closely with continuous improvement engineer, off-site design engineers, and manufacturing engineering to…",Test Engineer,Mukilteo, WA
68,"University Mechanical Contractors, Inc","Support Lead Engineers on large design projects. During construction, support the Lead Engineer and project management. Review shop drawings and submittals.",Design Engineer,Mukilteo, WA
69,"Institute for Shock Physics, Washington State University","Good computer skills, including experience with technical/design programs, such as LabView or SolidWorks, and working knowledge of data analysis software.","Research Operations Engineer Position - Pullman, WA",Washington State,
70,TISS,Should be in Data engineering and not Data Analyst or Data scientist. Should be well versed in creating data pipelines using Python.,"Data Engineer or Database Developer - Menlo Park, CA / Seattle , WA",Seattle, WA
71,Facebook,Cross-correlate data from various techniques to drive towards conclusions. We are looking for a specialist who knows not only how to measure data using a suite…,Failure Analysis Engineer,Redmond, WA
72,Bungie,"Implement and optimize data pipelines, architectures and data sets on cutting-edge hardware. As a Data Engineer at Bungie you will help architect and support…",Data Engineer,Bellevue, WA
73,Microsoft,Constant collaboration with Support Engineers at different levels and technology area. Support Engineers (SE) serve as technical resources for Microsoft’s…,Support Engineer,Redmond, WA
74,Mitsubishi Aircraft Corporation,"As the Flight Test Project Engineer, you will be responsible for supporting your assigned Flight Test Vehicle (FTV) work scope, test readiness, test execution,…",Flight Test Project Engineer (Recent Graduate),Moses Lake, WA
75,Homesite Insurance,"We’re looking for a Data Engineer to help us transform our data systems and architecture to support greater variety, volume, and velocity of data and data…",Data Engineer,Seattle, WA
76,Microsoft,Technical Excellence - Core to being a software engineer is of course technical excellence. Customer Focus - A focus on delivering customer value and being able…,Data Scientist,Redmond, WA
77,Expedia Group,"Knowledge of data structures, algorithms and OOP concepts. As a software engineer at Expedia you will design and implement high-volume, fault tolerant, scalable…",New Graduate - Software Development Engineer 1,Seattle, WA
78,State of Washington State Investment Board,The Washington State Investment Board (WSIB) is seeking highly qualified candidates to fill an Investment Data Engineer position within the Investment Data…,Investment Data Engineer,Olympia, WA
79,BOEING,"Must be able to interact with employees to gather data for process improvements. This may include observing and documenting processes, and collecting data in…",Entry-Level Industrial Engineer,Everett, WA
80,Symphony AzimaAI,"3+ years experience as a Software QA Engineer and/or a Software Test Engineer. Software QA Engineer and / or Test: Experience with ALM processes, including:",Software QA Engineer,Poulsbo, WA
81,eXcell,The Database Engineer / Data Scientist will be instrumental in collecting data around processes and creating a warehouse for various teams to consume.,Database Engineer / Data Scientist,Redmond, WA
82,Sound Transit,Professional Civil Engineer License issued by the State of Washington. Preparing and analyzing complex data and comprehensive reports.,Senior Civil Engineer - Traffic,Seattle, WA
83,Structured Communication Systems,"The noise level in the data center environment is generally loud. Structured has immediate openings in Clackamas, Oregon and Bellevue, Washington for a Systems…",Systems Engineer Tier- II,Bellevue, WA
84,Pythian,"Warehousing, data marts, data lakes). Experience in data management best practices, real-time and batch data integration, and data rationalization.",Big Data Engineer,United States,
85,WiWynn,"Conduct analysis with tools, schematics, records and data books to find the root cause of the issue. Provide timely response and service to customer for issues…",Failure Analysis Engineer,Redmond, WA
86,Polaris Industries,"Coordinate data gathering and reporting of key metrics for process improvement events. Drive the design, implementation, and continuous improvement of the…",Lean Engineer,Battle Ground, WA
87,Woot Services LLC,"This person will build new business intelligence solutions as an owner end-to-end, at the same time, collaborate with data engineers and data scientists to…","Data Engineer, Woot!",Seattle, WA
88,Zillow,Interest in working with multi-terabyte-sized data sets and are comfortable accessing those data (even if they're in JSON format) with Hive and Presto.,Data Scientist - Intern,Seattle, WA
89,Grab Taxi,Design and implement robust data pipelines. Minimum 3 years experience as a software engineer writing production code. Get to know the Role:,AI Engineer,Bellevue, WA
90,Zillow,"We are looking for a Software Engineer to join the Listing Data team. Develop faster and innovative ways to process data. In this role, you will:",Software Development Engineer- Listing Data,Seattle, WA
91,Microsoft,Courses in OO programming and data structures. Applications to this opportunity are considered for all available Silicon Development Engineer full time roles…,Full Time Opportunities for Students or Recent Graduates: Silicon Engineering,Redmond, WA
92,Google,"Experience working with Data Structures or Algorithms (i.e. Data structures /algorithms class, coursework/projects, research, internships, or other practical…","Software Engineer, University Graduate",Kirkland, WA
93,Puget Sound Energy,Acquiring performance data from new and existing equipment or systems to validate against design parameters. Puget Sound Energy is looking to hire early-career…,Engineer In Training,Kent, WA
94,Cloudix,"Data Engineer will be responsible for expanding and optimizing data and data pipeline architecture, as well as optimizing data flow and collection for cross…",Data Engineer with AWS,Bellevue, WA
95,Imperative,"You will gain deep experience in start-up development, internal communications, running a SaaS technology stack, being part of a globally distributed team that…",QA Engineer,Seattle, WA
96,Philips,"Presents complex technical data in a concise way. Documents data / decisions in a detailed and structured way. In this role, you have the opportunity to.",Systems Engineer,Bothell, WA
97,Revel Consulting,"AS A BIG DATA ENGINEER SENIOR ASSOCIATE FOR THE TECHNOLOGY COMMUNITY, YOU: Advanced knowledge of Big Data & Data Engineering, with deep, hands-on technical…",Big Data Engineer,Seattle, WA
98,AeroMech Incorporated,"Federal Aviation Administration (FAA) certification responsibility, program management planning, data aircraft systems engineering/design, data analysis and…",Aircraft Certification and Systems Engineer,Everett, WA
99,Modern Electron,Utilize laboratory and field test data to correlate and validate analytical models. Experience analyzing laboratory and field test data to correlate and…,Combustion Engineer,Bothell, WA
100,Zumiez Inc,"Ability to define problems, collect data, establish facts, and draw valid conclusions. Seeks out advice, coaching and educational opportunities from architects…",Applications Engineer,Lynnwood, WA
101,"Agilysys, Inc.","Experience in fundamentals of data structure, algorithm design, problem solving, copmlexity analysys. Agilysys is looking for talented, motivated Software…",Junior Software Engineer,Bellevue, WA
102,Leaseweb USA,Our team of Data center Operations Engineers is involved in the daily management of our 10 data center facilities throughout the US.,Data Center Engineer,Seattle, WA
103,"Amazon.com Services, Inc.","5+ years of experience as a Data Engineer, BI Engineer, Business/Financial Analyst or Systems Analyst in a company with large, complex data sources.","Data Engineer, Global Exports",Bellevue, WA
104,Invitae,"As a Healthcare Data Engineer, you'll be responsible for collaborating with product managers, data scientists, designers, and engineers to help us make sense of…","Data Engineer, Healthcare",Seattle, WA
105,Sound,"The Data Engineer has the responsibility to oversee data organization, data warehouse, maintenance, and support development of Data Analysis - Reporting.",Data Engineer,Tukwila, WA
106,Calabrio,"The Calabrio software suite generates large quantities of numerical, text, audio, and user-generated data. We are looking for an individual with a passion for…",Haskell and Data Engineer,Vancouver, WA
107,ASSURANCE,Our Data Engineers design and build the backbone that makes this development possible with no support from engineering (we own our stack end to end).,Data Engineer,Seattle, WA
108,Nordstrom,"An engineer 2 is part of a key team of Nordstrom Technology professionals that applies scientific, mathematical and social principles to design, build, and…",Engineer 2 - Search Data Platform,Seattle, WA
109,TTi Global,"Experience in Handling Big Data Ingestion. 5+ yrs of Hadoop based technologies – HDP. Experience with Sqoop, spark, python/java.",Sr. Data Engineer,Bellevue, WA
110,"Amazon.com Services, Inc.","Business Intelligence Engineer, Quantitative Analyst, Data Scientist, Software Engineer, etc.). Understanding of data management fundamentals, data storage…","Snr, Data Engineer, WWCS",Seattle, WA
111,Indeed,"Work side by side with world-class QA Automation Engineers, QA Engineers, Software Engineers, Data Scientists, Site Reliability Engineers, Tech Writers, and…",QA Automation Engineer,Seattle, WA
112,Confidential,Experience in data center and/or cloud operations and migrations. Expert knowledge of various Cisco Route/Switch equipment and Data Center technologies.,Lead Network Engineer,Seattle, WA
113,SR Education Group,"Our experienced Ruby on Rails software engineers write and maintain complex code bases, process large amounts of data using advanced algorithms, and design…",Software Engineer,Kirkland, WA
114,Zillow Group,"As a Data Engineer, you will be responsible for all phases of the development cycle: Work closely with business stake holders, data analysts and machine…","Software Development Engineer, Big Data",Seattle, WA
115,Stillaguamish Tribe of Indians,_Designs databases and data dictionary criteria. Ability to consolidate Access databases into a logical SQL implementation and design web based front ends for…,Database Engineer,Arlington, WA
116,Red Ventures,"Data Engineers at HigherEducation.com drive business value by transferring and structuring data for production and consumption by engineers, businesses,…",Data Engineer,Seattle, WA
117,"ExtraHop Networks, Inc.",Employ a mix of manual and automated data analysis techniques to collect data and analyze the operational environment of the ExtraHop system.,Intern Data Scientist,Seattle, WA
118,US Department of Veterans Affairs,"A) Professional registration - Current registration as an Engineer Intern (EI), Engineer in Training (EIT), or licensure as a Professional Engineer (PE) by any…",General Engineer,Walla Walla, WA
119,City of Tacoma,Engineer in Training (EIT)/Fundamentals of Engineering (FE) is highly desired. Work collaboratively with and direct others to verify and validate customer…,Distribution Line Engineer,Tacoma, WA
120,"Amazon.com Services, Inc.","Industry experience as a Data Engineer or related specialty (e.g., Software Engineer, Business Intelligence Engineer, Data Scientist) with a track record of…","Data Engineer, Global Workforce Solutions",Seattle, WA
