,company_name,job_summary,job_title,City,State
940,Tableau,"Coach and mentor senior engineers. We help people see and understand their data. In addition to direct execution of feature work, the Marketing Engineer works…",Staff Marketing Engineer,Seattle, WA
941,Hardsuit Labs Inc,Assist designers and engineers with game-play prototypes. Experience with motion capture data and the mocap pipeline. Facilitate and inform tool development.,Character Animator,Seattle, WA
942,BOEING,We are engineers and technicians. Provide technical data and develop documentation in accordance with requirements and system security processes and procedures…,Cybersecurity Specialist 4,Seattle, WA
943,Pacific Northwest National Laboratory,"The Advanced Computing, Mathematics, and Data (ACMD) Division at the Pacific Northwest National Laboratory is seeking for a Data Scientist for its Data Sciences…",Data Scientist,Richland, WA
944,Dropbox,"Security Engineering- People trust Dropbox to keep their data secure, and at Dropbox we rely on our security engineers to make our products safe.",Software Engineer University Grad,Seattle, WA
945,Cannon Construction,Cannon Companies provides copper and fiber inside/outside plant data networks for corporations and government agencies around the world.,Permit Coordinator,Milton, WA
946,Hire Resolve,"Works under the supervision of a Professional Engineer. Are you a Geotechnical Engineer looking for a change? Analyze data, and perform engineering calculations…",Geotechnical Staff Engineer,Seattle, WA
947,Saudi Aramco,"Manage and prepare studies and reports on drilling subjects, provide recommendations, alternative proposals, and preliminary design and program outlines with…",Drilling Engineer- Relocation to Saudi Arabia,United States,
948,Mixpanel,"Features to keep data clean, accurate, and trustworthy. Then they can use that data to improve their business and products. We're looking for someone with:",Frontend Engineer,Seattle, WA
949,BOEING,We are engineers and technicians. The Stationary Engineers and Boiler Operators also regularly perform routine maintenance. Valid Drivers License is required.,Power Plant Operator,Auburn, WA
950,Wilbur-Ellis Company,Wilbur-Ellis is seeking a passionate Test Automation Engineer who will partner with and work closely with the software engineers to ensure our new UI/UX project…,"Software Engineer in Test (Tukwila, WA)",Seattle, WA
951,Thurston County,"Participating in meeting with vendors, customer, engineers, architects and user department representatives; The Department has 48 employees, supporting a County…",Facilities Technician II,Olympia, WA
952,"Amazon.com Services, Inc.","You should be an engineer who is focused on developing internal systems written in Python, Java, C or a similar language.",System Dev Engineer I,Seattle, WA
953,Microsoft,"Software engineers (SWEs) work with teammates to solve problems and build innovative software solutions. Ability to demonstrate understanding of algorithms,…",Internship Opportunities for Students: Software Engineering & Program Management (Washington area),Redmond, WA
954,BOEING,The Boeing Test and Evaluation (BT&E) organization is seeking a First Level Leader to join our Transport Data System management team supporting NW Flight Test…,BT&E Flight Test Manager - Transport Data Systems,Seattle, WA
955,"Amazon.com Services, Inc.","Partnering with our Data Engineering team to enhance data infrastructure, data availability, and broad access to customer insights made available through…","Business Intelligence Engineer, Amazon Music",Seattle, WA
956,L&T Technology Services Ltd.,"Call and data performance KPI testing. Performing Mobile handset Field testing on live network. Perform Mobile testing on live/ Lab network on 3G, LTE and LTE…",Mobile Protocol Field Test Engineer,Redmond, WA
957,"Amazon.com Services, Inc.","Experience mentoring junior software engineers to improve their skills, and make them more effective, product software engineers.",Sn. Software Development Engineer,Seattle, WA
958,Talascend LLC,"Talascend is currently seeking an Electronics Software QA Engineer for a contract opportunity in Bellevue, WA. 2-4 years of experience required.",Electronics Software QA Engineer,Bellevue, WA
959,f5,"An interest in information security, big data and data presentation is a must! Interns at F5 work in collaboration with senior engineers and designers who are…",Internship -- F5 Labs,Seattle, WA
960,Blue Origin,"As a Software Engineer, you will automate data management and reporting processes for engineers doing mechanical, electrical, and structural design across all…",Software Engineer - Data Management,Kent, WA
961,Muckleshoot Indian Tribe,"Enters data or information into a terminal, PC or other keyboard device. Assist the Chief Engineer with training personnel in the repair and maintenance of…",Engineer II,Auburn, WA
962,"Amazon.com Services, Inc.","Interface and collaborate with aerodynamics and performance engineers, flight control engineers, flight test engineers, and systems engineers in order to set…",Research Scientist II - AMZ3535,Seattle, WA
963,Facebook,Ranking quality evaluation and data analysis. Facebook's mission is to give people the power to build community and bring the world closer together.,"Software Engineer, Search Ranking",Seattle, WA
964,Growth Mindset,"As a DevOps Engineer on the Enterprise Data Management (EDM) team, you will be working with IT operations, systems administration, and application support teams…",DevOps Engineer - Enterprise Data Management (EDM) team,Tacoma, WA
965,Amazon Services LLC,"Computer Science fundamentals in data structures. Possess an extremely sound understanding of areas in the basic areas of Computer Science such as Algorithms,…",Software Development Engineer,Seattle, WA
966,"Amazon.com Services, Inc.",Experience and ability to effectively gather information from multiple data sources and systems then present that data and information in a logical and…,Business Intelligence Engineer - WW Ops,Seattle, WA
967,Avalara,Develop new implementations of data driven technology stacks. We are looking for a full-stack developer that is well-versed in server side and data driven…,Software Engineer,Seattle, WA
968,Zillow Group,Design data access and transformation abstractions to facilitate onboarding new pipelines. Experience building data pipelines with distributed processing…,Senior Software Development Engineer- Big Data,Seattle, WA
969,Virtuoso,"Understand and apply the advanced principles of entity-relationship model design, good data typing practices, index management, data management, and data…",Senior Business Intelligence Engineer,Seattle, WA
970,Cyient,"Senior Wire Installation Design Engineer - Seattle, WA. Celebrating its twenty-fifth anniversary in 2016, Cyient is an acknowledged leader in engineering design…",Senior Wire Installation Design Engineer,Seattle, WA
971,CDW,"Senior Virtualization Delivery Engineers at CDWG team with other Engineers on highly visible, technically challenging projects and offerings.",Sr. Virtualization Delivery Engineer - Federal,United States,
972,FedEx Supply Chain,"Expert analytic and problem solving capacity with large data sets. Assess inbound, outbound data files for volume profiles and peak concerns.","Engineer, Project IV",United States,
973,Zillow,"Zillow embraces daunting challenges like this one, and that's why we are looking for a Software Development Engineer to help contribute to our success.",Software Development Engineer,Seattle, WA
974,Foundries.io,The Community Engineer role is to create compelling demonstrations for the Foundries.io platform in different market sectors (e.g.,Foundries.io Community Engineer,Seattle, WA
975,"Angeles Composite Technologies, Inc.","Physical activity (30%) consists of generating and/or collecting data, maintaining hardcopy files, and maintaining/enhancing manufacturing processing…",Manufacturing Engineer,Port Angeles, WA
976,Cardno,"> Conduct survey, testing, and data recovery of archaeological sites. > Experience with completing inventory, survey, testing, and/or data recovery.",Archaeologist I,Seattle, WA
977,James Hardie,"The Mechanical Engineer has excellent decision-making skills in order to be able to make critical, on the spot process related decisions with limited data.","Engineer II, Mechanical Engineer - Tacoma 2",Tacoma, WA
978,BOEING,We are engineers and technicians. Planner - Compiles data from headcount projections and business plans to enable forecasting.,Boeing Summer 2020 Internship – Facilities Project Management,Everett, WA
979,Facebook,"Partner with expert research scientists, mechanical engineers, electrical engineers, and other brilliant software minds to build cutting-edge prototypes, as we…",Software Engineer - Perceptual Science,Redmond, WA
980,AppSheet,A qualified applicant would have a computer science degree and five years of experience working with server technology and data.,Site Reliability Engineer,Seattle, WA
981,Facebook,"Knowledge of device physics, statistic data analysis and knowledge with sensor data analysis methodologies. The Cameras & Sensors group is looking for a world…",Sensor Characterization Engineer,Redmond, WA
982,Blue Origin,Perform subsequent data reduction and reviews. Demonstrate high standards in test operations and work cooperatively with a diverse team of Integration Engineers…,Test Engineer I - Kent Test Operations,Kent, WA
983,Philips,"Mentoring, coaching, and providing work direction to other engineers, technicians and interns. Compiling and analyze validation data, prepare documentation, and…",Sr. Hardware Verification & Validation Engineer,Bothell, WA
984,D. R. Horton - WA,"Solicit bids and determining engineers and other consultants. Ability to define problems, collect data, establish facts, and draw valid conclusions.",Entitlement Analyst/Project Manager - Residential Construction,Kirkland, WA
985,Philips,Collaborate with other Software Development Engineers and Software Test Engineers to deliver the highest quality products in a timely and cost-effective manner.,Senior Software Development Engineer,Bothell, WA
986,Tindall Corporation,"Must have strong computer skills to include word processing-Word, spreadsheet-Excel, presentation-PowerPoint, documentation systems, data base management, and…",Industrial Engineer (Plant),United States,
987,Ramp Group,"Perform data architecture, data modeling, data access, data integration, database design and implementation techniques. Mail your resume to Ramp Group,.",Software Engineer,Bellevue, WA
988,Accenture,"Have a concentration in Data Analytics, Data Science, and/or Big Data. Build tools to connect to multiple data sources, collect data, store and analyze data,…",Entry Level Accenture Technology Advanced Application Engineer,Seattle, WA
989,Google,"We're looking for engineers who bring fresh ideas from all areas, including information retrieval, distributed computing, large-scale system design, networking…",Staff Software Engineer,Kirkland, WA
990,Uber,"Our team owns the end-to-end experience which includes frontend, backend, operation tools, experimentation and data analysis pipeline.",Backend Software Engineer - Premium/Rider Verticals (Seattle),Seattle, WA
991,Tableau,"We help people see and understand their data. At Tableau, our mission is to help people see and understand their data. Some of the things we'll be doing….","Software Engineer, Interactive Analytics",Seattle, WA
992,Zumiez Inc,"Ability to define problems, collect data, establish facts, and draw valid conclusions. Seeks out advice, coaching and educational opportunities from architects…",Applications Engineer,Lynnwood, WA
993,Grab Taxi,Design and implement robust data pipelines. Minimum 5 years experience as a software engineer writing production code. Get to know the Role:,Senior AI Engineer,Bellevue, WA
994,Turner Construction Company,"Assist in obtaining and reviewing information and approvals for processing of shop drawings, product data and samples. Use hands to finger, handle, or feel;",Intern Seattle 2019-2020,Seattle, WA
995,Microsoft,"Our team of engineers and data scientists have pioneered the analysis of all such collaboration signals into anonymous, aggregated, predictive data that can…",WPI Full-Stack Senior Engineer,Redmond, WA
996,BMC,BMC is seeking an Innovation Controls Engineer to join our growing team! Hands-on design guidance and design confirmation testing and data acquisition…,Innovations Controls Engineer,Issaquah, WA
997,"Railhead, Inc.","Extracting data for reporting purposes. Partners with developers and engineers to reduce re-occurring incidents. System start-up, initialization and shut down.","Multi-functional Field Service Engineer / DBA - Charlottesville, VA",United States,
998,Ookla,"We are looking for a highly capable software engineer to join our Android team. Expertise in Java with a solid foundation in data structures, algorithms and…",Android Software Engineer,Seattle, WA
999,"Plastic Executive Recruiters, LLC","Experience with data analysis, technical reporting, R&D, metrology and regulatory structures. Company located in the Northern California*.",Sr. Process Development Engineer,Seattle, WA
1000,Splunk,Opportunities to develop and grow as an engineer. We believe in growing engineers through ownership and leadership opportunities. Desire to Learn and Adapt.,Principal Software Engineer - Cloud and Microservices,Seattle, WA
1001,Safran,Provides guidance and feedback to other Stress Engineers. The Group places fourth on the Universum ranking for the favorite companies of newly-qualified…,Greenpoint - Senior Stress Engineer,Kirkland, WA
1002,"Amazon.com Services, Inc.","Experience conceptualizing and implementing data warehousing or data lake solutions to support long term business data needs (familiarity with AWS, API’s,…",Business Intelligence Engineer | Social Responsibility,Seattle, WA
1003,Microsoft,"Data mining knowledge that spans a range of disciplines. Work with engineers, marketing partners and other content providers to produce and secure all content…",Community Manager 2,Redmond, WA
1004,Facebook,"Machine learning, recommendation systems, pattern recognition, data mining or artificial intelligence. Facebook is seeking Machine Learning Engineers to join…","Software Engineer, News Feed",Seattle, WA
1005,Starbucks,Engineer build and release processes. Platform engineer I – Cloud Foundation Services. Implements all technologies in accordance with Information Security's…,"platform engineer I, Cloud Foundation Services, Starbucks Technology - Seattle, WA",Seattle, WA
1006,Outreach,Data is at the core of Outreach's strategy. This requires a scalable cost-efficient data and ML infrastructure. You have substantial coding experience.,Machine Learning Engineer,Seattle, WA
1007,T-Mobile,"This is a 12-week paid learning experience with our army of project managers, web developers, and engineers, all working like a well-oiled machine to keep our…",2020 Technology Internship (Computer Science),Bellevue, WA
1008,AbSci,The role will also be responsible for integrating instrument data with the LIMS and other in-house systems. The automation engineer will lead systems automation…,"Automation Engineer I/II, Scientific Computing and Bioinformatics",Vancouver, WA
1009,"City of Kent, WA",Engineer II/III- Engineering Plan Review (TLT). Minimum Qualifications for Engineer II include: Minimum Qualifications for Engineer III include:,Engineer II/III- Engineering Plan Review (TLT),Kent, WA
1010,SOUND TRANSIT,"Preparing and analyzing data and comprehensive reports. Under general direction, performs professional duties involved in serving as technical expert for…",Scheduling Engineer,Seattle, WA
1011,Amazon Services LLC,"Experience mentoring and managing other Data Engineers or Software Development Engineers, ensuring data engineering best practices are being followed.","Manager III, Data Engineer",Seattle, WA
1012,"Amazon.com Services, Inc.","Proficiency in data structures, algorithm design, problem solving, and complexity analysis. Bachelor’s (or above) Degree in Computer Science or related field.","Software Development Engineer, Alexa Shopping",Seattle, WA
1013,"Envestnet Asset Management, Inc",Familiarity with Microsoft SQL Server Management Studio and SQL queries for test scenario validation and data manipulation. What competencies will you have –.,Software Test Engineer III,Seattle, WA
1014,McKinstry,We are currently seeking an Enterprise Data Architect to join our team as a member of our growing Technology Applications & Systems division.,Enterprise Data Architect,Seattle, WA
1015,Terex Corporation,"Solid understanding of C and comfortable with C++ including STL data structures. Genie Industries is a global leader in the production of aerial work platforms,…",Software Engineer II,Redmond, WA
1016,Source Engineering,Perform site visits to ensure project data is correct. Preferably ten or more years of experience working as an engineer. A passion for serving others.,Design Engineer,Bellingham, WA
1017,Oracle,"Software Engineer - Public Cloud IaaS (JoinOCI-CVMCM)-190017A8. Strong knowledge of data structures, algorithms, operating systems, and distributed.",Software Engineer - Public Cloud IaaS (JoinOCI-CVMCM),Seattle, WA
1018,Tableau,"We help people see and understand their data. When requested, work with the network architect to engineer solutions based on business requirements.",Network Engineer,Seattle, WA
1019,Facebook,"Experience working with large-scale data in multi-method studies. Partner with engineers, analysts, and other technical roles to create and share research.",Qualitative UX Researcher,Seattle, WA
1020,SAIC,Operational experience and exposure to national reporting and database reference tools for ELINT data. SAIC is seeking candidates for a full time opportunity…,Engineer / ELINT,Oak Harbor, WA
1021,KPMG,"Strong ability to rapidly ingest, transform, engineer, and visualize data for both ad-hoc and product-level (e.g., automated) data & analytics solutions;","Sr. Associate, AI Engineer",Seattle, WA
1022,Belcan,"Develop repair schemes utilizing SRM or Engineering data. Perform incoming aircraft accountability/inventory inspections in accordance with technical data,.",A&P Mechanic,Moses Lake, WA
1023,Facebook,"Facebook is seeking Machine Learning Engineers to join our engineering team. Machine learning, recommendation systems, pattern recognition, data mining or…","Software Engineer, Machine Learning",Seattle, WA
1024,AeroTEC Inc,Analyze test data and evaluate compliance with regulations. Support flight and ground test conduct and data collection. Are you looking for a challenge?,Flight Test Engineer,Seattle, WA
1025,Facebook,"Data analysis experience with JMP, MATLAB, Excel, or other analysis software. The Cameras and Sensors Group is looking for a Camera Systems Engineer who has…",Camera Systems Engineer,Redmond, WA
1026,DocuSign,Feature extraction and data preparation. We also maintain the highest possible standards around customer data security and service availability.,Machine Learning Engineer,Seattle, WA
1027,Schweitzer Engineering Laboratories,Mentors and directs the efforts of associate engineers and technicians. Schweitzer Engineering Laboratories (SEL) seeks a Hardware Engineer to work in our Power…,Hardware Engineer,Pullman, WA
1028,McKinstry,"Experience in T&E reporting, processing, and data analysis preferred. At McKinstry, we’re proud to be a collective group of innovators and problem-solvers,…",Travel Administrator,Seattle, WA
1029,BOEING,Boeing Commercial Airplane is seeking an Aviation Product Cybersecurity Engineer to join our team. Provide technical data and develop documentation in…,Mid-level Cybersecurity Engineer,Seattle, WA
1030,Airbiquity Inc,"Software Development Engineer, Test (SDET). Choreo™, and supports all leading use cases including over-the-air (OTA) software and data management.","Software Development Engineer, Test",Seattle, WA
1031,PACCAR,"Coordinates set up of tests, verifies that test equipment and instrumentation equipment meets specified requirements and performs software and data checks.",Powertrain Controls Validation Engineer,Mount Vernon, WA
1032,Amphenol Network Solutions,Using analytical data to drive and implement changes to reduce costs. Provide production assembly time estimates for new products and refine existing data for…,Manufacturing Engineer,Liberty Lake, WA
1033,Saudi Aramco,Saudi Aramco is seeking an Engineer – Data Scientist for the development and implementation of data analytics solutions to join the Process & Control Systems…,Data Scientist- Relocation to Saudi Arabia,United States,
1034,Servatron Inc,"Troubleshoots software programs, identifies problems, and assists software engineers in problem-solving. Prepare statistical reports, charts, and graphs using…",Electronics Contract Manufacturing Technician,Spokane Valley, WA
1035,Avalara,Develop new implementations of data driven technology stacks. We are looking for a full-stack developer that is well-versed in server side and data driven…,Software Engineer,Seattle, WA
1036,Apple,"You will play a key role in defining, designing, implementing and evaluating algorithms involving unique data and objectives.",Applied Machine Learning Engineer - NLP,Seattle, WA
1037,Facebook,You are the kind of engineer who has expertise writing systems software that sits between applications and devices. 7 or more years of C++ experience.,"Software Engineer, Drivers and Systems",Redmond, WA
1038,Amazon Services LLC,Amazon is data driven and a strong data backbone is necessary in our systems. You will be a senior software development engineer. THE CHALLENGES WE WILL TACKLE.,Software Dev Engineer,Seattle, WA
1039,DomainTools,"Deep enterprise-grade software, systems and data architecture experience. An ability to hire outstanding Engineers and technologists in a very competitive…",CTO,Seattle, WA
1040,Amazon Digital Services LLC,"You will also work with a team of economists, scientists, and software engineers to automate and scale the analysis and dissemination of big data, and to make…",Data Scientist,Seattle, WA
1041,Tableau,"The Senior Data Engineer role will help solve challenging data integration problems by participating in development, architecture and operations work, related…",Senior Data Engineer – Marketing,Seattle, WA
1042,Splunk,As a Software Engineer Intern you will be responsible for …. We believe in growing engineers through ownership and leadership opportunities.,Software Engineer Intern (Summer 2020),Seattle, WA
1043,HNTB Corporation,"Collects, organizes, and summarizes transportation data including output from travel forecasting models. HNTB is currently seeking an Engineer I - Traffic in…",Traffic Design Engineer I,Bellevue, WA
1044,Oracle,"Strong knowledge of data structures, algorithms, operating systems, and distributed. An engineer at any level can have significant technical and business impact…",Principal Software Engineer (JoinOCI-CVMCM),Seattle, WA
1045,Mitsubishi Aircraft Corporation,"Process, analyze, and draw conclusions from post flight data. Monitor live flight data, typically via telemetry, during flight test on aircraft.",Powerplant Engineer,Moses Lake, WA
1046,Consolidated Networks Corporation (CNC),"Viewand filter of consolidated site data. At the direction of the lead CNC SolarWinds training engineer, CNC trainer engineers will be responsible to deliver…",SolarWinds Trainer Engineer - NMS,United States,
1047,Novo Nordisk,Will lead the development and mentor application of algorithms for the in depth analysis of experimental data sets connected to development of new drug designs…,DIRECTOR- COMPUTATIONAL BIOLOGY Job,Seattle, WA
1048,Tableau,"To deliver on your mission, you'll bring your passion for developing world class engineering services and engineer experiences so that Tableau engineers are…","Senior Software Engineer, Build and Tools",Seattle, WA
1049,"Discovery Communications, LLC","Computer Science fundamentals in data structures. Discovery Digital Media is a well-funded start-up within Discovery Inc., a high-performing global team working…",Software Engineer,Bellevue, WA
1050,AECOM,"Interface cohesively with mechanical, structural, civil and process engineers to make sound decisions that facilitate optimum overall solutions.",Electrical Engineer,Richland, WA
1051,"Amazon.com Services, Inc.","We are looking for a Flight Test Engineer. Articulate test approaches, test plans, and perform data analysis. Bachelor’s Degree in Aerospace, or related field.",Flight Test Engineer - Prime Air,Seattle, WA
1052,Dolly,"Strong understanding of data structures & algorithms. As a Front-End Software Engineer you’ll be responsible for book.dolly.com, our customer-facing web client.",Front-End Software Engineer,Seattle, WA
1053,Aerojet Rocketdyne,"Previous experience analyzing rocket engine data preferable. Aerojet Rocketdyne is seeking an Associate Systems Engineer to join our team in Redmond, Washington…","Associate Engineer, Analysis/Systems Engineering",Redmond, WA
1054,Moogsoft,"As a Sales Engineer at Moogsoft, you’ll serve as a key member of our Sales Team. Naturally combining judgment and intuition and a constant curiosity for more…",Sales Engineer,Seattle, WA
1055,Securitas,"Basic knowledge of computer network architecture, data transmission and bandwidth. Manages all aspects and phases of physical security system solution services…",Technology Solutions Engineer,Redmond, WA
1056,Microsoft,Strong communication skills and the desire to collaborate in a team of engineers. The AI and Advanced Architectures team is looking for hardware engineers to…,Sr Hardware Engineer,Redmond, WA
