,company_name,job_summary,job_title,City,State
356,Port of Seattle,"Reduce and compile data for tide adjustments. Identify topographical elements for the collection of data. Utilizes onboard computer to collect, code and store…",Assistant Civil Engineer Technician (Assistant Surveyor),Seattle, WA
357,Invitae,"We are a cross-functional team of scientific domain experts and dedicated, curious engineers. As the data gets bigger, our systems need to get better and faster…",Senior Software Engineer,Seattle, WA
358,"Discovery Communications, LLC",You are able to take documented designs prepared by more experienced engineers and contribute code to implement the design working solo or with other engineers…,Software Development Engineer I,Bellevue, WA
359,Qumulo,Qumulo is a Seattle based data storage startup. Data driven and have desire to work in collaborative team environments. We hire individuals who are:,Software Development Engineer (Internship),Seattle, WA
360,Puget Sound Energy,"Identifies test environment requirements, including data sources (extraction, creation, manipulation), files and tables. Micro Focus ALM & Performance Center:",IT QA Test Engineer/Tools Admin,Bellevue, WA
361,Dropbox,Software engineers work at all levels of the stack to deliver software - everything from syncing exabytes of data ( https://blogs.dropbox.com/tech/2016/05…,Software Engineer,Seattle, WA
362,"Ellumen, Inc","Experience with DICOM Viewer, Clinical Image data, Radiology workflow and VistA Imaging. The purpose of SCIP is ongoing operations and maintenance of medical…",Automated Test Engineer,Opportunity, WA
363,Zillow,"Zillow is hiring a Machine Learning Engineer - Intern for a 12 week summer internship, with an interest in web-scale distributed systems, data engineering, and…",Machine Learning Engineer - Intern,Seattle, WA
364,Sacré-Davey Engineering Inc.,"Communicates and coordinates with other team members, including managers, engineers, designers, and drafters. Prepares reports and other technical documentation…",Junior/Intermediate Mechanical Engineer,Seattle, WA
365,Terex,Desire to work with IoT data and product engineers in order to develop end-to-end data science solutions. Develop custom data models and algorithms to apply to…,Data Science (Telematics) Intern,Redmond, WA
366,Metropolitan Washington Airports Authority,Licensure as a Professional Engineer (PE) in the Commonwealth of Virginia. Ability to perform detailed analyses of data and information and make recommendations…,Operations Industrial Engineer,Headquarters, WA
367,VMware,"Ability to work on multiple projects with various groups including Systems Engineers, Storage Engineers, Networking, and Design & Architecture, etc.",Data Center Operations Engineer,Wenatchee, WA
368,ProKarma,Hands-on ability to manipulate data and build analytical data sets. Collaborate with data engineers to optimize the data platform to product the analysis…,Data Analyst,Seattle, WA
369,Onward Search,"5+ years of industry experience as a Data Engineer or related specialty such as Business Intelligence Engineer, Data Scientist.",Data engineer,Seattle, WA
370,BOEING,"We are engineers and technicians. Obtain job assignment from data systems, management or designee. Machine Repair Mechanics do the following:Repair critical…",Machine Repair Mechanic,Renton, WA
371,Charter Construction Inc,Extract unit prices and save data for future use. Review basic scopes of repair and structure estimates accurately and efficiently.,Project Engineer (Remediation Team),Seattle, WA
372,PayScale,"Our mission is to grow the company in traffic, data and revenue by focusing on SEO, improving data and lead conversion via A/B testing, and an e-commerce…","Software Technical Lead, Growth",Seattle, WA
373,Varsity Tutors,"Understanding of OO design, algorithms, and data structures. We are looking for talented software engineers to help with our ongoing growth and expansion!",Senior Full Stack Engineer (Remote),Seattle, WA
374,Spokane Transit Authority,"Able to use data and information to convey findings and recommendations. Construction Manager, Project Manager, Superintendent, Foreman, Scheduler, Cost…",Construction Manager / Project Engineer,Spokane, WA
375,Exotic Metals,"Utilize CMM’s, ESM’s, SRM’s and other repair data to: Aircraft Services is a FAA, EASA and CAAC approved repair station and a provider of PMA spares.",Senior Aftermarket Quality Engineer,Kent, WA
376,Philips,"In Computer Engineer or Electrical Engineering. Scopes, data acquisition systems, communication analyzer, spectrum analyzer, etc.). Why should you join Philips?",Embedded Systems Test Engineer,Bothell, WA
377,Innovative Edge Consulting,"Senior mobile SDET with experience in data driven testing, with strong experience in python. Innovative Edge TCS is currently looking to hire Mobile SDETs with…",SDET (Java Automation Engineer),Washington State,
378,"Amazon.com Services, Inc.","Experience in aerodynamics, acoustics, programming, data acquisition, and materials are valued. We're looking for an outstanding engineer who combines superb…",Mechanical Engineer Prime Air,Seattle, WA
379,KPMG,"Work in cross-disciplinary teams with KPMG industry professionals to understand client needs and ingest rich data sources (social media, news, internal/external…","Associate, Big Data Software Engineer",Seattle, WA
380,"Amazon.com Services, Inc.","Specifically, we are looking for an outstanding Data Engineer who is looking to work in a new space to help define how we use data to understand customer…",Data Engineer - Alexa,Seattle, WA
381,Microsoft,"Familiar with statistical data analysis and designed experiments. The Microsoft Quantum Group in Redmond, WA is looking for a Test Engineer familiar with ATE…",Test Engineer,Redmond, WA
382,"Amazon.com Services, Inc.",Amazon's Employee Services Technology (ES Tech) team is seeking an outstanding Senior Data Engineer to join our BI team to build out the data platform with all…,ES Tech Data Engineer,Seattle, WA
383,"Amazon.com Services, Inc.","Experience with ETL and Data Warehousing. Scripting skills to perform data manipulation (e.g., Python). Perform complex data analysis in support of ad-hoc…",BI Engineer,Seattle, WA
384,Tableau,"The Product Owner for our internal data platform is responsible for the modern platform, services, and tools that enable data engineers across the company to…","Product Owner, Data Platform",Seattle, WA
385,Boundless Immigration,We are a growing number of engineers and designers working out of downtown Seattle. You will understand the effectiveness of your work by working with our data…,Software Engineer,Seattle, WA
386,SADA,"Google Professional Data Engineer Certified. As a Data Engineer at SADA, you will work collaboratively with architects and other engineers to recommend,…",Data Engineer,Seattle, WA
387,Porch,"Collaborate with data scientists, product management, web engineers, and data engineers to deliver features to production. 2+ years ML Engineering experience.",Senior Machine Learning Engineer,Seattle, WA
388,SAP,"Ensure data consistency, performance, and exception management. Seeks a Support Engineer at our Bellevue, WA location (and various client sites nationwide) to…",Support Engineer,Bellevue, WA
389,ManTech International Corporation,"AIMS Assessment System Engineer Support. The collection, analysis and evaluation of signature data. ManTech is seeking a Junior Engineer to support our…",Junior Engineer,Silverdale, WA
390,FreightWeb,FreightWeb is putting together a rockstar team of engineers and data scientists in our Seattle HQ to make this disruption happen. Is great at problem solving.,Machine Learning Engineer,Seattle, WA
391,Hotwire,"Prior analytics and data mining experience, focusing on segmentation strategies and predictive modeling. You work closely with Product Managers and Engineers to…",Data Scientist II (Seattle),Seattle, WA
392,"Amazon.com Services, Inc.","As a Data Engineer on the CDE team, you will be responsible for: Build and deliver high quality data architecture to support business intelligence engineer and…","Data Engineer, Customer Delivery Excellence, Transportation Execution",Bellevue, WA
393,Wargaming.net,The Gameplay Engineer will report to Lead Software Engineer. Deep knowledge of the C++ language and commonly used data structures. What are we looking for?,Gameplay Engineer,Bellevue, WA
394,Blue Origin,"Demonstrated familiarity with data analysis. Develop and configure engine hot fire test sequences, analyze test data, and support subsequent data reviews.",Engines Verification and Test Engineer - I,Kent, WA
395,AECOM,"Provide support for data uploads, review and comparison of analytical data, and addition of new/revised data. Previous inventory and characterization experience…",Chemical Engineer,Richland, WA
396,Puget Sound Energy,PSE's IT Infrastructure team is looking for qualified candidates to fill an open Principle Identity Engineer position! Familiarity with Zero Trust framework.,Principle Identity Engineer,Redmond, WA
397,Tableau,"We help people see and understand their data. The Technical Support Engineer works primarily with enterprise customers of Tableau’s server and desktop products,…",Technical Support Engineer,Kirkland, WA
398,Local Spokane Manufacturing - Confidential,Ability to collect data and prioritize equipment needs. We are searching for an automation/ mechanical engineer to work on our manufacturing equipment.,Automation/ Mechanical Engineer,Spokane, WA
399,"Kyocera International, Inc.","Alphanumeric Data Entry, Spreadsheet, Word Processing/Typing. Capable of working independently and recording data. High level of personal energy;",R&D Technician 3 (Wafering),Vancouver, WA
400,Triveni IT,Light Data Model - Knows snowflake data schema. Understanding and experience with data sets and data flows. Data Analytics - Analysis of the data to improve the…,Sharepoint and Power BI Lead (Full Time with our Client),Bothell, WA
401,"Amazon.com Services, Inc.",As a Data Engineer you'll shape the data handling strategy; Leverage strong data extraction and transformation skills to engineer reporting mechanisms;,"Data Engineer, Transportation Execution",Bellevue, WA
402,"Amazon.com Services, Inc.","Experience managing full 3-tier architecture (Presentation, Application, and Data tier) Communication skills including presentations to diverse customer and…",Operations Engineer I,Seattle, WA
403,SEH America,"Use data to quantify results and determine best solutions. Knowledgeable with statistical data analysis techniques (JMP, SPC, DOE, Excel tools).",Process Engineer - EPI,Vancouver, WA
404,Facebook,"Work with internal technical operations teams to define problems, data collection, synthesize relevant data, build analytical models and forecasts.",Edge Network Quantitative Engineer,Seattle, WA
405,LOCKHEED MARTIN CORPORATION,"As a Program Quality Engineer, you will support the Fleet Ballistic Missile (FBM) Quality Program in Silverdale, WA. Knowledge of First Article Inspection.",Program Quality Engineer,Silverdale, WA
406,Dsquare,"Familiarity with Clickstream data sets and analytics is a plus. Capable of investigating, familiarizing and mastering new data sets quickly.",Sr. Data Engineer,Seattle, WA
407,JPMorgan Chase,"Solid understanding of application, data and infrastructure architecture disciplines. Contribute to a shared automation platform and ensure test data integrity.",Software Engineer,Seattle, WA
408,BECU,Full time on-site coverage required for employees who support the Spokane Data Center. The Systems Engineer must manage at least one infrastructure technology…,Systems Engineer,Tukwila, WA
409,Tableau,"We help people see and understand their data. Collaborating with designers, researchers, and engineers to come up with new ideas and ways to implement them.","Software Engineer, Prototyping",Seattle, WA
410,The Climate Corporation,"Science - Large-scale distributed data services for scientific computing (we use Clojure). You will work with Hadoop/Map Reduce, RDBMS and data visualization…",Intern: Software Engineer (Summer 2020),Seattle, WA
411,LabKey,"5+ years experience in the software industry as a program manager, software developer or automation engineer, strongly prefer software development experience.",Technical Program Manager,Seattle, WA
412,CDW,"Senior Consulting Engineers at CDW are smart, hard-working Engineers who enjoy teaming with other best and brightest Engineers on highly visible, technically…",Senior Consulting Engineer-Network/Data Center,Seattle, WA
413,Orchestra Technology,"The Mobility Network Engineer must possess a mix of broad networking knowledge, virtualized platforms and specific Deployment/Implementation expertise of Mobile…",EPC Mobility Engineer,Seattle, WA
414,Indeed,"The SMB Hiring team is a group of engineers, designers, data scientists and product managers who are responsible for the products used by millions of Small and…",Staff Software Engineer - SMB,Seattle, WA
415,Novanta,"Ability to define problems, collect data, establish facts, and draw valid conclusions. Prepares reports by collecting, analyzing, and summarizing data and…",Quality/Reliability Engineer,Mukilteo, WA
416,Concur Technologies,"Ensure data consistency, performance, and exception management. ERP, Engineer, SAP, Embedded, Information Systems, Technology, Engineering.",Support Engineer,Bellevue, WA
417,T-Mobile,"This is a 12-week paid learning experience with our army of project managers, web developers, and engineers, all working like a well-oiled machine to keep our…",2020 Technology Internship (Analytics),Bellevue, WA
418,Tech Mahindra,"5+ years’ experience in T-SQL, SCOPE, USQL, SSRS , SSIS, SSAS, Azure Data Factory, PowerBI development. Strong Experience in designing and developing large…",Site Reliability Engineer (SRE) - Data,Redmond, WA
419,"Amazon.com Services, Inc.","Industry experience as a Data Engineer or related specialty (e.g., Software Engineer, Business Intelligence Engineer, Data Scientist) with a track record of…",Data Engineer II - Talent Products,Seattle, WA
420,Facebook,"Relevant industry experience is important (Site Reliability Engineer (SRE), Systems Engineer, Software Engineer, DevOps Engineer, Network Engineer, Systems…",Production Engineer,Seattle, WA
421,Persha Studia,The Gameplay Engineer will report to Lead Software Engineer. Deep knowledge of the C++ language and commonly used data structures. What are we looking for?,Gameplay Engineer,Bellevue, WA
422,"Amazon.com Services, Inc.","Ability to work with a wide range of people including research scientists, engineers and customers, and engineers. Current FAA Part 107 license.",Support Engineer,Seattle, WA
423,Oracle,"An engineer at any level can have significant technical and business impact. Strong knowledge of data structures, algorithms, operating systems, and distributed…",Software Engineer (JoinOCI-NLSDST),Seattle, WA
424,employHER,"Software Engineer, Data Engineer, and Data Scientist) with extensive professional experience and a proven track record in a role focused on understanding,…",Business Intelligence Engineer,Seattle, WA
425,KPMG,"Strong ability to rapidly ingest, transform, engineer, and visualize data for both ad-hoc and product-level (e.g., automated) data & analytics solutions;","Manager, Big Data Software Engineer",Seattle, WA
426,Volant Aerospace,"From component overhauls to fleet-wide reconfigurations, we have the capabilities to project manage, engineer, design, fabricate, integrate, source, test, and…",Production Technician,Burlington, WA
427,Orchestra Technology,Prepare test results data and writes requiredengineering reports to ensure products compliance with requirements and testplans. CDMA/GSM/LTE (5G is a bonus).,Device Test Engineer,Seattle, WA
428,Sazan Group,"In this role, you will design low-voltage data and telecommunication infrastructure for commercial, healthcare, education, laboratory, light industrial,…",Junior Information and Communications Technology Systems Designer,Seattle, WA
429,Indeed,"Experience in data structures, algorithms, and software design. As the world’s number 1 job site, our mission is to help people get jobs.","Software Engineer, Site Reliability Engineer",Seattle, WA
430,Accenture,"You will have an opportunity to work in roles such as Data Scientist, Data Engineer, or Chief Data Officer covering all aspects of Data including Data…",Azure Data Engineer,Seattle, WA
431,Facebook,"Plan the largest server and data center capacity: Work with Product Engineering, Infrastructure Engineering, and Data Engineering teams to find the optimal way…",Performance and Capacity Engineer,Seattle, WA
432,Twitter,"Observability - a comprehensive set of diagnostic tools for Twitter engineers to troubleshoot incidents. To handle this scale, As engineers on the Observability…",Software Engineer - Storage and Observability,Seattle, WA
433,Fred Hutchinson Cancer Research Center,Providing research application of our clinical data integrated with external data sources (Amalga) on behalf of CRD’s scientific mission.,Data Analyst - Application Support Engineer II/III,Seattle, WA
434,Mindtree,"Support Engineer (Bigdata / C# / SQL). Mindtree provides services in e-commerce, mobile applications, cloud computing, digital transformation, data analytics,…",Support Engineer (Bigdata / C# / SQL),Redmond, WA
435,Arcus Data,Arcus Data is seeking an experienced Sales Engineer to join their team. Arcus Data is a high growth solutions provider that celebrates and rewards innovation.,"Presales Engineer Seattle, WA",Seattle, WA
436,TLG Aerospace,Wind tunnel and flight test data reduction. We are currently seeking experienced aircraft Flight Sciences engineers to support a variety of aerospace…,FLIGHT SCIENCES ENGINEER,Seattle, WA
437,King County Library System,"Consult in capacity planning, acquisition and support of data storage needs for core business applications, such as ADP, JDE and Evergreen, located in KCLS's…",Network and Systems Engineer,Issaquah, WA
438,"Amazon.com Services, Inc.","Specifically, the Language Engineer will: Handle competing requests from a range of data customers. Experience with language annotation and other forms of data…",Language Engineer - Alexa on FireTV,Seattle, WA
439,ABC Legal Services Inc.,"Not only can you help define and engineer specific solutions, you will help us build our team’s process for always getting better. We have an awesome team size.",Data Entry Specialist,Seattle, WA
440,Techbridge Girls,"In addition, the Development Director must be resourceful, self-motivated and proactive in working to manage donor operations, systems, data, staff, and…",Development Director,Seattle, WA
441,"GoldenWolf, LLC","Registered Architect or Professional Engineer. Develop and review documents as needed, such as answers to congressional inquiries, leadership briefings,…",Facilities Project Manager,Seattle, WA
442,Indeed,"You will work with Product Managers (PM), Data Scientists (DS), Quality Assurance (QA), and other stakeholders. ‘Find and Engage the People you’ll Hire’.",Senior Software Engineer - Resume Search,Seattle, WA
443,Oracle,"Good foundation understanding of data mining, machine learning and data sciences. We are seeking a driven, and experienced Senior Data Science with good…",Data Scientist,Seattle, WA
444,"Amazon Web Services, Inc.","Working knowledge of data retrieving and processing using SQL, ETL, data warehouse as well as Excel. Experience handling confidential data with discretion.",Partner Business Intelligence Engineer,Seattle, WA
445,Google,"Google engineers develop the next-generation technologies that change how users connect, explore, and interact with information and one another.","Technical Solutions Engineer, Stadia",Seattle, WA
446,Facebook,"Our designers, engineers, and builders are bringing the future here today through relentless innovation and advances in science and technology.","Thermal Analyst, AR",Redmond, WA
447,Blue Origin,"American Society of Quality, Certified Quality Engineer certification. Represent Blue Origin as the company’s Government-Industry Data Exchange Program (GIDEP)…",Quality Engineer- Government-Industry Data Exchange Program (GIDEP),Kent, WA
448,Infoblox,"5+ years of experience in data engineering, data science, and related data-centric fields using large-scale data environments.",Senior Data Engineer,Tacoma, WA
449,Facebook,"Knowledge of the fundamentals of computer architecture, including CPU data caching, SIMD instruction sets, and compiler code generation.","Software Engineer, Mixed Reality Experiences",Redmond, WA
450,KeyTronicEMS,"In the Test Engineer position you will conduct electrical test engineering support involving automation, assembly, maintenance, and data collection.",Test Engineer,Spokane Valley, WA
451,Microsoft,Partner with senior engineers to define and refine data center-related electrical requirements and ensure new IT infrastructure meets those standards.,Electrical Engineer,Redmond, WA
452,GenScript,"Communicates designs through standard engineering documents, technical drawings and CAD data. Hands-on mechanical engineer responsible for component and system…",Mechanical Engineer,Bothell, WA
453,Nintendo of America Inc.,"Communicate and collaborate effectively with other engineers and stakeholders. Strong working knowledge of video and audio processing including compression,…",Senior Engineer - Multimedia (NTD),Redmond, WA
454,Internap Network Services,"Assists Data Center Manager and Data Center Site Manager on projects involving the physical installation of. Cabinets, cages, cables, shelving, cable management…",Data Center Operations Engineer,Seattle, WA
455,Structured Communications,"The noise level in the data center environment is generally loud. Structured has immediate openings in Clackamas, Oregon and Bellevue, Washington for a Systems…",Systems Engineer Tier- II,Bellevue, WA
456,Velocity Consulting Solutions,"Responsibilities of the Air Systems Engineer. Requirements of the Aerospace Engineer - Air Systems. Process, analyze, and draw conclusions from post flight data…",Aerospace Engineer - Air Systems,Renton, WA
457,Jobot,Industry to integrate cloud based data collection into next generation robotics technical equipment. We are actively looking for an experienced Software…,Software Engineer - Robotics,Seattle, WA
458,REI,"Data acquisition, MatLab, Octave, LabView, FEA or similar. Test Engineers act in accordance with REI’s guiding values and mission.","Test Engineer - Fabric, Textiles (One Year Term)",Kent, WA
459,Google,"Work with large, complex data sets. Work closely with engineers to identify opportunities for, design, and assess improvements to Google products.","Data Scientist Intern, PhD, 2020",Seattle, WA
460,Kaiser Permanente,"Experience designing Data Management processes and standards for Metadata Management, Data Architecture, Data Quality, and Data Security. Yes, 5 % of the Time.",Principal Data Warehouse Engineer (Informatica Required),Renton, WA
461,Qumulo,"Data driven and have desire to work in collaborative team environments. We hire smart, adaptive engineers with diverse backgrounds and a knack for taking…",Software Development Engineer - Spring/Summer 2020 (Entry Level),Seattle, WA
462,"Amazon.com Services, Inc.","High level knowledge base of data structures, algorithms, and object oriented design, databases and service-oriented architectures. What do we expect you to do?",Software Dev Engineer I,Seattle, WA
463,FreightWeb,FreightWeb is putting together a rockstar team of engineers and data scientists in our Seattle HQ to make this disruption happen. Is great at problem solving.,Fullstack Engineer,Seattle, WA
464,Convoy,Mentoring and developing other Data Engineers and Data Analysts. Convoy’s Data Science team is looking for a talented Data Engineer with a strong background in…,Senior Data Engineer,Seattle, WA
465,Amazon Digital Services LLC,We are looking for a talented Data Engineer to join our Global Cross Channel and Cross Category (XCM) Insights team to focus on building advanced data pipelines…,Data Engineer,Seattle, WA
466,Oracle Corp,"Strong knowledge of data structures, algorithms, operating systems, and distributed. An engineer at any level can have significant technical and business impact…",Software Development Engineer,Seattle, WA
467,Samsung Electronics,Analyze test data and reports to determine if design meets functional and performance specifications. Assist in analyzing test data and reports to determine if…,Senior Quality Engineer,Bellevue, WA
468,"Yoh, A Day & Zimmermann Company","Assists in developing models, data bases and spreadsheets to analyze data (e.g., statistics, operations research, engineering economics), and provides summary…",DFKEI2-Industrial Engineer 2 - D26-Mfg Industrial Engrg,Everett, WA
469,Avalara,Work cross functionally with our Data Services and Data Science teams to architect and implement optimized data pipelines.,"Data Engineer, Sales & Marketing",Seattle, WA
470,Amcor,"Ability to work with mathematical concepts such as probability and statistics, define problems, collect data, establish facts, and draw valid conclusions.",Plant Engineer,Tumwater, WA
471,"NetMotion Wireless, Inc.","Data storage and retrieval of structured data (NoSQL), especially for scalable systems. Software Engineer, Authentication to join our Seattle team.","Sr. Software Engineer, Authentication",Seattle, WA
472,Redcley,Are you a prolific software engineer wanting to expand your skills and experience in data science? We are looking for leading engineers capable of leveraging…,Machine Learning Engineer,Redmond, WA
